Race,Division,Gender,Rank Overall,Rank Age Group,Name,Nation,Age Group,Total Time
2024 London,HYROX PRO DOUBLES - Overall,Women,55,27,"Patricia Costa, Leticia Martins",,30-34,01:18:36
2024 London,HYROX PRO DOUBLES - Overall,Women,56,12,"Shauna Coogan, Rachelle Connolly",,WU29,01:18:40
2024 London,HYROX PRO DOUBLES - Overall,Women,57,28,"Rachael Pinion, Kat Channing-Phillips",,30-34,01:18:47
2024 London,HYROX PRO DOUBLES - Overall,Women,58,13,"Sophie-Ray Cook, Nicola Roberts",,WU29,01:18:54
2024 London,HYROX PRO DOUBLES - Overall,Women,59,14,"Julie Patterson, Melissa Samms",,40-44,01:19:08
2024 London,HYROX PRO DOUBLES - Overall,Women,60,14,"Bethany Wheeler, Lydia Graham",,WU29,01:19:20
2024 London,HYROX PRO DOUBLES - Overall,Women,61,29,"Noelle Westley, Victoria Hopson",,30-34,01:20:10
2024 London,HYROX PRO DOUBLES - Overall,Women,62,30,"Samantha Miller, Kimberley Biles",,30-34,01:20:22
2024 London,HYROX PRO DOUBLES - Overall,Women,63,31,"Emma Maggott, Maddy Vaughan-Johncey Vaughan-Johncey",,30-34,01:20:31
2024 London,HYROX PRO DOUBLES - Overall,Women,64,15,"Nina Shemelides, Elli Shemelides",,WU29,01:21:00
2024 London,HYROX PRO DOUBLES - Overall,Women,65,32,"Camille Devine, Kayleigh Parker",,30-34,01:21:11
2024 London,HYROX PRO DOUBLES - Overall,Women,66,5,"Michelle Kenny, Nicky Akroyd",,50-54,01:21:14
2024 London,HYROX PRO DOUBLES - Overall,Women,67,16,"Lauren Compston, Sophie Torkington",,WU29,01:22:22
2024 London,HYROX PRO DOUBLES - Overall,Women,68,33,"Nicola O’Brien, Hayley Pepper",,30-34,01:22:24
2024 London,HYROX PRO DOUBLES - Overall,Women,69,17,"Christelle Kee, Olivia Watson",,WU29,01:22:27
2024 London,HYROX PRO DOUBLES - Overall,Women,70,18,"Kate Barrett, Mary O Donovan",,WU29,01:23:04
2024 London,HYROX PRO DOUBLES - Overall,Women,71,34,"Tia-Kate Davidson, Coralie Watson",,30-34,01:23:04
2024 London,HYROX PRO DOUBLES - Overall,Women,72,35,"Lucy Dodds, Chloe Harris",,30-34,01:23:16
2024 London,HYROX PRO DOUBLES - Overall,Women,73,15,"Sidra Malkera, Sammy Beale",,40-44,01:23:58
2024 London,HYROX PRO DOUBLES - Overall,Women,74,36,"Hayley Shayestehroo, Vicky Griffin",,30-34,01:24:01
2024 London,HYROX PRO DOUBLES - Overall,Women,75,37,"Lauren Young, Beth Davies",,30-34,01:24:05
2024 London,HYROX PRO DOUBLES - Overall,Women,76,16,"Amanda Ellis, Leanne Turvey",,40-44,01:24:26
2024 London,HYROX PRO DOUBLES - Overall,Women,77,17,"Ann Marie Mcneill, Jeanette Keenan",,40-44,01:25:16
2024 London,HYROX PRO DOUBLES - Overall,Women,78,18,"Natalie Reseigh, Holly Barton-Brown",,40-44,01:25:44
2024 London,HYROX PRO DOUBLES - Overall,Women,79,19,"Annabel Vause, Emily Naylor",,WU29,01:25:45
2024 London,HYROX PRO DOUBLES - Overall,Women,80,38,"Harriette Withers, Eleanor Gadd",,30-34,01:25:49
2024 London,HYROX PRO DOUBLES - Overall,Women,81,19,"Amy Robinson, Katherine Bowden",,40-44,01:25:49
2024 London,HYROX PRO DOUBLES - Overall,Women,82,20,"Alana Childs, Natalie Lynn",,WU29,01:26:07
2024 London,HYROX PRO DOUBLES - Overall,Women,83,39,"Laura Greenstreet, Katie Mcwilliams",,30-34,01:26:21
2024 London,HYROX PRO DOUBLES - Overall,Women,84,21,"Pria Donkin, Chloe Charter",,WU29,01:26:26
2024 London,HYROX PRO DOUBLES - Overall,Women,85,6,"Kursty Knight, Leigh-Michelle Sansom",,50-54,01:26:51
2024 London,HYROX PRO DOUBLES - Overall,Women,86,40,"Ella Bishop, Georgina Bishop",,30-34,01:27:05
2024 London,HYROX PRO DOUBLES - Overall,Women,87,41,"Hollie Muckley, Fatima Latunji Jones",,30-34,01:27:18
2024 London,HYROX PRO DOUBLES - Overall,Women,88,20,"Kiran Gibbons, Sarah Bailey",,40-44,01:27:23
2024 London,HYROX PRO DOUBLES - Overall,Women,89,42,"Sam Howell, Sara Smith",,30-34,01:27:37
2024 London,HYROX PRO DOUBLES - Overall,Women,90,43,"Emily Cooper, Laura Brawn",,30-34,01:27:39
2024 London,HYROX PRO DOUBLES - Overall,Women,91,44,"Kellie Cooke, Harriet Freeman",,30-34,01:27:46
2024 London,HYROX PRO DOUBLES - Overall,Women,92,45,"Emma Gallagher, Emma Rayworth",,30-34,01:27:55
2024 London,HYROX PRO DOUBLES - Overall,Women,93,21,"Nicola Evanson, Anita Casey",,40-44,01:28:43
2024 London,HYROX PRO DOUBLES - Overall,Women,94,22,"Hannah Wilson, Lucy Harris",,WU29,01:28:53
2024 London,HYROX PRO DOUBLES - Overall,Women,95,22,"Maxine Wood, Liza Smith",,40-44,01:30:32
2024 London,HYROX PRO DOUBLES - Overall,Women,96,46,"Jenna Hill-Wood, Lauren Packham",,30-34,01:30:45
2024 London,HYROX PRO DOUBLES - Overall,Women,97,47,"Morika Richmond, Jenni Panaki",,30-34,01:32:55
2024 London,HYROX PRO DOUBLES - Overall,Women,98,48,"Maxine Mills, Catherine Devas",,30-34,01:33:32
2024 London,HYROX PRO DOUBLES - Overall,Women,99,23,"Aimee Cooper, Nicola Forster",,40-44,01:34:50
2024 London,HYROX PRO DOUBLES - Overall,Women,100,49,"Danielle Bennett, Kimberly Perickathara",,30-34,01:34:55
2024 London,HYROX PRO DOUBLES - Overall,Women,101,50,"Sarah Woods, Jessica Allibone",,30-34,01:35:50
2024 London,HYROX PRO DOUBLES - Overall,Women,102,51,"Rebecca Walker, Charlotte Hewitt",,30-34,01:37:09
2024 London,HYROX PRO DOUBLES - Overall,Women,103,24,"Arlene Strachan, Sam Llewellyn",,40-44,01:38:27
2024 London,HYROX PRO DOUBLES - Overall,Women,104,52,"Sophie Sheridan, Rachel Christian",,30-34,01:44:24
2024 London,HYROX PRO DOUBLES - Overall,Women,105,53,"Luella Dhoore, Mia Manssen",,30-34,01:46:08
2024 London,HYROX PRO DOUBLES - Overall,Women,106,7,"Lisa Mcdonald, Jacqui Westmoreland",,50-54,01:46:38
2024 London,HYROX PRO DOUBLES - Overall,Women,107,54,"Isobel Haskell, Gemma Edwards",,30-34,01:48:22
2024 London,HYROX PRO DOUBLES - Overall,Women,108,25,"Kat Wozniak, Liz Nicolaou",,40-44,01:53:26
2024 London,HYROX PRO DOUBLES - Overall,Women,109,55,"Kirsteigh Lawton, Charlotte Barnes",,30-34,02:08:20
