Race,Division,Gender,Rank Overall,Rank Age Group,Name,Nation,Age Group,Total Time
2024 London,HYROX PRO DOUBLES - Overall,Men,1,1,"Sam Craig, Jake Williamson",,MU29,00:52:26
2024 London,HYROX PRO DOUBLES - Overall,Men,2,2,"Luke Ennis, Graham Halliday",,MU29,00:53:26
2024 London,HYROX PRO DOUBLES - Overall,Men,3,1,"Michael Murray, Joshua Rose",,30-34,00:54:39
2024 London,HYROX PRO DOUBLES - Overall,Men,4,2,"Dan Jackson, Max Pointon",,30-34,00:54:41
2024 London,HYROX PRO DOUBLES - Overall,Men,5,3,"Lewis Tanner, Aaron Docherty",,30-34,00:54:47
2024 London,HYROX PRO DOUBLES - Overall,Men,6,4,"Christopher De Souza, Matthew Green",,30-34,00:54:58
2024 London,HYROX PRO DOUBLES - Overall,Men,7,5,"Jordan Bryant, Ben Walker",,30-34,00:55:23
2024 London,HYROX PRO DOUBLES - Overall,Men,8,3,"George Kimberley, Jordan Bulpitt",,MU29,00:55:54
2024 London,HYROX PRO DOUBLES - Overall,Men,9,4,"Harry Sutherland, Oskar Kolk",,MU29,00:56:12
2024 London,HYROX PRO DOUBLES - Overall,Men,10,6,"Charlie Hendrie, Lawrence Brown",,30-34,00:56:34
2024 London,HYROX PRO DOUBLES - Overall,Men,11,5,"Jamie George, Duncan Russell",,MU29,00:56:50
2024 London,HYROX PRO DOUBLES - Overall,Men,12,1,"Paul Prothero, Tristam Murdoch",,40-44,00:57:05
2024 London,HYROX PRO DOUBLES - Overall,Men,13,7,"Xavier Schurtz, James Taylor-Medhurst",,30-34,00:57:07
2024 London,HYROX PRO DOUBLES - Overall,Men,14,8,"Ben Nockolds, Jake Pye",,30-34,00:57:13
2024 London,HYROX PRO DOUBLES - Overall,Men,15,6,"Jonathan Reaney, Fenton Hancock",,MU29,00:57:21
2024 London,HYROX PRO DOUBLES - Overall,Men,16,7,"Jake Seymour, Joseph Davies",,MU29,00:57:36
2024 London,HYROX PRO DOUBLES - Overall,Men,17,9,"Stephane Margot, Ryan Hogan",,30-34,00:57:43
2024 London,HYROX PRO DOUBLES - Overall,Men,18,10,"Morgan Penfold, Michael Channing-Phillips",,30-34,00:57:48
2024 London,HYROX PRO DOUBLES - Overall,Men,19,11,"Michael Saunders, Matt Bateson",,30-34,00:58:09
2024 London,HYROX PRO DOUBLES - Overall,Men,20,12,"Ezra Warren, Callum Stoddart",,30-34,00:58:55
2024 London,HYROX PRO DOUBLES - Overall,Men,21,8,"Conran Reynolds, Lewis Clare",,MU29,00:59:10
2024 London,HYROX PRO DOUBLES - Overall,Men,22,13,"Mark Ingham, Max Ansell-Wood",,30-34,00:59:48
2024 London,HYROX PRO DOUBLES - Overall,Men,23,14,"Martin Conlon, Paul Beattie",,30-34,00:59:54
2024 London,HYROX PRO DOUBLES - Overall,Men,24,15,"Carl Harrold, Craig Mcintosh",,30-34,01:00:12
2024 London,HYROX PRO DOUBLES - Overall,Men,25,16,"Sam Osborne, Bill Osborne",,30-34,01:00:33
2024 London,HYROX PRO DOUBLES - Overall,Men,26,17,"Lee Mclaughlin, Karan Davatwal",,30-34,01:00:36
2024 London,HYROX PRO DOUBLES - Overall,Men,27,9,"Sam Smith, Sam Wright",,MU29,01:00:45
2024 London,HYROX PRO DOUBLES - Overall,Men,28,18,"Charlie Bell, Robert Woods",,30-34,01:00:47
2024 London,HYROX PRO DOUBLES - Overall,Men,29,19,"Adam Darbyshire, Jordan Gee",,30-34,01:00:48
2024 London,HYROX PRO DOUBLES - Overall,Men,30,20,"Jack Cripps, Patrick James",,30-34,01:00:50
2024 London,HYROX PRO DOUBLES - Overall,Men,31,21,"Brandon Mcguinness, Alan Strachan",,30-34,01:00:52
2024 London,HYROX PRO DOUBLES - Overall,Men,32,22,"Kirk Grewar, Andrew Crawford",,30-34,01:00:58
2024 London,HYROX PRO DOUBLES - Overall,Men,33,23,"Mark Todd, Mikey Tranent",,30-34,01:01:06
2024 London,HYROX PRO DOUBLES - Overall,Men,34,2,"David Sloan, Gary Ackerley",,40-44,01:01:06
2024 London,HYROX PRO DOUBLES - Overall,Men,35,10,"Josh Cooper, Daniel Akinrinbola",,MU29,01:01:08
2024 London,HYROX PRO DOUBLES - Overall,Men,36,24,"Liam Hogan, Harry King",,30-34,01:01:19
2024 London,HYROX PRO DOUBLES - Overall,Men,37,25,"Paul Stannard, Jordan Hilton",,30-34,01:01:25
2024 London,HYROX PRO DOUBLES - Overall,Men,38,26,"Daniel Brook, Josh Cavey",,30-34,01:01:28
2024 London,HYROX PRO DOUBLES - Overall,Men,39,27,"Matthew Pope, Hector Macneal",,30-34,01:01:38
2024 London,HYROX PRO DOUBLES - Overall,Men,40,28,"Owen Jones, Ben Miles",,30-34,01:01:55
2024 London,HYROX PRO DOUBLES - Overall,Men,41,29,"Edward Mccormack, Phil Baker",,30-34,01:02:05
2024 London,HYROX PRO DOUBLES - Overall,Men,42,30,"Chris Cummins, Cameron Macro",,30-34,01:02:27
2024 London,HYROX PRO DOUBLES - Overall,Men,43,31,"Steffan Cairns, Connan Murray",,30-34,01:02:32
2024 London,HYROX PRO DOUBLES - Overall,Men,44,32,"Nolan Fredericks, Daniel King",,30-34,01:02:33
2024 London,HYROX PRO DOUBLES - Overall,Men,45,33,"Faisal Abdalla, Ben Chips",,30-34,01:02:33
2024 London,HYROX PRO DOUBLES - Overall,Men,46,34,"Jordon Duffy, Elliott Pashley",,30-34,01:02:38
2024 London,HYROX PRO DOUBLES - Overall,Men,47,35,"Gareth Beer, Sam Soul",,30-34,01:02:41
2024 London,HYROX PRO DOUBLES - Overall,Men,48,3,"Ian Campbell, Mark Whittle",,40-44,01:02:44
2024 London,HYROX PRO DOUBLES - Overall,Men,49,36,"Michele Zanirato, Ranald Falconer",,30-34,01:02:59
2024 London,HYROX PRO DOUBLES - Overall,Men,50,37,"Declan Bonus, Carrick Laycock",,30-34,01:03:08
2024 London,HYROX PRO DOUBLES - Overall,Men,51,11,"Jaydon Emmott, Matt Jones",,MU29,01:03:11
2024 London,HYROX PRO DOUBLES - Overall,Men,52,4,"Paul Gillingham, Greg Williams",,40-44,01:03:17
2024 London,HYROX PRO DOUBLES - Overall,Men,53,12,"Daniel Breeze, Bradley Starkey",,MU29,01:03:24
2024 London,HYROX PRO DOUBLES - Overall,Men,54,38,"Aiden Smith, Liam Salt",,30-34,01:03:30
2024 London,HYROX PRO DOUBLES - Overall,Men,55,13,"Darragh Kennedy, Mark Nicholas",,MU29,01:03:32
2024 London,HYROX PRO DOUBLES - Overall,Men,56,39,"Anthony Roderique, Prasun Gautam",,30-34,01:03:39
2024 London,HYROX PRO DOUBLES - Overall,Men,57,40,"Ross Flockhart, Luke Mccloy",,30-34,01:03:45
2024 London,HYROX PRO DOUBLES - Overall,Men,58,14,"Miguel Dias, Luke Ward",,MU29,01:04:04
2024 London,HYROX PRO DOUBLES - Overall,Men,59,41,"David Gill, John Gill",,30-34,01:04:14
2024 London,HYROX PRO DOUBLES - Overall,Men,60,42,"Sam Banner, Jamie Reid",,30-34,01:04:15
2024 London,HYROX PRO DOUBLES - Overall,Men,61,15,"Luke Thompson, Sam Harper",,MU29,01:04:29
2024 London,HYROX PRO DOUBLES - Overall,Men,62,43,"Richie Steele, George Lowe",,30-34,01:04:30
2024 London,HYROX PRO DOUBLES - Overall,Men,63,44,"Adam Daniels, Scott Colquitt",,30-34,01:04:47
2024 London,HYROX PRO DOUBLES - Overall,Men,64,16,"Ben Cedolin, Jamie Smalley",,MU29,01:04:47
2024 London,HYROX PRO DOUBLES - Overall,Men,65,45,"John Morris, Richie Thomas",,30-34,01:04:52
2024 London,HYROX PRO DOUBLES - Overall,Men,66,17,"Calum Booth, David Wallace",,MU29,01:04:52
2024 London,HYROX PRO DOUBLES - Overall,Men,67,5,"Stephen Wilding, Mark Wilding",,40-44,01:04:54
2024 London,HYROX PRO DOUBLES - Overall,Men,68,18,"Morgan Newman, Sam Grant",,MU29,01:05:01
2024 London,HYROX PRO DOUBLES - Overall,Men,69,6,"Dave Kelly, Paul Foster",,40-44,01:05:03
2024 London,HYROX PRO DOUBLES - Overall,Men,70,46,"Jack Stevens, Kevin Gardner",,30-34,01:05:03
2024 London,HYROX PRO DOUBLES - Overall,Men,71,47,"Jack Sharp, Nathan Budgett",,30-34,01:05:06
2024 London,HYROX PRO DOUBLES - Overall,Men,72,48,"Simone Tagliabue, Filippo Prussiani",,30-34,01:05:13
2024 London,HYROX PRO DOUBLES - Overall,Men,73,49,"Phil Mant, Alex Grumley",,30-34,01:05:29
2024 London,HYROX PRO DOUBLES - Overall,Men,74,50,"Tom Smith, Robert Patey",,30-34,01:05:32
2024 London,HYROX PRO DOUBLES - Overall,Men,75,51,"Zachary Orr, Caleb Hendy",,30-34,01:05:37
2024 London,HYROX PRO DOUBLES - Overall,Men,76,19,"Josh Hamilton-Cosgrave, James Count",,MU29,01:05:47
2024 London,HYROX PRO DOUBLES - Overall,Men,77,20,"Emanuel Roche, Sol Roche",,MU29,01:05:47
2024 London,HYROX PRO DOUBLES - Overall,Men,78,52,"Alex Patrick, Matt Dryden",,30-34,01:05:47
2024 London,HYROX PRO DOUBLES - Overall,Men,79,53,"Scott Hitchcock, Zbyněk Zatloukal",,30-34,01:05:49
2024 London,HYROX PRO DOUBLES - Overall,Men,80,21,"Jasper Kelly, Alex Hughes",,MU29,01:05:51
2024 London,HYROX PRO DOUBLES - Overall,Men,81,7,"Anthony Scarborough, Paul Harnett",,40-44,01:05:57
2024 London,HYROX PRO DOUBLES - Overall,Men,82,8,"Dylan Myers, James Earp",,40-44,01:06:17
2024 London,HYROX PRO DOUBLES - Overall,Men,83,9,"Rob Perry, Nick Wilson",,40-44,01:06:23
2024 London,HYROX PRO DOUBLES - Overall,Men,84,54,"Nick Mcculloch, Nic Chaviaris",,30-34,01:06:33
2024 London,HYROX PRO DOUBLES - Overall,Men,85,55,"Jamie Lazenby, Regan Lazenby",,30-34,01:06:36
2024 London,HYROX PRO DOUBLES - Overall,Men,86,22,"Mark Parrott, Alex Mcmillan",,MU29,01:07:02
2024 London,HYROX PRO DOUBLES - Overall,Men,87,23,"Connor Kerry, Benjamin Whitbourn",,MU29,01:07:05
2024 London,HYROX PRO DOUBLES - Overall,Men,88,56,"Dayne Stewart, Zak Smith",,30-34,01:07:05
2024 London,HYROX PRO DOUBLES - Overall,Men,89,57,"Mathew Sharp, Michael Jones",,30-34,01:07:27
2024 London,HYROX PRO DOUBLES - Overall,Men,90,58,"Simon Evans, Chris Evans",,30-34,01:07:28
2024 London,HYROX PRO DOUBLES - Overall,Men,91,10,"Eddie Brundle, Darren Lewis",,40-44,01:07:31
2024 London,HYROX PRO DOUBLES - Overall,Men,92,24,"Niall Harris, David Naworynsky",,MU29,01:07:38
2024 London,HYROX PRO DOUBLES - Overall,Men,93,25,"Seamus Connolly, Dylan Kenning",,MU29,01:07:39
2024 London,HYROX PRO DOUBLES - Overall,Men,94,59,"Harry Vaughan, William Cabedo",,30-34,01:07:41
2024 London,HYROX PRO DOUBLES - Overall,Men,95,26,"Mitchel Mcdermott, Brad Dixon",,MU29,01:07:45
2024 London,HYROX PRO DOUBLES - Overall,Men,96,60,"Andrew Ruston, Sam Taylor",,30-34,01:07:45
2024 London,HYROX PRO DOUBLES - Overall,Men,97,11,"Alan Daniels, Joel Havermans",,40-44,01:07:47
2024 London,HYROX PRO DOUBLES - Overall,Men,98,61,"James Ames, Lee Devlin",,30-34,01:08:15
2024 London,HYROX PRO DOUBLES - Overall,Men,99,27,"David Bloomfield, Becan Donald",,MU29,01:08:38
2024 London,HYROX PRO DOUBLES - Overall,Men,100,62,"Matthew Durham, Alan Porter",,30-34,01:08:45
2024 London,HYROX PRO DOUBLES - Overall,Men,101,12,"Gareth Henderson, Howard Wagstaff",,40-44,01:09:00
2024 London,HYROX PRO DOUBLES - Overall,Men,102,28,"Ian Jenkyn, Jonathan Chu",,MU29,01:09:00
2024 London,HYROX PRO DOUBLES - Overall,Men,103,63,"Joshua Davies, Leo Sanders",,30-34,01:09:04
2024 London,HYROX PRO DOUBLES - Overall,Men,104,13,"Dan Vallance, Stuart Starkey",,40-44,01:09:05
2024 London,HYROX PRO DOUBLES - Overall,Men,105,64,"Fraser Lawrence, Jason Clarke",,30-34,01:09:13
2024 London,HYROX PRO DOUBLES - Overall,Men,106,1,"Scott Mcmillan, Tony Mcneil",,50-54,01:09:21
2024 London,HYROX PRO DOUBLES - Overall,Men,107,65,"Robert Clarkson, Lloyd Riddell",,30-34,01:09:23
2024 London,HYROX PRO DOUBLES - Overall,Men,108,29,"Daniel Cootes, Owain Thomas",,MU29,01:09:29
2024 London,HYROX PRO DOUBLES - Overall,Men,109,30,"Elliot Page, Sam Jeyes",,MU29,01:09:32
2024 London,HYROX PRO DOUBLES - Overall,Men,110,66,"Luke Bradshaw, Brendan Macdonald",,30-34,01:09:37
2024 London,HYROX PRO DOUBLES - Overall,Men,111,67,"Tom Shaw, Peter Karaiskos",,30-34,01:09:38
2024 London,HYROX PRO DOUBLES - Overall,Men,112,68,"Perri Haines, Karim Zaghlul",,30-34,01:09:38
2024 London,HYROX PRO DOUBLES - Overall,Men,113,14,"Derek Garner, Chris Adams",,40-44,01:09:40
2024 London,HYROX PRO DOUBLES - Overall,Men,114,15,"Jack Shaylor, Steve Brackenridge",,40-44,01:09:42
2024 London,HYROX PRO DOUBLES - Overall,Men,115,16,"Sandip Thakrar, William Wells",,40-44,01:10:11
2024 London,HYROX PRO DOUBLES - Overall,Men,116,69,"Jason Thomas, Dan Boneham",,30-34,01:10:11
2024 London,HYROX PRO DOUBLES - Overall,Men,117,17,"Michael Robinson, Liam Hunn",,40-44,01:10:11
2024 London,HYROX PRO DOUBLES - Overall,Men,118,70,"Dale Howard, Kal Jhugroo",,30-34,01:10:11
2024 London,HYROX PRO DOUBLES - Overall,Men,119,31,"Jamie Piggins, Benjamin Piggins",,MU29,01:10:16
2024 London,HYROX PRO DOUBLES - Overall,Men,120,71,"Chris Doutre, Michael Lintin",,30-34,01:10:20
2024 London,HYROX PRO DOUBLES - Overall,Men,121,32,"Matt Tucker, Dan Higgs",,MU29,01:10:25
2024 London,HYROX PRO DOUBLES - Overall,Men,122,72,"Anton Micallef, Ben Harman",,30-34,01:10:25
2024 London,HYROX PRO DOUBLES - Overall,Men,123,73,"Jordan O Connor, Ryan O’Brien",,30-34,01:10:29
2024 London,HYROX PRO DOUBLES - Overall,Men,124,74,"Luke Bland, Kirk Miller",,30-34,01:10:44
2024 London,HYROX PRO DOUBLES - Overall,Men,125,33,"George Briance, Barnaby Hitchcock",,MU29,01:11:14
2024 London,HYROX PRO DOUBLES - Overall,Men,126,2,"Tim Bliss, Benvenuto Baldelli",,50-54,01:11:26
2024 London,HYROX PRO DOUBLES - Overall,Men,127,75,"Will Wolf, Atchou Tossou Edem",,30-34,01:11:29
2024 London,HYROX PRO DOUBLES - Overall,Men,128,76,"Nick Di Giampasquale, Jack Austen",,30-34,01:11:39
2024 London,HYROX PRO DOUBLES - Overall,Men,129,77,"Ian Mulcahy, Paul Josua",,30-34,01:11:40
2024 London,HYROX PRO DOUBLES - Overall,Men,130,78,"Toby Mullins, Thomas Powell",,30-34,01:11:44
2024 London,HYROX PRO DOUBLES - Overall,Men,131,18,"Lorenzo Giove, Micheal Burton",,40-44,01:12:01
2024 London,HYROX PRO DOUBLES - Overall,Men,132,79,"Nicholas Hession, Daniel Sanders",,30-34,01:12:08
2024 London,HYROX PRO DOUBLES - Overall,Men,133,80,"Padraig Mcnamara, Jack Nicholas",,30-34,01:12:08
2024 London,HYROX PRO DOUBLES - Overall,Men,134,81,"Ibraheem Khan, Mark Chivers",,30-34,01:12:10
2024 London,HYROX PRO DOUBLES - Overall,Men,135,82,"Rufus Camm, Hector Camm",,30-34,01:12:15
2024 London,HYROX PRO DOUBLES - Overall,Men,136,83,"George Playford, Tom Jones",,30-34,01:12:29
2024 London,HYROX PRO DOUBLES - Overall,Men,137,84,"Craig Donadio, Martin Mhende",,30-34,01:12:36
2024 London,HYROX PRO DOUBLES - Overall,Men,138,19,"Dave Peters, Simon Randall",,40-44,01:12:37
2024 London,HYROX PRO DOUBLES - Overall,Men,139,85,"Newman Poku, Ben Paul",,30-34,01:12:41
2024 London,HYROX PRO DOUBLES - Overall,Men,140,86,"Daniel Lee, Joshua Nino",,30-34,01:12:42
2024 London,HYROX PRO DOUBLES - Overall,Men,141,34,"James Hudson, Harvey Kirchgaesser",,MU29,01:12:59
2024 London,HYROX PRO DOUBLES - Overall,Men,142,87,"Gary Mantiri, Andreso Otto",,30-34,01:13:27
2024 London,HYROX PRO DOUBLES - Overall,Men,143,35,"Bradley Chew, Harry Chew",,MU29,01:13:36
2024 London,HYROX PRO DOUBLES - Overall,Men,144,88,"Matt Olsen, Bernard Van Erk",,30-34,01:13:41
2024 London,HYROX PRO DOUBLES - Overall,Men,145,89,"Callum Grant, Chris Harding",,30-34,01:13:44
2024 London,HYROX PRO DOUBLES - Overall,Men,146,20,"Matt Snow, Adam Clarke",,40-44,01:14:00
2024 London,HYROX PRO DOUBLES - Overall,Men,147,36,"Callum Wright, Oscar Smith",,MU29,01:14:03
2024 London,HYROX PRO DOUBLES - Overall,Men,148,21,"Daniel Moore, Ibrahim Volkan",,40-44,01:14:04
2024 London,HYROX PRO DOUBLES - Overall,Men,149,90,"Carlos Diogo Lanca Fernandes, Nuno Miguel Faria Cachada",,30-34,01:14:06
2024 London,HYROX PRO DOUBLES - Overall,Men,150,91,"Arran Aro, Aaron Edwards",,30-34,01:14:21
2024 London,HYROX PRO DOUBLES - Overall,Men,151,37,"Charlie Stanley, George Deal",,MU29,01:14:41
2024 London,HYROX PRO DOUBLES - Overall,Men,152,92,"Alfie Johnson, Shaun Frost",,30-34,01:14:42
2024 London,HYROX PRO DOUBLES - Overall,Men,153,22,"Matthew Ashra-Blundell, Jez Smelt",,40-44,01:15:00
2024 London,HYROX PRO DOUBLES - Overall,Men,154,93,"Harry Noble, Jake Allnutt",,30-34,01:15:05
2024 London,HYROX PRO DOUBLES - Overall,Men,155,94,"James Shirley-Chequer, Ashley Kitt",,30-34,01:15:05
2024 London,HYROX PRO DOUBLES - Overall,Men,156,3,"neil hodgson, Daniel Reason",,50-54,01:15:31
2024 London,HYROX PRO DOUBLES - Overall,Men,157,38,"Joe Ames, Sam Devlin",,MU29,01:15:31
2024 London,HYROX PRO DOUBLES - Overall,Men,158,39,"Lucas Roper, Ezra Roper",,MU29,01:15:36
2024 London,HYROX PRO DOUBLES - Overall,Men,159,95,"Chris Webb, Stephen Miller",,30-34,01:15:44
2024 London,HYROX PRO DOUBLES - Overall,Men,160,96,"Vinicius Gaetan, Michael Bernardeli",,30-34,01:15:47
2024 London,HYROX PRO DOUBLES - Overall,Men,161,97,"Terry Murphy, Alfie Downey",,30-34,01:16:10
2024 London,HYROX PRO DOUBLES - Overall,Men,162,98,"Nikesh Patel, Asad Husain",,30-34,01:16:15
2024 London,HYROX PRO DOUBLES - Overall,Men,163,99,"Bryan Keye, Daniel Fitzgerald",,30-34,01:16:37
2024 London,HYROX PRO DOUBLES - Overall,Men,164,100,"Alex Hooper, David Villota",,30-34,01:16:46
2024 London,HYROX PRO DOUBLES - Overall,Men,165,23,"Start Pannell, Laurence Pannell",,40-44,01:16:57
2024 London,HYROX PRO DOUBLES - Overall,Men,166,101,"Miles Micallef, Leigh Timon",,30-34,01:17:04
2024 London,HYROX PRO DOUBLES - Overall,Men,167,102,"David Webster, Milen Milushev",,30-34,01:17:11
2024 London,HYROX PRO DOUBLES - Overall,Men,168,24,"Sammy Edwards, Spencer Stent",,40-44,01:17:16
2024 London,HYROX PRO DOUBLES - Overall,Men,169,103,"Alex Tagg, Elliott Jenkins",,30-34,01:17:21
2024 London,HYROX PRO DOUBLES - Overall,Men,170,104,"David Lewis-Charlton, Chris Bell",,30-34,01:17:45
2024 London,HYROX PRO DOUBLES - Overall,Men,171,25,"James Mott, John Ballantyne",,40-44,01:18:13
2024 London,HYROX PRO DOUBLES - Overall,Men,172,4,"Niall Clifford, Glenn Smith",,50-54,01:18:21
2024 London,HYROX PRO DOUBLES - Overall,Men,173,40,"Jordan Woodcock, Ross Testa",,MU29,01:18:52
2024 London,HYROX PRO DOUBLES - Overall,Men,174,105,"Ali Wilson, Lawrence Collins",,30-34,01:19:11
2024 London,HYROX PRO DOUBLES - Overall,Men,175,26,"Julian Murrell, Dan Hopkins",,40-44,01:19:23
2024 London,HYROX PRO DOUBLES - Overall,Men,176,106,"Sam Gough, Andy Laing",,30-34,01:19:27
2024 London,HYROX PRO DOUBLES - Overall,Men,177,27,"Simon Walker, Simon Allen",,40-44,01:19:36
2024 London,HYROX PRO DOUBLES - Overall,Men,178,107,"Graham Purdy, Adam Double",,30-34,01:19:40
2024 London,HYROX PRO DOUBLES - Overall,Men,179,108,"Rob Buchanan, Marc Copperwheat",,30-34,01:19:45
2024 London,HYROX PRO DOUBLES - Overall,Men,180,109,"Matthew Edwards, Konrad Surkont",,30-34,01:20:10
2024 London,HYROX PRO DOUBLES - Overall,Men,181,110,"Adrian Drummond, Philip Ramsey",,30-34,01:20:16
2024 London,HYROX PRO DOUBLES - Overall,Men,182,28,"Gareth Auty, Rob Williams",,40-44,01:20:19
2024 London,HYROX PRO DOUBLES - Overall,Men,183,41,"Benjamin Pearson, Max Mckeown",,MU29,01:20:28
2024 London,HYROX PRO DOUBLES - Overall,Men,184,42,"Jack Webb, Jake Taylor",,MU29,01:20:48
2024 London,HYROX PRO DOUBLES - Overall,Men,185,111,"Cody Marchant, Karl Learnihan",,30-34,01:20:58
2024 London,HYROX PRO DOUBLES - Overall,Men,186,112,"Matthew Paterson, Lee Howard",,30-34,01:21:17
2024 London,HYROX PRO DOUBLES - Overall,Men,187,29,"Dean Stonestreet, Steve Williams",,40-44,01:21:35
2024 London,HYROX PRO DOUBLES - Overall,Men,188,43,"Callum Gee, Joshua Coe",,MU29,01:22:05
2024 London,HYROX PRO DOUBLES - Overall,Men,189,5,"Simon Sykes, Richard Sansom",,50-54,01:22:52
2024 London,HYROX PRO DOUBLES - Overall,Men,190,44,"Lewis Balcombe, Mick Quinn",,MU29,01:22:53
2024 London,HYROX PRO DOUBLES - Overall,Men,191,113,"David Garry, Tim Rafferty Rafferty",,30-34,01:23:07
2024 London,HYROX PRO DOUBLES - Overall,Men,192,114,"Ross Clarkson, Lee Bradshaw",,30-34,01:23:10
2024 London,HYROX PRO DOUBLES - Overall,Men,193,30,"Krzysztof Maka, Mark Lanham",,40-44,01:23:27
2024 London,HYROX PRO DOUBLES - Overall,Men,194,31,"Ells Day, Guy Player",,40-44,01:23:28
2024 London,HYROX PRO DOUBLES - Overall,Men,195,32,"Scott Harmer, Ben Thomas",,40-44,01:23:29
2024 London,HYROX PRO DOUBLES - Overall,Men,196,115,"George Lang, Max Moggridge",,30-34,01:23:30
2024 London,HYROX PRO DOUBLES - Overall,Men,197,33,"Anthony Barrett, Ian Paterson",,40-44,01:24:07
2024 London,HYROX PRO DOUBLES - Overall,Men,198,116,"Denes Tatar, Glauber Peleje Dos Santos",,30-34,01:25:31
2024 London,HYROX PRO DOUBLES - Overall,Men,199,45,"Callum Whiteside, Gus Levinson",,MU29,01:27:49
2024 London,HYROX PRO DOUBLES - Overall,Men,200,117,"Daniel Navarro, Riccardo Composto",,30-34,01:29:21
2024 London,HYROX PRO DOUBLES - Overall,Men,201,118,"Edward Hor, Edward Bates",,30-34,01:30:55
2024 London,HYROX PRO DOUBLES - Overall,Men,202,34,"Neil Mirtle, John Masterson",,40-44,01:33:03
2024 London,HYROX PRO DOUBLES - Overall,Men,203,119,"Jason Williams, C Shako",,30-34,01:33:17
2024 London,HYROX PRO DOUBLES - Overall,Men,204,120,"Harry Bown, Maciek Dunin",,30-34,01:34:07
2024 London,HYROX PRO DOUBLES - Overall,Men,205,6,"David Caldwell, Gary Rand",,50-54,01:34:10
2024 London,HYROX PRO DOUBLES - Overall,Men,206,35,"Rick Gray, Dan Taylor",,40-44,01:34:57
2024 London,HYROX PRO DOUBLES - Overall,Men,207,7,"Rob Borland, Jay Flynn",,50-54,01:36:23
2024 London,HYROX PRO DOUBLES - Overall,Men,208,36,"Robert Mildred, Richie Kiely",,40-44,01:38:01
2024 London,HYROX PRO DOUBLES - Overall,Men,209,121,"Timothy Taylor, John Prentice",,30-34,01:48:46
2024 London,HYROX PRO DOUBLES - Overall,Men,210,8,"Adrian Purvis, Steve Ashley",,50-54,01:49:45
2024 London,HYROX PRO DOUBLES - Overall,Men,211,46,"Sid Austen, David Moss",,MU29,01:50:02
2024 London,HYROX PRO DOUBLES - Overall,Men,212,37,"Dennis Morales, Chris Woodhouse",,40-44,01:59:46
2024 London,HYROX PRO DOUBLES - Overall,Women,1,1,"Margot Vandenlindenloof, Charlotte Vandenlindenloof",,WU29,00:58:18
2024 London,HYROX PRO DOUBLES - Overall,Women,2,1,"Katrina Hamilton, Melanie Carsten",,30-34,00:59:55
2024 London,HYROX PRO DOUBLES - Overall,Women,3,2,"Becky Beech, Hannah Willis",,WU29,01:00:48
2024 London,HYROX PRO DOUBLES - Overall,Women,4,2,"Nikki Brammeier, Kimberley Keay",,30-34,01:01:47
2024 London,HYROX PRO DOUBLES - Overall,Women,5,1,"Anne Marte Sneve, Inger Reidun Fleischer",,40-44,01:03:26
2024 London,HYROX PRO DOUBLES - Overall,Women,6,3,"Lucie Bourne, Charlotte Sutcliffe",,30-34,01:03:35
2024 London,HYROX PRO DOUBLES - Overall,Women,7,4,"Naomi Heffernan, Emily Heffernan",,30-34,01:04:55
2024 London,HYROX PRO DOUBLES - Overall,Women,8,5,"Emma Davis, Becky Fagg",,30-34,01:06:28
2024 London,HYROX PRO DOUBLES - Overall,Women,9,3,"Jazmin Giles-Reffell, Sophie Knox",,WU29,01:07:05
2024 London,HYROX PRO DOUBLES - Overall,Women,10,6,"Hannah Heggarty, Rachel Tedeschi",,30-34,01:07:46
2024 London,HYROX PRO DOUBLES - Overall,Women,11,7,"Fay Cunningham, Emma Petrie",,30-34,01:08:37
2024 London,HYROX PRO DOUBLES - Overall,Women,12,1,"Emily Heard, Sam Parsons",,50-54,01:09:07
2024 London,HYROX PRO DOUBLES - Overall,Women,13,4,"Charlotte Beard, Nicki Pelling",,WU29,01:09:30
2024 London,HYROX PRO DOUBLES - Overall,Women,14,2,"Catherine Bradley, Andrea Potter",,40-44,01:09:47
2024 London,HYROX PRO DOUBLES - Overall,Women,15,8,"Hayley Scullion, Naomi Fell",,30-34,01:09:51
2024 London,HYROX PRO DOUBLES - Overall,Women,16,3,"Katie Rose, Anne Wright",,40-44,01:10:13
2024 London,HYROX PRO DOUBLES - Overall,Women,17,4,"Kirsty Keating, Viktoriya Ivanova",,40-44,01:10:14
2024 London,HYROX PRO DOUBLES - Overall,Women,18,9,"Katie Hall, Marnelia Scribante",,30-34,01:10:29
2024 London,HYROX PRO DOUBLES - Overall,Women,19,10,"Natalie Pagett, Stef Zandy-Smith",,30-34,01:10:37
2024 London,HYROX PRO DOUBLES - Overall,Women,20,5,"Daisy Turner, Joanna Lewis",,WU29,01:11:53
2024 London,HYROX PRO DOUBLES - Overall,Women,21,11,"Chloe Attwal, Faye Haddon",,30-34,01:12:37
2024 London,HYROX PRO DOUBLES - Overall,Women,22,12,"Hannah Woodards, Jolene Wills",,30-34,01:12:46
2024 London,HYROX PRO DOUBLES - Overall,Women,23,6,"Daisy Self, Laura Hitt",,WU29,01:12:52
2024 London,HYROX PRO DOUBLES - Overall,Women,24,13,"Ellie English, Natalie Branston",,30-34,01:12:58
2024 London,HYROX PRO DOUBLES - Overall,Women,25,7,"Nadine Snijders Blok, Nina Wikman",,WU29,01:13:20
2024 London,HYROX PRO DOUBLES - Overall,Women,26,8,"Claire Rendall, Ellie Hunter",,WU29,01:13:39
2024 London,HYROX PRO DOUBLES - Overall,Women,27,5,"Louise Ambrose, Claire Godfrey",,40-44,01:13:44
2024 London,HYROX PRO DOUBLES - Overall,Women,28,14,"Farah Cohen, Marie Bessadi",,30-34,01:14:15
2024 London,HYROX PRO DOUBLES - Overall,Women,29,15,"Adele Tremenheere-Fox, Lucy Donovan",,30-34,01:14:18
2024 London,HYROX PRO DOUBLES - Overall,Women,30,16,"Kate Temple-Mabe, Ailsa Mckeon",,30-34,01:14:27
2024 London,HYROX PRO DOUBLES - Overall,Women,31,17,"Amy Davies, Jenny Babb",,30-34,01:14:33
2024 London,HYROX PRO DOUBLES - Overall,Women,32,18,"Leah Saux, Laura Jenkins",,30-34,01:14:34
2024 London,HYROX PRO DOUBLES - Overall,Women,33,6,"Liz Jones, Aimee Bishop",,40-44,01:14:53
2024 London,HYROX PRO DOUBLES - Overall,Women,34,7,"Madeline Phillips, Bella Jones",,40-44,01:15:19
2024 London,HYROX PRO DOUBLES - Overall,Women,35,19,"Sarah Campbell, Olga Matthews",,30-34,01:15:30
2024 London,HYROX PRO DOUBLES - Overall,Women,36,20,"Samantha Graham, Sarah Delieu",,30-34,01:15:50
2024 London,HYROX PRO DOUBLES - Overall,Women,37,21,"Lily Pearmain, Helen Moore",,30-34,01:15:51
2024 London,HYROX PRO DOUBLES - Overall,Women,38,8,"Hannah Cole, Lyndsay Copeland",,40-44,01:15:57
2024 London,HYROX PRO DOUBLES - Overall,Women,39,9,"Emma Hibbs, Fran Rickatson",,40-44,01:16:06
2024 London,HYROX PRO DOUBLES - Overall,Women,40,9,"Aoife Martinson, Lorraine Conwell",,WU29,01:16:18
2024 London,HYROX PRO DOUBLES - Overall,Women,41,22,"Elena Thawrani, Stephanie Hand",,30-34,01:16:20
2024 London,HYROX PRO DOUBLES - Overall,Women,42,23,"Rebeka Derry, Mary Oyewale",,30-34,01:16:24
2024 London,HYROX PRO DOUBLES - Overall,Women,43,24,"Katie Flatters-Cliffe, Charlotte Ford",,30-34,01:16:43
2024 London,HYROX PRO DOUBLES - Overall,Women,44,25,"Caroline Goode, Viktoria Cechova",,30-34,01:16:59
2024 London,HYROX PRO DOUBLES - Overall,Women,45,2,"Sally Collins, Colette Keoghan",,50-54,01:17:02
2024 London,HYROX PRO DOUBLES - Overall,Women,46,10,"Denise Brazier, Leah Smith",,40-44,01:17:09
2024 London,HYROX PRO DOUBLES - Overall,Women,47,3,"Ceri Cave, Christabel Boersma",,50-54,01:17:24
2024 London,HYROX PRO DOUBLES - Overall,Women,48,26,"Ela Jones, Lowri Hughes",,30-34,01:17:38
2024 London,HYROX PRO DOUBLES - Overall,Women,49,11,"Lisa De'Ath, Kate Noble",,40-44,01:17:39
2024 London,HYROX PRO DOUBLES - Overall,Women,50,10,"Jasmine Kenny, Maddy Sketchley",,WU29,01:17:51
2024 London,HYROX PRO DOUBLES - Overall,Women,51,12,"Sarah Greer, Anna Toothill",,40-44,01:17:59
2024 London,HYROX PRO DOUBLES - Overall,Women,52,13,"Karen Scott, Emma Phillips",,40-44,01:18:12
2024 London,HYROX PRO DOUBLES - Overall,Women,53,4,"Lainey Hunter, Kimberley Parsonson-Smith",,50-54,01:18:22
2024 London,HYROX PRO DOUBLES - Overall,Women,54,11,"Hannah Spencer, Kara Lawrenson",,WU29,01:18:29
