Race,Division,Gender,Rank Overall,Rank Age Group,Name,Nation,Age Group,Total Time
2025 New York,HYROX PRO DOUBLES - Overall,Men,1,1,"Jake Williamson, Jake Dearden",,MU29,00:50:06
2025 New York,HYROX PRO DOUBLES - Overall,Men,2,1,"Quentin Nantois, Alan Cao",,30-34,00:52:57
2025 New York,HYROX PRO DOUBLES - Overall,Men,3,2,"Jason Loebig, Bret Gornik",,30-34,00:54:11
2025 New York,HYROX PRO DOUBLES - Overall,Men,4,1,"Peter Edgar, Beau Meredith",,40-44,00:55:12
2025 New York,HYROX PRO DOUBLES - Overall,Men,5,3,"Kenneth Stapon, Maximilian Robinson",,30-34,00:55:35
2025 New York,HYROX PRO DOUBLES - Overall,Men,6,4,"Gus Manke, Jimmy DeCicco",,30-34,00:55:41
2025 New York,HYROX PRO DOUBLES - Overall,Men,7,5,"Jack Draper, Sam Booth",,30-34,00:55:43
2025 New York,HYROX PRO DOUBLES - Overall,Men,8,6,"William Allen, Jared Mclafferty",,30-34,00:55:50
2025 New York,HYROX PRO DOUBLES - Overall,Men,9,2,"Steve Hoather, Adam DivFulvio",,40-44,00:56:14
2025 New York,HYROX PRO DOUBLES - Overall,Men,10,7,"Andrew Kelley, Keith Hardwick",,30-34,00:56:17
2025 New York,HYROX PRO DOUBLES - Overall,Men,11,8,"Samuel Hebert, Christopher Mercier-Bonneau",,30-34,00:57:12
2025 New York,HYROX PRO DOUBLES - Overall,Men,12,2,"Arthur Gioulekas, David Andrew",,MU29,00:57:28
2025 New York,HYROX PRO DOUBLES - Overall,Men,13,9,"Chase Stewart, Sean Conerty",,30-34,00:57:38
2025 New York,HYROX PRO DOUBLES - Overall,Men,14,10,"JC Clough, Akio Ohtake-Gordon",,30-34,00:58:37
2025 New York,HYROX PRO DOUBLES - Overall,Men,15,3,"Billy Bernitt, Brandon Caldwell",,MU29,00:58:38
2025 New York,HYROX PRO DOUBLES - Overall,Men,16,4,"Fran Kilinski, Matthew Procopio",,MU29,00:59:21
2025 New York,HYROX PRO DOUBLES - Overall,Men,17,5,"Samuel Hammers, Chad Dawgiello",,MU29,00:59:25
2025 New York,HYROX PRO DOUBLES - Overall,Men,18,6,"Jake Kastroll, Garrett Head",,MU29,01:00:26
2025 New York,HYROX PRO DOUBLES - Overall,Men,19,11,"Jared Silverman, Danny Johnson",,30-34,01:00:31
2025 New York,HYROX PRO DOUBLES - Overall,Men,20,12,"Anthony Pelkey, Jordan Becker",,30-34,01:00:32
2025 New York,HYROX PRO DOUBLES - Overall,Men,21,7,"Alex Sroka, Chase Finley",,MU29,01:00:51
2025 New York,HYROX PRO DOUBLES - Overall,Men,22,13,"Kyle Vis, Matt Tralli",,30-34,01:01:05
2025 New York,HYROX PRO DOUBLES - Overall,Men,23,14,"Henrik Decker, Ross Duhon",,30-34,01:01:16
2025 New York,HYROX PRO DOUBLES - Overall,Men,24,8,"Nyme Manns, Jalen Racine",,MU29,01:01:20
2025 New York,HYROX PRO DOUBLES - Overall,Men,25,9,"James Elway, Robert O’Gorman",,MU29,01:01:41
2025 New York,HYROX PRO DOUBLES - Overall,Men,26,15,"Brandon DelBianco, Trey Etseyatse",,30-34,01:01:44
2025 New York,HYROX PRO DOUBLES - Overall,Men,27,16,"Fernando Gomez Diaz, Mario Enrique Martinez Ornelas",,30-34,01:01:46
2025 New York,HYROX PRO DOUBLES - Overall,Men,28,10,"Joseph Block, Jack Hartigan",,MU29,01:01:51
2025 New York,HYROX PRO DOUBLES - Overall,Men,29,17,"Talon Smith, Zachary Cain",,30-34,01:02:00
2025 New York,HYROX PRO DOUBLES - Overall,Men,30,18,"Scotty Forrester, Paul Marshall",,30-34,01:02:06
2025 New York,HYROX PRO DOUBLES - Overall,Men,31,19,"William Leroy, Sébastien Boilard",,30-34,01:02:09
2025 New York,HYROX PRO DOUBLES - Overall,Men,32,11,"Bradley Seeber, Nick Walker",,MU29,01:02:21
2025 New York,HYROX PRO DOUBLES - Overall,Men,33,12,"Cooper George, Richard Koenke",,MU29,01:02:30
2025 New York,HYROX PRO DOUBLES - Overall,Men,34,20,"Tom Elford, Stewart Cherry",,30-34,01:02:48
2025 New York,HYROX PRO DOUBLES - Overall,Men,35,21,"Thomas Jaeger, Tyler McDonough",,30-34,01:03:22
2025 New York,HYROX PRO DOUBLES - Overall,Men,36,22,"Austin Spencer, Josh Vales",,30-34,01:03:30
2025 New York,HYROX PRO DOUBLES - Overall,Men,37,23,"Kyle Bouhana, Trevor Emig",,30-34,01:03:39
2025 New York,HYROX PRO DOUBLES - Overall,Men,38,24,"Paul Sakowski, Brandon Whittington",,30-34,01:03:41
2025 New York,HYROX PRO DOUBLES - Overall,Men,39,25,"Daniel Guzman, Shane Foley",,30-34,01:03:44
2025 New York,HYROX PRO DOUBLES - Overall,Men,40,26,"Marc Bowron, Rokas Navickas",,30-34,01:03:46
2025 New York,HYROX PRO DOUBLES - Overall,Men,41,27,"Dan Kain, Remillino Ella",,30-34,01:03:57
2025 New York,HYROX PRO DOUBLES - Overall,Men,42,28,"Cody Mooney, Alec Smith",,30-34,01:04:04
2025 New York,HYROX PRO DOUBLES - Overall,Men,43,29,"Jonathan Holman, Trenton Kennedy",,30-34,01:04:24
2025 New York,HYROX PRO DOUBLES - Overall,Men,44,13,"Fabian Acuna, Jorge Olivares",,MU29,01:04:25
2025 New York,HYROX PRO DOUBLES - Overall,Men,45,30,"James Arcieri, Bill Murphy",,30-34,01:04:28
2025 New York,HYROX PRO DOUBLES - Overall,Men,46,14,"Chad Friedberg, Jared Friedberg",,MU29,01:04:36
2025 New York,HYROX PRO DOUBLES - Overall,Men,47,15,"Kristijan Gjorgjevik, Trey Fowler",,MU29,01:04:43
2025 New York,HYROX PRO DOUBLES - Overall,Men,48,31,"Flavio Rogantini, Francis Robidoux",,30-34,01:04:43
2025 New York,HYROX PRO DOUBLES - Overall,Men,49,16,"Daniel Wolf, Thomas Sargeant",,MU29,01:05:25
2025 New York,HYROX PRO DOUBLES - Overall,Men,50,32,"Alexander Frost, Malik Grove",,30-34,01:05:31
2025 New York,HYROX PRO DOUBLES - Overall,Men,51,33,"Kevin Barby, Michael Marchese",,30-34,01:05:38
2025 New York,HYROX PRO DOUBLES - Overall,Men,52,34,"Angel Navarro, Kevin Johnk",,30-34,01:05:58
2025 New York,HYROX PRO DOUBLES - Overall,Men,53,3,"Joe Miele, Collin Martin",,40-44,01:06:10
2025 New York,HYROX PRO DOUBLES - Overall,Men,54,35,"David Anderson, Kyle Windebank",,30-34,01:06:16
2025 New York,HYROX PRO DOUBLES - Overall,Men,55,4,"Marco Talamantez, Christopher Enfinger",,40-44,01:06:35
2025 New York,HYROX PRO DOUBLES - Overall,Men,56,36,"Steven LePorin, David Chan",,30-34,01:06:37
2025 New York,HYROX PRO DOUBLES - Overall,Men,57,37,"Doug Litvack, Razonte Dunn",,30-34,01:06:41
2025 New York,HYROX PRO DOUBLES - Overall,Men,58,38,"CJ Finley, Peter Sportello",,30-34,01:06:42
2025 New York,HYROX PRO DOUBLES - Overall,Men,59,39,"Pete Kinsella, Dave Martinsky",,30-34,01:06:43
2025 New York,HYROX PRO DOUBLES - Overall,Men,60,40,"Kyryl Reptushenko, David Fano",,30-34,01:07:00
2025 New York,HYROX PRO DOUBLES - Overall,Men,61,17,"Matthew Malmrose, Zachary Jarvis",,MU29,01:07:00
2025 New York,HYROX PRO DOUBLES - Overall,Men,62,18,"Jordan Bandera, Gage Clark",,MU29,01:07:08
2025 New York,HYROX PRO DOUBLES - Overall,Men,63,19,"Alex Grignon, Jurgen Bach",,MU29,01:07:18
2025 New York,HYROX PRO DOUBLES - Overall,Men,64,41,"James-Tyler Dodge, Angelo Accattato",,30-34,01:07:31
2025 New York,HYROX PRO DOUBLES - Overall,Men,65,42,"Andrew J Fenton IV, Joe Szalay",,30-34,01:07:32
2025 New York,HYROX PRO DOUBLES - Overall,Men,66,20,"Nick Lucignano, Pablo Arraut",,MU29,01:07:54
2025 New York,HYROX PRO DOUBLES - Overall,Men,67,5,"John Rubsam, Robert Olson",,40-44,01:07:55
2025 New York,HYROX PRO DOUBLES - Overall,Men,68,21,"Darren Battista, Charles Clay",,MU29,01:08:01
2025 New York,HYROX PRO DOUBLES - Overall,Men,69,43,"Paul Herskovitz, Benedict Dohmen",,30-34,01:08:10
2025 New York,HYROX PRO DOUBLES - Overall,Men,70,22,"Neel Doshi, Connor McQueeney",,MU29,01:08:14
2025 New York,HYROX PRO DOUBLES - Overall,Men,71,23,"Matthew Garcia, Fernando Aguilar",,MU29,01:08:26
2025 New York,HYROX PRO DOUBLES - Overall,Men,72,24,"David Benson, Pete Marchineck",,MU29,01:08:36
2025 New York,HYROX PRO DOUBLES - Overall,Men,73,44,"Michael Fuertes, Corey Berger",,30-34,01:08:46
2025 New York,HYROX PRO DOUBLES - Overall,Men,74,45,"John Malaya, Nick O'Bumsawin",,30-34,01:08:56
2025 New York,HYROX PRO DOUBLES - Overall,Men,75,1,"Juan Berdejo, Kirt Warrack",,50-54,01:09:02
2025 New York,HYROX PRO DOUBLES - Overall,Men,76,25,"Aidan Kranz, Ashley Stephen",,MU29,01:09:03
2025 New York,HYROX PRO DOUBLES - Overall,Men,77,46,"José Enrique Linares Meza, Francisco Javier Camarena Paz",,30-34,01:09:17
2025 New York,HYROX PRO DOUBLES - Overall,Men,78,6,"Declan Coyne, Matt Hester",,40-44,01:09:17
2025 New York,HYROX PRO DOUBLES - Overall,Men,79,47,"Sean Smith, Timothy Frost",,30-34,01:09:21
2025 New York,HYROX PRO DOUBLES - Overall,Men,80,48,"Sean Kelly, Austin Buhl",,30-34,01:09:24
2025 New York,HYROX PRO DOUBLES - Overall,Men,81,49,"Salvador Perezchica Esparza, Ernie Cheatham",,30-34,01:09:26
2025 New York,HYROX PRO DOUBLES - Overall,Men,82,50,"Richard Hawker, Nick Barbas",,30-34,01:09:27
2025 New York,HYROX PRO DOUBLES - Overall,Men,83,51,"Ross Pereira, Carson Hunsaker",,30-34,01:09:57
2025 New York,HYROX PRO DOUBLES - Overall,Men,84,52,"Baraa Elalami, Mohamed Benkirane",,30-34,01:10:03
2025 New York,HYROX PRO DOUBLES - Overall,Men,85,53,"Kevin Clancy, Michael Clancy",,30-34,01:10:04
2025 New York,HYROX PRO DOUBLES - Overall,Men,86,54,"Diogo Dias, Tony Dominguez",,30-34,01:10:13
2025 New York,HYROX PRO DOUBLES - Overall,Men,87,55,"Vasilios Grigorakos, Kostantino Athanassulas",,30-34,01:10:13
2025 New York,HYROX PRO DOUBLES - Overall,Men,88,56,"Matt Wiest, Josh Herrington",,30-34,01:10:22
2025 New York,HYROX PRO DOUBLES - Overall,Men,89,57,"Emeka Ononye, Chuka Ononye",,30-34,01:10:26
2025 New York,HYROX PRO DOUBLES - Overall,Men,90,26,"Andrew Holmes, Ryan Hayes",,MU29,01:10:44
2025 New York,HYROX PRO DOUBLES - Overall,Men,91,27,"Tyler Yorke, Lucas McCulloch",,MU29,01:10:52
2025 New York,HYROX PRO DOUBLES - Overall,Men,92,58,"Alan Cohen, Juan Comito",,30-34,01:11:14
2025 New York,HYROX PRO DOUBLES - Overall,Men,93,59,"Sean Devir, Bryan Arsi",,30-34,01:11:21
2025 New York,HYROX PRO DOUBLES - Overall,Men,94,60,"Leonard Markert, Ryan McCann",,30-34,01:11:25
2025 New York,HYROX PRO DOUBLES - Overall,Men,95,61,"Jeremy Lawless, Ryan Lawless",,30-34,01:11:32
2025 New York,HYROX PRO DOUBLES - Overall,Men,96,28,"Andrew Carlyle, Brook Biniam",,MU29,01:11:32
2025 New York,HYROX PRO DOUBLES - Overall,Men,97,29,"Dominic Devito, Thomas Linaris",,MU29,01:11:39
2025 New York,HYROX PRO DOUBLES - Overall,Men,98,7,"Anthony Viccora, Ryan Vander Wielen",,40-44,01:11:51
2025 New York,HYROX PRO DOUBLES - Overall,Men,99,62,"Enrique Moctezuma, Cory Hunt",,30-34,01:11:53
2025 New York,HYROX PRO DOUBLES - Overall,Men,100,63,"Paul Brooks, Sean Calhoun",,30-34,01:12:21
2025 New York,HYROX PRO DOUBLES - Overall,Men,101,64,"Frankie Tassielli, John Messina",,30-34,01:12:29
2025 New York,HYROX PRO DOUBLES - Overall,Men,102,65,"Jon Shanahan, Patrick Miller",,30-34,01:12:30
2025 New York,HYROX PRO DOUBLES - Overall,Men,103,2,"Patrick Murphy, Kieran O'Brien",,50-54,01:12:47
2025 New York,HYROX PRO DOUBLES - Overall,Men,104,30,"Colin Powell, Brian Sieber",,MU29,01:12:57
2025 New York,HYROX PRO DOUBLES - Overall,Men,105,66,"Andrew Beane, Jeremy Cypher",,30-34,01:12:58
2025 New York,HYROX PRO DOUBLES - Overall,Men,106,31,"Marco Aurelien, Ray Walker",,MU29,01:12:59
2025 New York,HYROX PRO DOUBLES - Overall,Men,107,32,"Charles Samuel, Brad Barren",,MU29,01:13:07
2025 New York,HYROX PRO DOUBLES - Overall,Men,108,8,"Domenick Camporeale, Jay Wein",,40-44,01:13:25
2025 New York,HYROX PRO DOUBLES - Overall,Men,109,9,"Gus Manke, Eric Manke",,40-44,01:13:42
2025 New York,HYROX PRO DOUBLES - Overall,Men,110,67,"Nick Lynch, Mike Kovar",,30-34,01:13:47
2025 New York,HYROX PRO DOUBLES - Overall,Men,111,10,"TIM SNEE, +MICHAEL DELUKA+",,40-44,01:13:48
2025 New York,HYROX PRO DOUBLES - Overall,Men,112,33,"Grant Holbrook, Charles DeGasperis",,MU29,01:13:51
2025 New York,HYROX PRO DOUBLES - Overall,Men,113,68,"Austin Hechler, Bryan Parker",,30-34,01:14:00
2025 New York,HYROX PRO DOUBLES - Overall,Men,114,69,"Kevin Goh, Michael Vonfrolio",,30-34,01:14:13
2025 New York,HYROX PRO DOUBLES - Overall,Men,115,70,"Todd Miller, Andrew Miller",,30-34,01:14:24
2025 New York,HYROX PRO DOUBLES - Overall,Men,116,11,"Scott Katzenstein, Earl Han",,40-44,01:14:27
2025 New York,HYROX PRO DOUBLES - Overall,Men,117,34,"Victor Marzano, Anthony O’Donnell",,MU29,01:14:32
2025 New York,HYROX PRO DOUBLES - Overall,Men,118,71,"Roy Mitchell, Emerson Tuttle",,30-34,01:15:05
2025 New York,HYROX PRO DOUBLES - Overall,Men,119,72,"Kevin Riva, Benjamin Loup",,30-34,01:15:27
2025 New York,HYROX PRO DOUBLES - Overall,Men,120,12,"Michael Smith, Craig DeCollibus",,40-44,01:15:34
2025 New York,HYROX PRO DOUBLES - Overall,Men,121,73,"Will Dunleavy, Anthony Surico",,30-34,01:15:44
2025 New York,HYROX PRO DOUBLES - Overall,Men,122,35,"Nicholas Sclafani, Xander Rivera",,MU29,01:15:47
2025 New York,HYROX PRO DOUBLES - Overall,Men,123,36,"Matt Purdy, Brian Crowe",,MU29,01:16:13
2025 New York,HYROX PRO DOUBLES - Overall,Men,124,37,"Kyle Wollman, Brennan Quigley",,MU29,01:16:18
2025 New York,HYROX PRO DOUBLES - Overall,Men,125,38,"Alexander McKenna, John McKenna",,MU29,01:16:19
2025 New York,HYROX PRO DOUBLES - Overall,Men,126,13,"Alejandro Franco, Gustavo Araujo",,40-44,01:16:22
2025 New York,HYROX PRO DOUBLES - Overall,Men,127,74,"Mike Ramirez, Brandon Manley",,30-34,01:16:23
2025 New York,HYROX PRO DOUBLES - Overall,Men,128,75,"Corey Friesen, Nicolas Fredrickson",,30-34,01:16:54
2025 New York,HYROX PRO DOUBLES - Overall,Men,129,76,"Carl Meixsell, Bradley Meixsell",,30-34,01:16:56
2025 New York,HYROX PRO DOUBLES - Overall,Men,130,77,"Logan Schecter, Dillon Fletcher",,30-34,01:16:57
2025 New York,HYROX PRO DOUBLES - Overall,Men,131,78,"Craig Casterella, Anthony Spadaro",,30-34,01:17:05
2025 New York,HYROX PRO DOUBLES - Overall,Men,132,39,"Jeremy Tramontano, John Schlank",,MU29,01:17:08
2025 New York,HYROX PRO DOUBLES - Overall,Men,133,79,"Andres Moreno, Fady Issa",,30-34,01:17:20
2025 New York,HYROX PRO DOUBLES - Overall,Men,134,80,"Mike Karcz, Jonathan Gonzalez",,30-34,01:17:25
2025 New York,HYROX PRO DOUBLES - Overall,Men,135,40,"Nick Picard, Jean-Benoit Girard",,MU29,01:17:38
2025 New York,HYROX PRO DOUBLES - Overall,Men,136,81,"Joseph Flynn, Jake O'Riordan",,30-34,01:17:41
2025 New York,HYROX PRO DOUBLES - Overall,Men,137,41,"philip wolf, Kareem Moumina",,MU29,01:17:42
2025 New York,HYROX PRO DOUBLES - Overall,Men,138,82,"Marc Seah, Eric Hu",,30-34,01:17:53
2025 New York,HYROX PRO DOUBLES - Overall,Men,139,42,"David Rojas, Michael Marini",,MU29,01:17:54
2025 New York,HYROX PRO DOUBLES - Overall,Men,140,43,"Juan Pablo Ospina gallego, Marcelo Layes Romero",,MU29,01:18:00
2025 New York,HYROX PRO DOUBLES - Overall,Men,141,14,"Jonathan Valentine, Shawn Alexis",,40-44,01:18:05
2025 New York,HYROX PRO DOUBLES - Overall,Men,142,44,"Mason Fliegel, Jeremy Miller",,MU29,01:18:18
2025 New York,HYROX PRO DOUBLES - Overall,Men,143,83,"Chad E. Malloy, Jose Lora",,30-34,01:18:32
2025 New York,HYROX PRO DOUBLES - Overall,Men,144,15,"Rudy Aoun, Ulises Pallares",,40-44,01:18:50
2025 New York,HYROX PRO DOUBLES - Overall,Men,145,84,"Arthur Mona, Kevin Weissheier",,30-34,01:18:51
2025 New York,HYROX PRO DOUBLES - Overall,Men,146,45,"Matt Harrison, Ben Harrison",,MU29,01:18:58
2025 New York,HYROX PRO DOUBLES - Overall,Men,147,85,"Abraham Calle, Marco Vargas",,30-34,01:19:09
2025 New York,HYROX PRO DOUBLES - Overall,Men,148,16,"Kem Ali, Ioan Homone",,40-44,01:19:16
2025 New York,HYROX PRO DOUBLES - Overall,Men,149,46,"Christopher Howell, Jordan Plantinga",,MU29,01:19:17
2025 New York,HYROX PRO DOUBLES - Overall,Men,150,86,"Thiago Costa, Eduardo Marroffino",,30-34,01:20:03
2025 New York,HYROX PRO DOUBLES - Overall,Men,151,87,"Travis Dubose, Terry Williams",,30-34,01:20:07
2025 New York,HYROX PRO DOUBLES - Overall,Men,152,17,"William Dorton, Greg Van Horn",,40-44,01:20:18
2025 New York,HYROX PRO DOUBLES - Overall,Men,153,88,"Norbert Kuter, Jaris Rousseau",,30-34,01:20:31
2025 New York,HYROX PRO DOUBLES - Overall,Men,154,47,"Joseph Rombalski, Stephen Okala",,MU29,01:21:02
2025 New York,HYROX PRO DOUBLES - Overall,Men,155,48,"Kieran Furse, Ryan Green",,MU29,01:21:27
2025 New York,HYROX PRO DOUBLES - Overall,Men,156,18,"Carlos Franco, Victor Machado",,40-44,01:21:54
2025 New York,HYROX PRO DOUBLES - Overall,Men,157,89,"Sun Hwy Kim, June Kim",,30-34,01:22:05
2025 New York,HYROX PRO DOUBLES - Overall,Men,158,3,"Christian Toetzke, Thomas Arndt",,50-54,01:22:09
2025 New York,HYROX PRO DOUBLES - Overall,Men,159,49,"Chris McDowell, Ryan Riviere",,MU29,01:22:49
2025 New York,HYROX PRO DOUBLES - Overall,Men,160,90,"Ryan Brewster, Mike Montagnino",,30-34,01:22:53
2025 New York,HYROX PRO DOUBLES - Overall,Men,161,50,"Jonathan Afanador, Aaron Castillo",,MU29,01:23:07
2025 New York,HYROX PRO DOUBLES - Overall,Men,162,91,"Alex Kuritzky, Joseph Pasqualini",,30-34,01:23:08
2025 New York,HYROX PRO DOUBLES - Overall,Men,163,51,"Matthew Leong, Matthew Pesco",,MU29,01:23:22
2025 New York,HYROX PRO DOUBLES - Overall,Men,164,52,"Chip Broderick, Connor Griffin",,MU29,01:23:30
2025 New York,HYROX PRO DOUBLES - Overall,Men,165,92,"Jordi Gonzalez, Martin Carmona",,30-34,01:24:18
2025 New York,HYROX PRO DOUBLES - Overall,Men,166,53,"Zach Morrison, Anthony Armano",,MU29,01:24:19
2025 New York,HYROX PRO DOUBLES - Overall,Men,167,93,"Matt Calabretta, Gabriel Pagan",,30-34,01:24:23
2025 New York,HYROX PRO DOUBLES - Overall,Men,168,54,"Osiris Shepherd, Tyler Brown",,MU29,01:24:36
2025 New York,HYROX PRO DOUBLES - Overall,Men,169,94,"Casey Grimes, Erik Guttersen",,30-34,01:25:16
2025 New York,HYROX PRO DOUBLES - Overall,Men,170,95,"Adrian Fernandez, Harrison Fernandez",,30-34,01:25:19
2025 New York,HYROX PRO DOUBLES - Overall,Men,171,96,"Timothy O'Shea, Mike Stansfield",,30-34,01:25:25
2025 New York,HYROX PRO DOUBLES - Overall,Men,172,97,"Jeremy Garcia, Jose Soto",,30-34,01:25:43
2025 New York,HYROX PRO DOUBLES - Overall,Men,173,55,"Tin Lazar, Angello Lazar",,MU29,01:26:09
2025 New York,HYROX PRO DOUBLES - Overall,Men,174,98,"Domingo V Sosa, Remington Castillo",,30-34,01:26:20
2025 New York,HYROX PRO DOUBLES - Overall,Men,175,19,"Anthony Gonzalez, Jovaniel Cordova",,40-44,01:27:56
2025 New York,HYROX PRO DOUBLES - Overall,Men,176,56,"Matt Moody, Dylan Nguyen",,MU29,01:28:00
2025 New York,HYROX PRO DOUBLES - Overall,Men,177,57,"Shannon Stephen, Shaqi Sulaiman",,MU29,01:28:30
2025 New York,HYROX PRO DOUBLES - Overall,Men,178,99,"Philip Zetterstrom, Ryan Sicard",,30-34,01:29:17
2025 New York,HYROX PRO DOUBLES - Overall,Men,179,58,"Simon Ridley, Franklyn Garcia",,MU29,01:29:23
2025 New York,HYROX PRO DOUBLES - Overall,Men,180,100,"Gustavo Monrroy, Dennis Grishin",,30-34,01:29:50
2025 New York,HYROX PRO DOUBLES - Overall,Men,181,4,"Rafael Diaz, Matthew Shelton",,50-54,01:29:58
2025 New York,HYROX PRO DOUBLES - Overall,Men,182,101,"Christian Andrews, Giuseppe Vilson",,30-34,01:30:19
2025 New York,HYROX PRO DOUBLES - Overall,Men,183,102,"Raphael Hassan, Albert Osei",,30-34,01:30:36
2025 New York,HYROX PRO DOUBLES - Overall,Men,184,103,"Jack Huntsman, Joshua Huntsman",,30-34,01:31:10
2025 New York,HYROX PRO DOUBLES - Overall,Men,185,20,"Florian Yamin, Vincent Rossi",,40-44,01:33:27
2025 New York,HYROX PRO DOUBLES - Overall,Men,186,104,"Kaolayao Pritchet, Joshua de Lara",,30-34,01:33:38
2025 New York,HYROX PRO DOUBLES - Overall,Men,187,59,"Ryan Rizzo, Jacob Lewinson",,MU29,01:35:23
2025 New York,HYROX PRO DOUBLES - Overall,Men,188,105,"Clifton Gabriel, Jordan Anderson",,30-34,01:35:39
2025 New York,HYROX PRO DOUBLES - Overall,Men,189,21,"Reggie Person, Nicholas Theusch",,40-44,01:36:21
2025 New York,HYROX PRO DOUBLES - Overall,Men,190,106,"Kevin Ryan, Vince Roush",,30-34,01:36:33
2025 New York,HYROX PRO DOUBLES - Overall,Men,191,107,"Xavier Baez, Jorge Luis Rodriguez",,30-34,01:37:31
2025 New York,HYROX PRO DOUBLES - Overall,Men,192,60,"Bobby Boyd, Charles Seislove",,MU29,01:39:30
2025 New York,HYROX PRO DOUBLES - Overall,Men,193,108,"Sean Singh, Edward Rosales",,30-34,01:40:14
2025 New York,HYROX PRO DOUBLES - Overall,Men,194,61,"Max Weng, Dennis Zhen",,MU29,01:42:20
2025 New York,HYROX PRO DOUBLES - Overall,Men,195,5,"Adrian Purvis, Mark Heyburn",,50-54,01:44:03
2025 New York,HYROX PRO DOUBLES - Overall,Men,196,109,"Joshua Calderon, Jorge Echevarria",,30-34,01:45:11
2025 New York,HYROX PRO DOUBLES - Overall,Men,197,62,"Venkat Shashank Vege, Revan Reddy Aleti",,MU29,01:46:51
2025 New York,HYROX PRO DOUBLES - Overall,Men,198,110,"Manny Langella, Anthony Giaimo",,30-34,01:52:00
2025 New York,HYROX PRO DOUBLES - Overall,Men,199,111,"Rinzin Thapa Magar, Talal Kirmani",,30-34,01:53:09
2025 New York,HYROX PRO DOUBLES - Overall,Men,200,112,"Sahan Pitigala, Steve Reyes",,30-34,01:56:28
2025 New York,HYROX PRO DOUBLES - Overall,Men,201,113,"Tyler Petty, Diya Sarsour",,30-34,01:59:56
2025 New York,HYROX PRO DOUBLES - Overall,Men,202,114,"Joseph Phiri, Brian Watt",,30-34,02:11:19
2025 New York,HYROX PRO DOUBLES - Overall,Women,1,1,"Gabriela Toledo, Bianca Toledo",,WU29,01:02:49
2025 New York,HYROX PRO DOUBLES - Overall,Women,2,2,"Dominique Sottile, Riley Rochon",,WU29,01:03:10
2025 New York,HYROX PRO DOUBLES - Overall,Women,3,1,"Taylor Nyquist, Meghan Lindsey",,30-34,01:03:29
2025 New York,HYROX PRO DOUBLES - Overall,Women,4,3,"Morgan Davis, Valerie Ladue",,WU29,01:04:42
2025 New York,HYROX PRO DOUBLES - Overall,Women,5,4,"Natalia Karkoszka, Joanna Belgrau",,WU29,01:04:52
2025 New York,HYROX PRO DOUBLES - Overall,Women,6,2,"Brianna Byrz, Daria Daspin",,30-34,01:07:07
2025 New York,HYROX PRO DOUBLES - Overall,Women,7,3,"Rachel Legacy, Tracy Parmar",,30-34,01:07:29
2025 New York,HYROX PRO DOUBLES - Overall,Women,8,4,"Kerri Whelan, Melissa Whelan",,30-34,01:09:01
2025 New York,HYROX PRO DOUBLES - Overall,Women,9,5,"Meg Flynn, Whitney Anthony",,30-34,01:09:23
2025 New York,HYROX PRO DOUBLES - Overall,Women,10,5,"Célia Vanhoye, Gentiane Le Grand",,WU29,01:09:53
2025 New York,HYROX PRO DOUBLES - Overall,Women,11,6,"Brittany Singer, Heidi Stenzel",,30-34,01:10:02
2025 New York,HYROX PRO DOUBLES - Overall,Women,12,7,"Chelsie Grant, Sonia Schuster",,30-34,01:10:17
2025 New York,HYROX PRO DOUBLES - Overall,Women,13,6,"Ella Thirroueiz, Naoise Mooney",,WU29,01:10:50
2025 New York,HYROX PRO DOUBLES - Overall,Women,14,8,"Caitlynn Stowell, Brianna Rhodes",,30-34,01:10:53
2025 New York,HYROX PRO DOUBLES - Overall,Women,15,1,"Shana Fitzgerald, Annie Gross",,40-44,01:11:19
2025 New York,HYROX PRO DOUBLES - Overall,Women,16,9,"Courtney Merkling, Hannah Heider",,30-34,01:12:15
2025 New York,HYROX PRO DOUBLES - Overall,Women,17,7,"Paige Allison, Claudia Coles",,WU29,01:12:52
2025 New York,HYROX PRO DOUBLES - Overall,Women,18,2,"Cecilia Calderon, Rebecca Collins",,40-44,01:12:52
2025 New York,HYROX PRO DOUBLES - Overall,Women,19,10,"Myriam Gilbert, Marie-Jeanne Parent",,30-34,01:12:56
2025 New York,HYROX PRO DOUBLES - Overall,Women,20,8,"Jordan Doyle, Victoria McGowan",,WU29,01:13:29
2025 New York,HYROX PRO DOUBLES - Overall,Women,21,11,"Courtney Gibson, Allison Mistrot",,30-34,01:13:52
2025 New York,HYROX PRO DOUBLES - Overall,Women,22,3,"Nicola Simpson, Hannah CHATTERTON",,40-44,01:13:55
2025 New York,HYROX PRO DOUBLES - Overall,Women,23,4,"Jennifer Spartalis, Jessica House",,40-44,01:13:57
2025 New York,HYROX PRO DOUBLES - Overall,Women,24,9,"Jessica Fletcher, Allison Hassell",,WU29,01:14:03
2025 New York,HYROX PRO DOUBLES - Overall,Women,25,10,"Marisa Brogna, Caitlin Cooke",,WU29,01:14:19
2025 New York,HYROX PRO DOUBLES - Overall,Women,26,12,"Sarah Murphy, Alison Douglas",,30-34,01:14:28
2025 New York,HYROX PRO DOUBLES - Overall,Women,27,11,"Savannah Belley, Marie-Laurence Leblanc-Richard",,WU29,01:14:29
2025 New York,HYROX PRO DOUBLES - Overall,Women,28,12,"Hannah Power, Louise Ryan",,WU29,01:14:46
2025 New York,HYROX PRO DOUBLES - Overall,Women,29,13,"Gabby Urmanski Dalton, Ashton Ogle",,WU29,01:15:14
2025 New York,HYROX PRO DOUBLES - Overall,Women,30,13,"Mikayla Berneski, Kelli Gyorfi",,30-34,01:15:32
2025 New York,HYROX PRO DOUBLES - Overall,Women,31,5,"Elizabeth Apicella, Allison Trovage",,40-44,01:16:11
2025 New York,HYROX PRO DOUBLES - Overall,Women,32,14,"Kayla Horning, Reland Saugling",,WU29,01:16:22
2025 New York,HYROX PRO DOUBLES - Overall,Women,33,14,"Amy Sedig, Kristina Sorensen",,30-34,01:16:24
2025 New York,HYROX PRO DOUBLES - Overall,Women,34,15,"Katie Vollmer, Megan Cull",,30-34,01:16:43
2025 New York,HYROX PRO DOUBLES - Overall,Women,35,15,"Lindsey Holt, Kate Lahey",,WU29,01:16:49
2025 New York,HYROX PRO DOUBLES - Overall,Women,36,6,"Maria Policelli, Traci Revis",,40-44,01:16:52
2025 New York,HYROX PRO DOUBLES - Overall,Women,37,16,"Elizabeth Almansa, Michelle Anthony",,30-34,01:16:58
2025 New York,HYROX PRO DOUBLES - Overall,Women,38,16,"Anna Vinnedge, Olivia Fenner",,WU29,01:17:00
2025 New York,HYROX PRO DOUBLES - Overall,Women,39,17,"Kristina Schrepf, Carolina Pelaez",,WU29,01:17:40
2025 New York,HYROX PRO DOUBLES - Overall,Women,40,18,"Jessica Oesterwinter, Haly Johnson",,WU29,01:17:40
2025 New York,HYROX PRO DOUBLES - Overall,Women,41,17,"Jenifer Reinisch, Lauren DiSessa",,30-34,01:17:43
2025 New York,HYROX PRO DOUBLES - Overall,Women,42,18,"Renee Schiefer, Sarah Sutch",,30-34,01:18:03
2025 New York,HYROX PRO DOUBLES - Overall,Women,43,19,"Laura Epsztein, Faiza Laid",,30-34,01:18:23
2025 New York,HYROX PRO DOUBLES - Overall,Women,44,20,"Amy Clement, Jessica Garcia",,30-34,01:18:35
2025 New York,HYROX PRO DOUBLES - Overall,Women,45,21,"Tia Gould, Trish Higgins",,30-34,01:18:50
2025 New York,HYROX PRO DOUBLES - Overall,Women,46,22,"Valérie KUHN, Camille BRIE",,30-34,01:18:51
2025 New York,HYROX PRO DOUBLES - Overall,Women,47,23,"emeline Desrumeaux, Katia Maanane",,30-34,01:19:12
2025 New York,HYROX PRO DOUBLES - Overall,Women,48,24,"Kaitlyn Clancy, Melissa Sicard",,30-34,01:19:24
2025 New York,HYROX PRO DOUBLES - Overall,Women,49,19,"Christina Rudderow, Dana Shulman",,WU29,01:19:33
2025 New York,HYROX PRO DOUBLES - Overall,Women,50,25,"Samantha Lacayo, Taylor Lane",,30-34,01:20:01
2025 New York,HYROX PRO DOUBLES - Overall,Women,51,26,"Amanda Beard, Megan Manzo",,30-34,01:20:07
2025 New York,HYROX PRO DOUBLES - Overall,Women,52,1,"Michelle Lewis, Amy Robinson",,50-54,01:20:09
2025 New York,HYROX PRO DOUBLES - Overall,Women,53,20,"Sara Barazesh, Bree Franko-Smith",,WU29,01:20:37
2025 New York,HYROX PRO DOUBLES - Overall,Women,54,27,"Cami Blijden, Martine Loubser",,30-34,01:20:41
2025 New York,HYROX PRO DOUBLES - Overall,Women,55,28,"Eulicia Abreu, Emily Chen",,30-34,01:20:53
2025 New York,HYROX PRO DOUBLES - Overall,Women,56,29,"Jennifer Stanforth, Mallory Duggan",,30-34,01:20:56
