Race,Division,Gender,Rank Overall,Rank Age Group,Name,Nation,Age Group,Total Time
2025 Karlsruhe,HYROX PRO DOUBLES,Men,1,1,"Lasse Pips, Rene Groinig",,MU29,00:54:07
2025 Karlsruhe,HYROX PRO DOUBLES,Men,2,1,"Philipp Wamser, Georg Leiseder",,30-34,00:54:23
2025 Karlsruhe,HYROX PRO DOUBLES,Men,3,2,"Markus Rhöse, Jaafar Moumen",,30-34,00:55:04
2025 Karlsruhe,HYROX PRO DOUBLES,Men,4,3,"Sascha Ahrens, Christopher von Stelzer",,30-34,00:56:04
2025 Karlsruhe,HYROX PRO DOUBLES,Men,5,4,"Danny Loureiro, Yann Carballa",,30-34,00:56:13
2025 Karlsruhe,HYROX PRO DOUBLES,Men,6,2,"Janik Hoffmann, Luis Schnuer",,MU29,00:56:21
2025 Karlsruhe,HYROX PRO DOUBLES,Men,7,5,"Piers Plowman, Joseph Wells",,30-34,00:56:39
2025 Karlsruhe,HYROX PRO DOUBLES,Men,8,3,"Daniel Szadorf, Ralf Bittig",,MU29,00:57:49
2025 Karlsruhe,HYROX PRO DOUBLES,Men,9,4,"Manuel Jandrijevic, Daniel Leibinger",,MU29,00:58:23
2025 Karlsruhe,HYROX PRO DOUBLES,Men,10,6,"Dominik Karl, Florian Staudt",,30-34,00:58:31
2025 Karlsruhe,HYROX PRO DOUBLES,Men,11,5,"Leon Lücke, Daniel Benz",,MU29,00:58:56
2025 Karlsruhe,HYROX PRO DOUBLES,Men,12,6,"Johannes Klos, Nils Stüber",,MU29,01:00:53
2025 Karlsruhe,HYROX PRO DOUBLES,Men,13,7,"Dom Stroh, Manuel Tüngler",,MU29,01:01:17
2025 Karlsruhe,HYROX PRO DOUBLES,Men,14,7,"Dani Ortiz Ramos, Mathias Moosmann",,30-34,01:01:20
2025 Karlsruhe,HYROX PRO DOUBLES,Men,15,8,"Clement Huber, Ousmane Sene",,30-34,01:01:26
2025 Karlsruhe,HYROX PRO DOUBLES,Men,16,9,"Patrick Nürnberger, Michael Oswald",,30-34,01:01:27
2025 Karlsruhe,HYROX PRO DOUBLES,Men,17,1,"Sylvester Bunt van de, Maarten Nijboer",,40-44,01:01:43
2025 Karlsruhe,HYROX PRO DOUBLES,Men,18,10,"Patrick Daniel, Daniel Endres",,30-34,01:02:09
2025 Karlsruhe,HYROX PRO DOUBLES,Men,19,11,"Daniel Breinig, Marcel Mehren",,30-34,01:02:17
2025 Karlsruhe,HYROX PRO DOUBLES,Men,20,1,"Thilo Schmalkoke, Jochen Binder",,50-54,01:02:24
2025 Karlsruhe,HYROX PRO DOUBLES,Men,21,8,"Robert Merkel, Hermann Aust",,MU29,01:02:29
2025 Karlsruhe,HYROX PRO DOUBLES,Men,22,12,"David Jesse, Fabian Weißenberger",,30-34,01:02:31
2025 Karlsruhe,HYROX PRO DOUBLES,Men,23,13,"Ricky Reinspach, Faris Fattohi",,30-34,01:02:41
2025 Karlsruhe,HYROX PRO DOUBLES,Men,24,14,"Joachim Wolf, Calvin Camehl",,30-34,01:02:47
2025 Karlsruhe,HYROX PRO DOUBLES,Men,25,15,"Denis Holdschick, Max Gebhardt",,30-34,01:02:50
2025 Karlsruhe,HYROX PRO DOUBLES,Men,26,9,"Shannon Pierre Borowsky, Philipp Lehmberg",,MU29,01:03:13
2025 Karlsruhe,HYROX PRO DOUBLES,Men,27,16,"Kilian Jonasch, Patrick Spyra",,30-34,01:03:22
2025 Karlsruhe,HYROX PRO DOUBLES,Men,28,17,"Filip Nikolic, Lars Peckmann",,30-34,01:03:29
2025 Karlsruhe,HYROX PRO DOUBLES,Men,29,2,"Xavier Gautier, Alexandre Carpentier",,40-44,01:03:34
2025 Karlsruhe,HYROX PRO DOUBLES,Men,30,3,"Rafal Różański, Radoslaw Koczwara",,40-44,01:03:44
2025 Karlsruhe,HYROX PRO DOUBLES,Men,31,18,"Philip Nastke, Domenik Pickard",,30-34,01:03:53
2025 Karlsruhe,HYROX PRO DOUBLES,Men,32,19,"Raphaël Zaninetti, Valentin Zaninetti",,30-34,01:03:54
2025 Karlsruhe,HYROX PRO DOUBLES,Men,33,20,"Claudio Sorgente, Alexander Petrovic",,30-34,01:04:29
2025 Karlsruhe,HYROX PRO DOUBLES,Men,34,4,"Mehdi Zaghbani, David Ecoffard",,40-44,01:04:38
2025 Karlsruhe,HYROX PRO DOUBLES,Men,35,21,"Benoit Mesnil, Jean-Charles Desvignes",,30-34,01:05:08
2025 Karlsruhe,HYROX PRO DOUBLES,Men,36,10,"Joe Richard, Cameron Massey",,MU29,01:05:13
2025 Karlsruhe,HYROX PRO DOUBLES,Men,37,11,"Justus Dietrich, Lorenz Handwerk",,MU29,01:05:15
2025 Karlsruhe,HYROX PRO DOUBLES,Men,38,22,"René Dau, Lennart Küster",,30-34,01:05:34
2025 Karlsruhe,HYROX PRO DOUBLES,Men,39,23,"Joffrey Eder, Jerome Kaiser",,30-34,01:05:50
2025 Karlsruhe,HYROX PRO DOUBLES,Men,40,24,"Kevin Schulz, Patrick Neumann",,30-34,01:05:52
2025 Karlsruhe,HYROX PRO DOUBLES,Men,41,25,"Yannick Romeo Fongue Tchamo, Chris Genning",,30-34,01:06:04
2025 Karlsruhe,HYROX PRO DOUBLES,Men,42,26,"Timo Sigloch, Tim Heermann",,30-34,01:06:49
2025 Karlsruhe,HYROX PRO DOUBLES,Men,43,12,"Max Schmitt, Jannis Schmitt",,MU29,01:07:14
2025 Karlsruhe,HYROX PRO DOUBLES,Men,44,13,"Moritz Kugler, Lukas Berger",,MU29,01:07:25
2025 Karlsruhe,HYROX PRO DOUBLES,Men,45,27,"Michael Füth, Julius Bornkamm",,30-34,01:07:27
2025 Karlsruhe,HYROX PRO DOUBLES,Men,46,28,"Andreas Lütkewitte, Brandon D‘Mellow",,30-34,01:07:32
2025 Karlsruhe,HYROX PRO DOUBLES,Men,47,29,"jonas Gübler, Tobias Tingler",,30-34,01:07:45
2025 Karlsruhe,HYROX PRO DOUBLES,Men,48,5,"Fabio Elia, Matthias Fischer",,40-44,01:08:01
2025 Karlsruhe,HYROX PRO DOUBLES,Men,49,30,"Jérémy Zimmermann, Jérémy Despres",,30-34,01:08:11
2025 Karlsruhe,HYROX PRO DOUBLES,Men,50,14,"Sander Roos, Andreas Gräfl",,MU29,01:08:26
2025 Karlsruhe,HYROX PRO DOUBLES,Men,51,6,"Andreas Eberle, Sven Bleh",,40-44,01:08:32
2025 Karlsruhe,HYROX PRO DOUBLES,Men,52,7,"Claudio Bruno, Dario Pelusi",,40-44,01:08:40
2025 Karlsruhe,HYROX PRO DOUBLES,Men,53,31,"Michael Schober, Nicolai Frank",,30-34,01:09:10
2025 Karlsruhe,HYROX PRO DOUBLES,Men,54,8,"Laurent Hoeltgen, Oliver Juric",,40-44,01:09:21
2025 Karlsruhe,HYROX PRO DOUBLES,Men,55,32,"Sébastien Lumia, Anthony Simon",,30-34,01:09:27
2025 Karlsruhe,HYROX PRO DOUBLES,Men,56,15,"Tadeus Franck, Jannis Ziegeltrum",,MU29,01:09:48
2025 Karlsruhe,HYROX PRO DOUBLES,Men,57,16,"Franco Bortoluzzi, Matthias Blöchlinger",,MU29,01:10:00
2025 Karlsruhe,HYROX PRO DOUBLES,Men,58,33,"Florian Thomas, Johannes Frank",,30-34,01:10:00
2025 Karlsruhe,HYROX PRO DOUBLES,Men,59,34,"David Pena, Jeff Kiesch",,30-34,01:10:05
2025 Karlsruhe,HYROX PRO DOUBLES,Men,60,35,"Romain Miot, Arnaud GABRIELE",,30-34,01:10:37
2025 Karlsruhe,HYROX PRO DOUBLES,Men,61,36,"Frederik Knieß, Philip Roßbach",,30-34,01:10:40
2025 Karlsruhe,HYROX PRO DOUBLES,Men,62,37,"Andreas Jäger, Sebastian Wagner",,30-34,01:10:50
2025 Karlsruhe,HYROX PRO DOUBLES,Men,63,38,"German Weiland, Florian Saile",,30-34,01:10:58
2025 Karlsruhe,HYROX PRO DOUBLES,Men,64,39,"Tobias Braun, Phillip Biermann",,30-34,01:11:24
2025 Karlsruhe,HYROX PRO DOUBLES,Men,65,17,"Julian Pecho, Matthias Ruschig",,MU29,01:11:33
2025 Karlsruhe,HYROX PRO DOUBLES,Men,66,9,"Andreas Fehn, Alex Berti",,40-44,01:11:45
2025 Karlsruhe,HYROX PRO DOUBLES,Men,67,40,"Duc Hung Nguyen, Minh Nguyen",,30-34,01:11:54
2025 Karlsruhe,HYROX PRO DOUBLES,Men,68,41,"Philipp Holz, Fabio Troisi",,30-34,01:12:07
2025 Karlsruhe,HYROX PRO DOUBLES,Men,69,42,"Florian Groshaeny, Fabien Funfschilling",,30-34,01:12:12
2025 Karlsruhe,HYROX PRO DOUBLES,Men,70,2,"Robert Schiller, Thomas Mierke",,50-54,01:12:38
2025 Karlsruhe,HYROX PRO DOUBLES,Men,71,43,"Daniel Springer, Branko Arandjelovic",,30-34,01:12:53
2025 Karlsruhe,HYROX PRO DOUBLES,Men,72,44,"Pierre Moeckel, Markus Maier",,30-34,01:13:49
2025 Karlsruhe,HYROX PRO DOUBLES,Men,73,45,"Waldemar Melmann, Christian Höchsmann",,30-34,01:15:08
2025 Karlsruhe,HYROX PRO DOUBLES,Men,74,10,"Rolf Keller, Marius Müller",,40-44,01:15:28
2025 Karlsruhe,HYROX PRO DOUBLES,Men,75,18,"Dennis Gerhard, Alexander Kreher",,MU29,01:15:30
2025 Karlsruhe,HYROX PRO DOUBLES,Men,76,19,"Jonas Pohl, Finn Auerswald",,MU29,01:15:40
2025 Karlsruhe,HYROX PRO DOUBLES,Men,77,20,"Lucian Baum, Anton Gartner",,MU29,01:15:40
2025 Karlsruhe,HYROX PRO DOUBLES,Men,78,46,"Alexander Toll, Oliver Jonietz",,30-34,01:17:41
2025 Karlsruhe,HYROX PRO DOUBLES,Men,79,11,"Joachim Gastein, Andreas Kensbock",,40-44,01:18:09
2025 Karlsruhe,HYROX PRO DOUBLES,Men,80,21,"Tobias Bastian, Georg Paul",,MU29,01:18:20
2025 Karlsruhe,HYROX PRO DOUBLES,Men,81,47,"Sven Schäfer, Simon Lamb",,30-34,01:18:39
2025 Karlsruhe,HYROX PRO DOUBLES,Men,82,12,"Wai-Yip Man, Jan Peiniger",,40-44,01:18:40
2025 Karlsruhe,HYROX PRO DOUBLES,Men,83,13,"Sébastien Lambert, Florian Manière",,40-44,01:19:11
2025 Karlsruhe,HYROX PRO DOUBLES,Men,84,48,"Axel Mansart, Maxime Boureille",,30-34,01:19:19
2025 Karlsruhe,HYROX PRO DOUBLES,Men,85,49,"Christoph Hofmeister, Stijn Oude Vrielink",,30-34,01:19:24
2025 Karlsruhe,HYROX PRO DOUBLES,Men,86,50,"Damien FUCHS, Jean-Paul Chamoun",,30-34,01:20:29
2025 Karlsruhe,HYROX PRO DOUBLES,Men,87,22,"Daniel PEETERS, Livramento Samy",,MU29,01:21:46
2025 Karlsruhe,HYROX PRO DOUBLES,Men,88,51,"Arkadius Zakwieja, Daniel kiener",,30-34,01:23:16
2025 Karlsruhe,HYROX PRO DOUBLES,Men,89,52,"Manuel Tulezi, Lorenz Weidinger",,30-34,01:23:17
2025 Karlsruhe,HYROX PRO DOUBLES,Men,90,53,"Marc Drossel, Heiko Schwindling",,30-34,01:24:11
2025 Karlsruhe,HYROX PRO DOUBLES,Men,91,23,"Marvin Voigt, Paul Weidlich",,MU29,01:24:47
2025 Karlsruhe,HYROX PRO DOUBLES,Men,92,54,"Robert Duwe, Moritz Bausch",,30-34,01:25:15
2025 Karlsruhe,HYROX PRO DOUBLES,Men,93,55,"Mirko Kiesenberg, Pawel Dregan",,30-34,01:26:30
2025 Karlsruhe,HYROX PRO DOUBLES,Men,94,56,"Fabrice Schwartz, Philippe Krauth",,30-34,01:26:31
2025 Karlsruhe,HYROX PRO DOUBLES,Men,95,14,"Emmanuel SWIAT, Emmanuel Borjon",,40-44,01:27:38
2025 Karlsruhe,HYROX PRO DOUBLES,Men,96,57,"Yannick Iob, Streng Philippe",,30-34,01:29:19
2025 Karlsruhe,HYROX PRO DOUBLES,Men,97,58,"Maximilian Karcher, Robin Schäfer",,30-34,01:30:34
2025 Karlsruhe,HYROX PRO DOUBLES,Men,98,59,"Sascha Ilitsch, Andreas Mastrangelo",,30-34,01:31:44
2025 Karlsruhe,HYROX PRO DOUBLES,Men,99,60,"Tobias Ritzal, Dennis Gassmann",,30-34,01:32:08
2025 Karlsruhe,HYROX PRO DOUBLES,Men,100,61,"Julien Tipton, Jermaine Guynn",,30-34,01:38:23
2025 Karlsruhe,HYROX PRO DOUBLES,Men,101,62,"Benjamin Stieler, Manuel Maul",,30-34,01:39:33
2025 Karlsruhe,HYROX PRO DOUBLES,Men,102,24,"Julius Lorenz, Jim Thomas",,MU29,01:42:33
2025 Karlsruhe,HYROX PRO DOUBLES,Men,103,63,"Kay Bermanseder, Samuel Mario Mader",,30-34,01:43:41
2025 Karlsruhe,HYROX PRO DOUBLES,Men,104,64,"Dennis Burns, Rick Ahlhelm",,30-34,01:45:01
2025 Karlsruhe,HYROX PRO DOUBLES,Men,105,25,"Yannick Burgard, David Klein",,MU29,01:48:02
2025 Karlsruhe,HYROX PRO DOUBLES,Men,106,15,"Eiko Janetzky, Jörn Wolterink",,40-44,01:57:03
2025 Karlsruhe,HYROX PRO DOUBLES,Men,107,65,"Aizaz Ahmad, Noamaan Ahmed Din",,30-34,02:22:12
2025 Karlsruhe,HYROX PRO DOUBLES,Women,1,1,"Olivia Rohse, Lena Miller",,WU29,01:05:45
2025 Karlsruhe,HYROX PRO DOUBLES,Women,2,1,"Elsa Martin, Julia Rindfleisch",,30-34,01:06:13
2025 Karlsruhe,HYROX PRO DOUBLES,Women,3,2,"Caroline Lieb, Carla Wiegand",,30-34,01:06:34
2025 Karlsruhe,HYROX PRO DOUBLES,Women,4,2,"Valentina Groha, Franziska Koch",,WU29,01:07:38
2025 Karlsruhe,HYROX PRO DOUBLES,Women,5,3,"Nathalie Stendahl, Valérie Strub",,WU29,01:08:12
2025 Karlsruhe,HYROX PRO DOUBLES,Women,6,3,"Maeva Flury, Armelle Tharin",,30-34,01:08:32
2025 Karlsruhe,HYROX PRO DOUBLES,Women,7,4,"Inga Mathwig, Viktoria Constanze Schneider",,30-34,01:09:05
2025 Karlsruhe,HYROX PRO DOUBLES,Women,8,1,"Merituuli Kallio, Luciane Macias",,50-54,01:09:24
2025 Karlsruhe,HYROX PRO DOUBLES,Women,9,5,"Lisa Drescher, Carolin Schroers",,30-34,01:10:41
2025 Karlsruhe,HYROX PRO DOUBLES,Women,10,1,"Marina Zander, Julia Wilms",,40-44,01:12:59
2025 Karlsruhe,HYROX PRO DOUBLES,Women,11,4,"Luisa Jacobj, Franziska Hadaschik",,WU29,01:13:43
2025 Karlsruhe,HYROX PRO DOUBLES,Women,12,6,"Lydia Taubert, Julia Weißhaar",,30-34,01:14:09
2025 Karlsruhe,HYROX PRO DOUBLES,Women,13,2,"Alexa Konrad, Sandra Silvery",,50-54,01:14:17
2025 Karlsruhe,HYROX PRO DOUBLES,Women,14,7,"Danny Dechant, Delayne Dechant",,30-34,01:14:34
2025 Karlsruhe,HYROX PRO DOUBLES,Women,15,2,"Lisa-Marie Steinheider, Anja Germer",,40-44,01:15:06
2025 Karlsruhe,HYROX PRO DOUBLES,Women,16,8,"Mylène Lecieux, Carina Felten",,30-34,01:15:08
2025 Karlsruhe,HYROX PRO DOUBLES,Women,17,3,"Silke Sontopski, Chrissi Kopp",,40-44,01:15:51
2025 Karlsruhe,HYROX PRO DOUBLES,Women,18,5,"Savannah Reif-Romero, Hannah Braun",,WU29,01:16:27
2025 Karlsruhe,HYROX PRO DOUBLES,Women,19,6,"Olivia Magosch, Nikolina Franke",,WU29,01:16:31
2025 Karlsruhe,HYROX PRO DOUBLES,Women,20,9,"Damaris Gatzsche, Katharina Menz",,30-34,01:16:39
2025 Karlsruhe,HYROX PRO DOUBLES,Women,21,10,"Maike Kärcher-Drössler, Jasmin Drössler",,30-34,01:16:52
2025 Karlsruhe,HYROX PRO DOUBLES,Women,22,4,"Gemma Fromage-crawford, Radka Allen",,40-44,01:16:56
2025 Karlsruhe,HYROX PRO DOUBLES,Women,23,11,"Patricia Fiedler, Anika Hasse",,30-34,01:17:08
2025 Karlsruhe,HYROX PRO DOUBLES,Women,24,5,"Natascha Küng, Julia Wehinger",,40-44,01:17:42
2025 Karlsruhe,HYROX PRO DOUBLES,Women,25,12,"Katinka Graw, Sabrina Triebess",,30-34,01:17:53
2025 Karlsruhe,HYROX PRO DOUBLES,Women,26,7,"Sophie Bauch, Eileen Henning",,WU29,01:17:54
2025 Karlsruhe,HYROX PRO DOUBLES,Women,27,8,"Gillie Gordon, Noémie Gerber",,WU29,01:18:13
2025 Karlsruhe,HYROX PRO DOUBLES,Women,28,6,"Natalie Thimm, Christiane Tillmann",,40-44,01:18:13
2025 Karlsruhe,HYROX PRO DOUBLES,Women,29,9,"Katja Huber, Christina Mittermeier",,WU29,01:18:22
2025 Karlsruhe,HYROX PRO DOUBLES,Women,30,13,"Sara Russo, Natalie Lankowski",,30-34,01:18:28
2025 Karlsruhe,HYROX PRO DOUBLES,Women,31,14,"Katharina Schlender, Carla Sibylle Beck",,30-34,01:19:09
2025 Karlsruhe,HYROX PRO DOUBLES,Women,32,15,"Carmen Gardin, Dominique Gardin",,30-34,01:20:16
2025 Karlsruhe,HYROX PRO DOUBLES,Women,33,10,"Klara Kosch, Carmen Lucia Hirschl",,WU29,01:20:24
2025 Karlsruhe,HYROX PRO DOUBLES,Women,34,16,"Tiia Markkanen, Vivienne Maccarone",,30-34,01:21:00
2025 Karlsruhe,HYROX PRO DOUBLES,Women,35,17,"Elke Glück, Merrit Bendsen",,30-34,01:21:53
2025 Karlsruhe,HYROX PRO DOUBLES,Women,36,7,"Nina Däuwel, Julia Jung",,40-44,01:21:58
2025 Karlsruhe,HYROX PRO DOUBLES,Women,37,8,"Veronika Troy, Nicole Berti",,40-44,01:23:33
2025 Karlsruhe,HYROX PRO DOUBLES,Women,38,3,"Kim-Stefanny Hagen, Monika Marx",,50-54,01:23:54
2025 Karlsruhe,HYROX PRO DOUBLES,Women,39,18,"Laura Eickelmann, Viktoriia Riegel",,30-34,01:24:29
2025 Karlsruhe,HYROX PRO DOUBLES,Women,40,11,"Alena Dietle, Gloriya Miteva",,WU29,01:24:56
2025 Karlsruhe,HYROX PRO DOUBLES,Women,41,19,"Roxane Kochert, Alexandra Christmann",,30-34,01:26:12
2025 Karlsruhe,HYROX PRO DOUBLES,Women,42,20,"Maria Stahel, Katja Holzwarth",,30-34,01:26:28
2025 Karlsruhe,HYROX PRO DOUBLES,Women,43,9,"Lisa Fenninger, Sandra Gehring",,40-44,01:27:32
2025 Karlsruhe,HYROX PRO DOUBLES,Women,44,21,"Vanessa Tünderligeti, Agnes Roberson",,30-34,01:28:03
2025 Karlsruhe,HYROX PRO DOUBLES,Women,45,12,"Luisa Engel, Isabel Kirschner",,WU29,01:28:25
2025 Karlsruhe,HYROX PRO DOUBLES,Women,46,22,"Lilia Faval, Anne-Christine Wolf",,30-34,01:30:20
2025 Karlsruhe,HYROX PRO DOUBLES,Women,47,23,"Nathalie Vollmer, Katy Coutier",,30-34,01:31:20
2025 Karlsruhe,HYROX PRO DOUBLES,Women,48,24,"Céline Burnier, Manouk Guignard",,30-34,01:32:22
2025 Karlsruhe,HYROX PRO DOUBLES,Women,49,10,"Muriel DE BRUYCKERE, Marina Hager",,40-44,01:32:36
2025 Karlsruhe,HYROX PRO DOUBLES,Women,50,11,"Carolin Bäzner, Natalie Friedrich",,40-44,01:32:37
2025 Karlsruhe,HYROX PRO DOUBLES,Women,51,25,"Maren Hormozi, Surina Hormozi",,30-34,01:32:48
2025 Karlsruhe,HYROX PRO DOUBLES,Women,52,26,"Kim Fuchs, Eva-Maria Weber",,30-34,01:33:02
2025 Karlsruhe,HYROX PRO DOUBLES,Women,53,27,"Claudia Fend, Sarah Krenkel",,30-34,01:33:34
2025 Karlsruhe,HYROX PRO DOUBLES,Women,54,1,Marlene Ganslmeier,,X70+,01:35:23
2025 Karlsruhe,HYROX PRO DOUBLES,Women,55,28,"Denise Drössler, Susanne Bodien",,30-34,01:38:08
2025 Karlsruhe,HYROX PRO DOUBLES,Women,56,29,"Ann Kristin Rettig, Mariella Klein",,30-34,01:40:46
2025 Karlsruhe,HYROX PRO DOUBLES,Women,57,30,"Carmen Brenzel, Carina Frolov",,30-34,01:44:09
2025 Karlsruhe,HYROX PRO DOUBLES,Women,58,31,"Marie Schmitz-Moormann, Elisabeth Wiechert",,30-34,01:44:34
2025 Karlsruhe,HYROX PRO DOUBLES,Women,59,13,"Janika Mägerle, Stefanie Glass",,WU29,01:54:20
2025 Karlsruhe,HYROX PRO DOUBLES,Women,60,12,"Nadine Endrussat, Sirin Salmasi",,40-44,02:00:40
2025 Karlsruhe,HYROX PRO DOUBLES,Women,61,14,"Laura Rice, Leah Cecil",,WU29,02:01:30
