Race,Division,Gender,Rank Overall,Rank Age Group,Name,Nation,Age Group,Total Time
2025 New York,HYROX PRO DOUBLES - Overall,Women,57,21,"Lisa Margaria, Kenar Gelman",,WU29,01:21:04
2025 New York,HYROX PRO DOUBLES - Overall,Women,58,30,"Jessica Brudzienski, Gabrielle Kosakowski",,30-34,01:21:07
2025 New York,HYROX PRO DOUBLES - Overall,Women,59,31,"Allyson Norton, Kristen Broking",,30-34,01:21:20
2025 New York,HYROX PRO DOUBLES - Overall,Women,60,7,"Renata Novotna, Christel Campanella",,40-44,01:21:23
2025 New York,HYROX PRO DOUBLES - Overall,Women,61,22,"Brittany Gomez, Sarah Karmazyn",,WU29,01:21:27
2025 New York,HYROX PRO DOUBLES - Overall,Women,62,23,"marissa trombino, mackenzie merrick",,WU29,01:21:37
2025 New York,HYROX PRO DOUBLES - Overall,Women,63,2,"Nancy Caldwell, Jillair Kubish",,50-54,01:21:50
2025 New York,HYROX PRO DOUBLES - Overall,Women,64,8,"Emily Biddle, Danielle Clemmer",,40-44,01:21:56
2025 New York,HYROX PRO DOUBLES - Overall,Women,65,9,"Jill Niedoba, Charlotte Steel",,40-44,01:21:58
2025 New York,HYROX PRO DOUBLES - Overall,Women,66,24,"Melanie Rodriguez-Palacios, Allison Schwartz",,WU29,01:21:59
2025 New York,HYROX PRO DOUBLES - Overall,Women,67,25,"Jamie Francis, Jackie Amato",,WU29,01:22:12
2025 New York,HYROX PRO DOUBLES - Overall,Women,68,32,"Jamieson Purtell, Cara Anastasio",,30-34,01:22:14
2025 New York,HYROX PRO DOUBLES - Overall,Women,69,33,"Olga Kolodziejska, Joanna Frankenfield",,30-34,01:22:15
2025 New York,HYROX PRO DOUBLES - Overall,Women,70,26,"Rachael Haunton, Karli DeVries",,WU29,01:22:16
2025 New York,HYROX PRO DOUBLES - Overall,Women,71,34,"Alex Lawwill, Kacie McIntosh",,30-34,01:22:18
2025 New York,HYROX PRO DOUBLES - Overall,Women,72,35,"Sally Lim, Elizabeth Chang",,30-34,01:22:27
2025 New York,HYROX PRO DOUBLES - Overall,Women,73,36,"Evelin Gallegos, Alysha Baldwin",,30-34,01:22:30
2025 New York,HYROX PRO DOUBLES - Overall,Women,74,10,"Vicki List, Melissa Usurin",,40-44,01:22:47
2025 New York,HYROX PRO DOUBLES - Overall,Women,75,27,"Caitlin Carroll, Kyra Bachety",,WU29,01:23:02
2025 New York,HYROX PRO DOUBLES - Overall,Women,76,37,"Gwendoline Pirillo, Karénn Cristina Vaz Dos Santos",,30-34,01:23:34
2025 New York,HYROX PRO DOUBLES - Overall,Women,77,28,"Nicole Frooks, Mikaela Barriga",,WU29,01:23:46
2025 New York,HYROX PRO DOUBLES - Overall,Women,78,29,"Kristen Barani, Arley Kost",,WU29,01:24:08
2025 New York,HYROX PRO DOUBLES - Overall,Women,79,38,"Laura Reyes, Monica Mayan-Martinez",,30-34,01:24:23
2025 New York,HYROX PRO DOUBLES - Overall,Women,80,39,"Danielle Halsey, Carly Burrows",,30-34,01:24:32
2025 New York,HYROX PRO DOUBLES - Overall,Women,81,30,"Ashlin Cosselman, Skylar DeVault",,WU29,01:24:39
2025 New York,HYROX PRO DOUBLES - Overall,Women,82,31,"Giovanna Caponi, Emma Hughes",,WU29,01:24:45
2025 New York,HYROX PRO DOUBLES - Overall,Women,83,3,"Julie Dvoskin, Brenda Rubin",,50-54,01:24:52
2025 New York,HYROX PRO DOUBLES - Overall,Women,84,11,"Tiffany Hafner, Nicole Stalletti",,40-44,01:24:53
2025 New York,HYROX PRO DOUBLES - Overall,Women,85,40,"Melinda Jaffer, Vanessa Ansari",,30-34,01:25:08
2025 New York,HYROX PRO DOUBLES - Overall,Women,86,41,"Victoria Vergona, Jordan Vasarkovy",,30-34,01:25:12
2025 New York,HYROX PRO DOUBLES - Overall,Women,87,32,"Anna Marks, Natalie Stephens",,WU29,01:25:14
2025 New York,HYROX PRO DOUBLES - Overall,Women,88,33,"Reagan Waldner, Georgia Waggoner",,WU29,01:25:18
2025 New York,HYROX PRO DOUBLES - Overall,Women,89,42,"Michelle Ng, Luisa Gonzalez",,30-34,01:25:27
2025 New York,HYROX PRO DOUBLES - Overall,Women,90,43,"Marie Gorka, Whitney Toyloy",,30-34,01:25:56
2025 New York,HYROX PRO DOUBLES - Overall,Women,91,12,"Christine Gralher, Rebecca Haehnle",,40-44,01:26:21
2025 New York,HYROX PRO DOUBLES - Overall,Women,92,34,"Rebecca Kirchgessner, Jeannie Bocchino",,WU29,01:26:32
2025 New York,HYROX PRO DOUBLES - Overall,Women,93,44,"Megan O’Dowd, Carla Alvarez",,30-34,01:26:33
2025 New York,HYROX PRO DOUBLES - Overall,Women,94,45,"Annemarie Urena, Bianca Rodriguez",,30-34,01:26:34
2025 New York,HYROX PRO DOUBLES - Overall,Women,95,46,"Samantha Gruettner, Liliana Villatoro",,30-34,01:26:47
2025 New York,HYROX PRO DOUBLES - Overall,Women,96,47,"Meghan Stetson, Jaclyn Marion",,30-34,01:27:01
2025 New York,HYROX PRO DOUBLES - Overall,Women,97,35,"Michelle Mendez, Lauren Johnson",,WU29,01:27:19
2025 New York,HYROX PRO DOUBLES - Overall,Women,98,48,"Karina Santos, Astrid Garcia",,30-34,01:27:24
2025 New York,HYROX PRO DOUBLES - Overall,Women,99,49,"Christina Karkouta, Adriana Zieba-Rosa",,30-34,01:27:52
2025 New York,HYROX PRO DOUBLES - Overall,Women,100,36,"Aoife Foster, Una Cannon",,WU29,01:28:08
2025 New York,HYROX PRO DOUBLES - Overall,Women,101,37,"jillian Stratichuk, Shelby Armstrong",,WU29,01:28:10
2025 New York,HYROX PRO DOUBLES - Overall,Women,102,50,"Alyce Mui, Stephanie Strouse",,30-34,01:28:12
2025 New York,HYROX PRO DOUBLES - Overall,Women,103,38,"Sara Fernandez, Genesis Alexandra Carchi Veliz",,WU29,01:29:26
2025 New York,HYROX PRO DOUBLES - Overall,Women,104,39,"Evelyn Amendano, Paola Colon",,WU29,01:29:46
2025 New York,HYROX PRO DOUBLES - Overall,Women,105,40,"Kamila Martinez, Carolyn Mistretta",,WU29,01:30:19
2025 New York,HYROX PRO DOUBLES - Overall,Women,106,51,"Ashley Ramsey, Tia Davis",,30-34,01:30:22
2025 New York,HYROX PRO DOUBLES - Overall,Women,107,52,"Faith Anker, Alejandra Alonso",,30-34,01:30:49
2025 New York,HYROX PRO DOUBLES - Overall,Women,108,13,"Erin Waldner, Caitlin Sullivan",,40-44,01:32:47
2025 New York,HYROX PRO DOUBLES - Overall,Women,109,41,"Victoria Ciccone, Rylee Foulks",,WU29,01:33:01
2025 New York,HYROX PRO DOUBLES - Overall,Women,110,14,"Anita Persaud, Jennifer von Graevenitz",,40-44,01:33:28
2025 New York,HYROX PRO DOUBLES - Overall,Women,111,53,"Amber Clancy, Geneva Zetterstrom",,30-34,01:33:46
2025 New York,HYROX PRO DOUBLES - Overall,Women,112,42,"Emma Ianni, Gwen Aviles",,WU29,01:33:59
2025 New York,HYROX PRO DOUBLES - Overall,Women,113,15,"Victoria Shepelevsky, Marleen Diaz",,40-44,01:34:10
2025 New York,HYROX PRO DOUBLES - Overall,Women,114,54,"Tamara Sellers, Kimberly Dutka",,30-34,01:34:32
2025 New York,HYROX PRO DOUBLES - Overall,Women,115,43,"Hailey Hill, Ashley Walter",,WU29,01:34:32
2025 New York,HYROX PRO DOUBLES - Overall,Women,116,16,"Elisabete Wagner, Mallory Morales",,40-44,01:34:53
2025 New York,HYROX PRO DOUBLES - Overall,Women,117,44,"Arielle Shternfeld, Elle Winterson",,WU29,01:35:18
2025 New York,HYROX PRO DOUBLES - Overall,Women,118,17,"Suzanne Horner, Erica Cole-Tucker",,40-44,01:35:29
2025 New York,HYROX PRO DOUBLES - Overall,Women,119,45,"Sarah Killoy, Hannah Duffy",,WU29,01:35:58
2025 New York,HYROX PRO DOUBLES - Overall,Women,120,55,"Diana Cigarroa, Daniela Duran",,30-34,01:36:10
2025 New York,HYROX PRO DOUBLES - Overall,Women,121,46,"Adila Gathers, Brianna Grammatico",,WU29,01:36:51
2025 New York,HYROX PRO DOUBLES - Overall,Women,122,56,"Alayna Blazakis, Rachael Wolfe",,30-34,01:37:40
2025 New York,HYROX PRO DOUBLES - Overall,Women,123,18,"Sally Fuentes, Xiomara Lugo",,40-44,01:37:43
2025 New York,HYROX PRO DOUBLES - Overall,Women,124,57,"Laina Michel, Aura arteaga",,30-34,01:37:56
2025 New York,HYROX PRO DOUBLES - Overall,Women,125,58,"Jordan Masharbash, Allison Janbakhsh",,30-34,01:40:15
2025 New York,HYROX PRO DOUBLES - Overall,Women,126,59,"Kaleigh O'Riordan, Elizabeth Joseph",,30-34,01:40:19
2025 New York,HYROX PRO DOUBLES - Overall,Women,127,47,"Taylor Martino, Jillian Reilly",,WU29,01:41:05
2025 New York,HYROX PRO DOUBLES - Overall,Women,128,48,"Katherine Ruilova, Amy Del Rio",,WU29,01:42:04
2025 New York,HYROX PRO DOUBLES - Overall,Women,129,60,"Barbara Kuhn, Margarita Feld",,30-34,01:42:39
2025 New York,HYROX PRO DOUBLES - Overall,Women,130,49,"Morgan Barnes, Rebecca Tomaszewski",,WU29,01:42:42
2025 New York,HYROX PRO DOUBLES - Overall,Women,131,61,"Priscilla Ippolito, Samantha Sportiello",,30-34,01:43:41
2025 New York,HYROX PRO DOUBLES - Overall,Women,132,19,"Kerri Mullaney, Jules Patel",,40-44,01:45:17
2025 New York,HYROX PRO DOUBLES - Overall,Women,133,50,"Lauren Ricci, Katrina Bellaran",,WU29,01:45:26
2025 New York,HYROX PRO DOUBLES - Overall,Women,134,62,"Brittany Craig, Anika Chelin",,30-34,01:46:25
2025 New York,HYROX PRO DOUBLES - Overall,Women,135,20,"Isabel Zapata, Karen Guilarte",,40-44,01:46:58
2025 New York,HYROX PRO DOUBLES - Overall,Women,136,21,"Emily Haggerty, Abbey Theroux",,40-44,01:50:00
2025 New York,HYROX PRO DOUBLES - Overall,Women,137,63,"Ann-Marie Prendergast, Aisling Concannon",,30-34,01:50:52
2025 New York,HYROX PRO DOUBLES - Overall,Women,138,51,"rachel Falto, Kristen Laub",,WU29,01:59:49
2025 New York,HYROX PRO DOUBLES - Overall,Women,139,52,"Taina Aller, Valery Zorrilla",,WU29,02:08:15
2025 New York,HYROX PRO DOUBLES - Overall,Women,140,64,"Rebecca Rosenberg, Angela Ecks",,30-34,02:20:46
2025 New York,HYROX PRO DOUBLES - Overall,Women,141,65,"Megan Perez, Jessica Lacher",,30-34,02:22:18
2025 New York,HYROX PRO DOUBLES - Overall,Women,142,66,"Janet Manoti, Esther Aburi",,30-34,02:42:17
