Race,Division,Gender,Rank Overall,Rank Age Group,Name,Nation,Age Group,Total Time
2025 Monterrey,HYROX PRO DOUBLES,Men,1,1,"Patricio Orozco, Adrian Sheridan",,MU29,00:57:34
2025 Monterrey,HYROX PRO DOUBLES,Men,2,1,"Luciano Valdes Gonzalez, Osmar Sanchez Pacheco",,30-34,00:59:53
2025 Monterrey,HYROX PRO DOUBLES,Men,3,2,"Caio Assayag, Lucas Medeiros",,30-34,01:00:37
2025 Monterrey,HYROX PRO DOUBLES,Men,4,2,"Axel Alejandro López Aguilar, Liam Kareem Gonzalez Torres",,MU29,01:01:33
2025 Monterrey,HYROX PRO DOUBLES,Men,5,3,"Alejandro De La Rosa, Paul Gonzalez Flores",,MU29,01:03:30
2025 Monterrey,HYROX PRO DOUBLES,Men,6,3,"Rodrigo Ivan Saez Cisneros, Manuel Roberto Gallegos Cereceres",,30-34,01:03:45
2025 Monterrey,HYROX PRO DOUBLES,Men,7,4,"Fernando Osorio Bandala, Graco Santaella Sendel",,MU29,01:04:11
2025 Monterrey,HYROX PRO DOUBLES,Men,8,5,"Eugenio Villarreal, Roberto Cantu",,MU29,01:04:24
2025 Monterrey,HYROX PRO DOUBLES,Men,9,4,"Julio César Lemus Martinez, Hector Ramirez Carcaño",,30-34,01:04:29
2025 Monterrey,HYROX PRO DOUBLES,Men,10,5,"Carlos Arturo Avilez Salazar, César Oswaldo Valencia Arredondo",,30-34,01:05:11
2025 Monterrey,HYROX PRO DOUBLES,Men,11,1,"Jonathan Witmond, Federico Barrault",,40-44,01:05:48
2025 Monterrey,HYROX PRO DOUBLES,Men,12,2,"Luis Alonso Cabello Rico, Francisco Olvera",,40-44,01:05:49
2025 Monterrey,HYROX PRO DOUBLES,Men,13,6,"Gilberto Rodriguez, Fernando Gomez Diaz",,30-34,01:05:52
2025 Monterrey,HYROX PRO DOUBLES,Men,14,7,"Daniel Paniagua, Mario Ortiz",,30-34,01:06:47
2025 Monterrey,HYROX PRO DOUBLES,Men,15,8,"Ruben Mora, Abraham Alejandro Tello Nava",,30-34,01:07:05
2025 Monterrey,HYROX PRO DOUBLES,Men,16,6,"Alejandro Galvez, Victor Martinez",,MU29,01:07:27
2025 Monterrey,HYROX PRO DOUBLES,Men,17,9,"Taro Alborta, Luis Alejandro Javier Martinez",,30-34,01:07:50
2025 Monterrey,HYROX PRO DOUBLES,Men,18,7,"Martin Ruiz, Alexis Terrones",,MU29,01:08:23
2025 Monterrey,HYROX PRO DOUBLES,Men,19,10,"Abad Francisco Tosatado Aguilar, Alfredo Nahum Montañez Rodriguez",,30-34,01:10:57
2025 Monterrey,HYROX PRO DOUBLES,Men,20,8,"Elias Richo Lankenau, Raul Fuentes Melo",,MU29,01:11:14
2025 Monterrey,HYROX PRO DOUBLES,Men,21,11,"Diego Armando Aceves Rebolledo, Omar Figueroa Cedillo",,30-34,01:11:47
2025 Monterrey,HYROX PRO DOUBLES,Men,22,12,"Jose Guillermo Moreno, Paul Pascual Campos",,30-34,01:12:46
2025 Monterrey,HYROX PRO DOUBLES,Men,23,13,"Francisco Acevedo, Eduardo Tetitla Bermudez",,30-34,01:14:20
2025 Monterrey,HYROX PRO DOUBLES,Men,24,9,"Emilio Garcia, Fernando Mañon",,MU29,01:14:25
2025 Monterrey,HYROX PRO DOUBLES,Men,25,10,"Emiliano Cervabtes, Jesús Manuel Villegas Altamirano",,MU29,01:15:59
2025 Monterrey,HYROX PRO DOUBLES,Men,26,3,"Daniel Rosales Herrera, Heder Guzmán Espejel",,40-44,01:17:13
2025 Monterrey,HYROX PRO DOUBLES,Men,27,11,"Jorge Fuentes Juárez, Emilio Hernandez Lozano",,MU29,01:17:16
2025 Monterrey,HYROX PRO DOUBLES,Men,28,4,"Fredy Gonzalez, Eduardo Ronzon",,40-44,01:19:17
2025 Monterrey,HYROX PRO DOUBLES,Men,29,14,"Jesus Gerardo Rendon Torres, Jesus Alejandro Rojas Sanchez",,30-34,01:19:50
2025 Monterrey,HYROX PRO DOUBLES,Men,30,15,"Alejandro Lopez Sanchez, Maximiliano Ibarra Belmonte",,30-34,01:21:45
2025 Monterrey,HYROX PRO DOUBLES,Men,31,5,"Alejandro Reyes, Juan Ezequiel Reyes",,40-44,01:22:19
2025 Monterrey,HYROX PRO DOUBLES,Men,32,12,"Diego Santiago, Luis Diaz",,MU29,01:23:41
2025 Monterrey,HYROX PRO DOUBLES,Men,33,13,"Diego Hernandez Zapien, Marco Antonio Aceves Durán",,MU29,01:24:07
2025 Monterrey,HYROX PRO DOUBLES,Men,34,16,"Pepe Cisneros, Gildardo Cano Gomez",,30-34,01:25:33
2025 Monterrey,HYROX PRO DOUBLES,Men,35,6,"Luis Castillo, Miguel Pichardo",,40-44,01:27:54
2025 Monterrey,HYROX PRO DOUBLES,Men,36,14,"Roberto Pardo, Alan Gonzalez",,MU29,01:28:34
2025 Monterrey,HYROX PRO DOUBLES,Men,37,17,"Edson Alfredo Coca Cazabal, Abraham De Jesus Morales Sanchez",,30-34,01:29:07
2025 Monterrey,HYROX PRO DOUBLES,Men,38,18,"Leonardo Ramirez, Edgar Mendoza",,30-34,01:37:07
2025 Monterrey,HYROX PRO DOUBLES,Men,39,15,"Sebastian Llerandi Moreno, Celestino Gómez Calvo",,MU29,01:41:52
2025 Monterrey,HYROX PRO DOUBLES,Men,40,16,"Emilio Jaziel Sánchez Alejo, Andrés Alejandro Xicará De Paz",,MU29,01:45:07
2025 Monterrey,HYROX PRO DOUBLES,Men,41,17,"Diego Garcia, Raul Jerlach",,MU29,01:45:12
2025 Monterrey,HYROX PRO DOUBLES,Women,1,1,"Chase Parda, Ash Bares",,30-34,01:07:15
2025 Monterrey,HYROX PRO DOUBLES,Women,2,2,"Deborah Jones, Andrea Alvarez",,30-34,01:12:53
2025 Monterrey,HYROX PRO DOUBLES,Women,3,1,"Johana Aracely Aguilar King, Karla Maria Zapata Dominguez",,WU29,01:13:38
2025 Monterrey,HYROX PRO DOUBLES,Women,4,3,"Pamela Medina, Karla Brinkman",,30-34,01:13:44
2025 Monterrey,HYROX PRO DOUBLES,Women,5,4,"Maria Fernanda Garcia Cuesta, Zuria Arreola Recio",,30-34,01:15:31
2025 Monterrey,HYROX PRO DOUBLES,Women,6,1,"Daneysa Berdejo, Karla Fernandez",,40-44,01:16:00
2025 Monterrey,HYROX PRO DOUBLES,Women,7,5,"María Antonieta Hernández Cisneros, Ana Sofía Ríos Magaña",,30-34,01:16:01
2025 Monterrey,HYROX PRO DOUBLES,Women,8,2,"Fernanda Cisneros Corral, Regina Francine Ceniceros Galarza",,WU29,01:16:54
2025 Monterrey,HYROX PRO DOUBLES,Women,9,2,"Cece Garcia, Vera Stepina",,40-44,01:18:18
2025 Monterrey,HYROX PRO DOUBLES,Women,10,3,"Rosa Cook, Karla Rivera",,WU29,01:18:58
2025 Monterrey,HYROX PRO DOUBLES,Women,11,6,"Ana Karen Bravo, Fernanda De Los Santos",,30-34,01:19:58
2025 Monterrey,HYROX PRO DOUBLES,Women,12,4,"Nazaret Gomez Padilla, Valeria Aguilar Maciel",,WU29,01:21:13
2025 Monterrey,HYROX PRO DOUBLES,Women,13,5,"Minerva Avilez Salazar, Dafne Alejandra Leon Cervantes",,WU29,01:21:54
2025 Monterrey,HYROX PRO DOUBLES,Women,14,6,"Lizbeth Angelica Ortega Mariscal, Aylin Carol Ortega Mariscal",,WU29,01:21:57
2025 Monterrey,HYROX PRO DOUBLES,Women,15,7,"Nadia Rios, Ivette Rizo",,WU29,01:23:03
2025 Monterrey,HYROX PRO DOUBLES,Women,16,8,"Paulina Fernandez Cappellesso, Sofia Nuñez Osorno",,WU29,01:24:15
2025 Monterrey,HYROX PRO DOUBLES,Women,17,7,"Aida Aguilar, Tania Peña",,30-34,01:24:43
2025 Monterrey,HYROX PRO DOUBLES,Women,18,3,"Paola Georgina Balmori Durazzo, Claudia Maroño López",,40-44,01:27:05
2025 Monterrey,HYROX PRO DOUBLES,Women,19,9,"Karen Rojas, Amelia Flores Camarena",,WU29,01:27:40
2025 Monterrey,HYROX PRO DOUBLES,Women,20,8,"Natalia Alicia Borgna, Leslie Yunuen Ávalos Peña",,30-34,01:28:26
2025 Monterrey,HYROX PRO DOUBLES,Women,21,9,"María Fernanda Cancino, Montserrat Fuente",,30-34,01:28:39
2025 Monterrey,HYROX PRO DOUBLES,Women,22,10,"Carolina Rodríguez Arceo, Gloryte Rubio Perez De La Vega",,30-34,01:29:57
2025 Monterrey,HYROX PRO DOUBLES,Women,23,10,"Macarena Ianina Maisenti, Daniela Jimenez",,WU29,01:30:41
2025 Monterrey,HYROX PRO DOUBLES,Women,24,11,"Nancy Mariana Martinez Flores, Ana Bárbara De León Valle",,30-34,01:33:56
2025 Monterrey,HYROX PRO DOUBLES,Women,25,12,"Regina Becerra, Tania García",,30-34,01:36:39
2025 Monterrey,HYROX PRO DOUBLES,Women,26,11,"Vannia Vázquez Mesillas, Salma Yvonne Hernández López",,WU29,01:36:56
2025 Monterrey,HYROX PRO DOUBLES,Women,27,13,"Tanya Armida Araiza Martínez, Andrea Montserrat González Covarrubias",,30-34,01:38:34
2025 Monterrey,HYROX PRO DOUBLES,Women,28,14,"Diana Cecilia Estrada Couoh, María De Los Angeles Gómez Tule",,30-34,01:38:43
2025 Monterrey,HYROX PRO DOUBLES,Women,29,15,"Dinorah Ortíz Ruíz, Paulina Martinez Dominguez",,30-34,01:38:57
2025 Monterrey,HYROX PRO DOUBLES,Women,30,4,"Marcela Torres, Eliza Castañeda",,40-44,01:41:35
2025 Monterrey,HYROX PRO DOUBLES,Women,31,16,"Mitzi López, Dorabril López",,30-34,01:42:20
2025 Monterrey,HYROX PRO DOUBLES,Women,32,17,"Mckensie Stanton, Tazh Wilding",,30-34,01:45:56
2025 Monterrey,HYROX PRO DOUBLES,Women,33,18,"Iris Magaly Sánchez Cruz, Nancy Daniela García Martínez",,30-34,01:46:41
2025 Monterrey,HYROX PRO DOUBLES,Women,34,19,"Priscilla Darwin, Havilah Crider",,30-34,01:50:04
2025 Monterrey,HYROX PRO DOUBLES,Women,35,20,"Ana Maritza Sena Ramírez, Senyase Maribell Pérez Ramirez",,30-34,01:54:23
2025 Monterrey,HYROX PRO DOUBLES,Women,36,21,"Maritza Hincapié Uribe, Tania Mendicuti Martin",,30-34,01:57:44
2025 Monterrey,HYROX PRO DOUBLES,Women,37,22,"Maritza Gabriela Rivera Arizpe, Miriam Edith Vargas Rojas",,30-34,01:58:33
2025 Monterrey,HYROX PRO DOUBLES,Women,38,5,"Brenda Lisseth Flores Valdez, María Felisa Puente Valladares",,40-44,03:16:00
