Race,Division,Gender,Rank Overall,Rank Age Group,Name,Nation,Age Group,Total Time
2026 Amsterdam,HYROX PRO DOUBLES - Overall,Women,19,6,"Iris Bosch, Lienke De Jong",,30-34,01:05:04
2026 Amsterdam,HYROX PRO DOUBLES - Overall,Women,20,7,"Karolin Maucher, Karolin Hopp",,30-34,01:05:25
2026 Amsterdam,HYROX PRO DOUBLES - Overall,Women,21,3,"Anniken Løvaas, Malin Løvaas",,16-24,01:05:49
2026 Amsterdam,HYROX PRO DOUBLES - Overall,Women,22,2,"Marijke Van Den Brul, Mariska Vermeulen",,40-44,01:05:55
2026 Amsterdam,HYROX PRO DOUBLES - Overall,Women,23,4,"JEANINE KNIPE-CLAASSEN, ALTA JOUBERT",,35-39,01:05:59
2026 Amsterdam,HYROX PRO DOUBLES - Overall,Women,24,8,"Sophie Van Ameijde, Floor Van Ameijde",,30-34,01:06:01
2026 Amsterdam,HYROX PRO DOUBLES - Overall,Women,25,8,"Zola Zwerver, Annabelle Out",,25-29,01:06:17
2026 Amsterdam,HYROX PRO DOUBLES - Overall,Women,26,1,"Sandra Muller, Victoria Klaasse",,45-49,01:06:22
2026 Amsterdam,HYROX PRO DOUBLES - Overall,Women,27,9,"Carlijn Van Essen, Kim Warlicht",,25-29,01:06:22
2026 Amsterdam,HYROX PRO DOUBLES - Overall,Women,28,9,"Laura Stocksieker, Michaela Müller",,30-34,01:06:24
2026 Amsterdam,HYROX PRO DOUBLES - Overall,Women,29,10,"Anne Philipse, Sanne Cox",,25-29,01:06:44
2026 Amsterdam,HYROX PRO DOUBLES - Overall,Women,30,10,"Angelique Noor, Lobke Kok",,30-34,01:06:56
2026 Amsterdam,HYROX PRO DOUBLES - Overall,Women,31,11,"Britt Fleischeuer, Kyona Lacroix",,25-29,01:07:07
2026 Amsterdam,HYROX PRO DOUBLES - Overall,Women,32,5,"Déborah Nguyen, Elsa Casadesus",,35-39,01:07:20
2026 Amsterdam,HYROX PRO DOUBLES - Overall,Women,33,12,"Ana García, Alba Folgueiras",,25-29,01:07:35
2026 Amsterdam,HYROX PRO DOUBLES - Overall,Women,34,13,"Jaimy van Leeuwen, Melanie Van Rijn",,25-29,01:07:36
2026 Amsterdam,HYROX PRO DOUBLES - Overall,Women,35,11,"Ula Kamile Klebanovaite, Laura Klimaite",,30-34,01:07:45
2026 Amsterdam,HYROX PRO DOUBLES - Overall,Women,36,4,"Isobel Gardiner, Poppy Ellis",,16-24,01:07:45
2026 Amsterdam,HYROX PRO DOUBLES - Overall,Women,37,3,"Jeanette Thorell, Elise Johansson",,40-44,01:07:55
2026 Amsterdam,HYROX PRO DOUBLES - Overall,Women,38,12,"Anja Kroon, Linda De Waard",,30-34,01:08:04
2026 Amsterdam,HYROX PRO DOUBLES - Overall,Women,39,14,"Anne Rongen, Bo Ladru",,25-29,01:08:04
2026 Amsterdam,HYROX PRO DOUBLES - Overall,Women,40,4,"Anouk Ville, Hilke Van Der Pols",,40-44,01:08:06
2026 Amsterdam,HYROX PRO DOUBLES - Overall,Women,41,15,"Kim Van Griensven, Maaike Geerdink",,25-29,01:08:11
2026 Amsterdam,HYROX PRO DOUBLES - Overall,Women,42,16,"Isabella Meyer, Janin Steitz",,25-29,01:08:28
2026 Amsterdam,HYROX PRO DOUBLES - Overall,Women,43,17,"Andrea Marín Alonso, Eva Reboll",,25-29,01:08:32
2026 Amsterdam,HYROX PRO DOUBLES - Overall,Women,44,13,"Daniëlle Van Veen, Anne De Jong",,30-34,01:08:33
2026 Amsterdam,HYROX PRO DOUBLES - Overall,Women,45,18,"Gina Van Der Zanden, Josta Hofer",,25-29,01:08:35
2026 Amsterdam,HYROX PRO DOUBLES - Overall,Women,46,6,"Romy Hartog, Joyce Benders",,35-39,01:08:48
2026 Amsterdam,HYROX PRO DOUBLES - Overall,Women,47,14,"Steffie Klemann, Siviana Nahr",,30-34,01:09:02
2026 Amsterdam,HYROX PRO DOUBLES - Overall,Women,48,15,"Anoek Verdonck, Rijkje Hoiting",,30-34,01:09:02
2026 Amsterdam,HYROX PRO DOUBLES - Overall,Women,49,16,"Sophie Grönewald, Samantha Figueroa",,30-34,01:09:18
2026 Amsterdam,HYROX PRO DOUBLES - Overall,Women,50,5,"Mandy Op Den Oordt, Edith Pieters",,40-44,01:09:22
2026 Amsterdam,HYROX PRO DOUBLES - Overall,Women,51,17,"Alma Fenne, Yvette Willems",,30-34,01:09:26
2026 Amsterdam,HYROX PRO DOUBLES - Overall,Women,52,19,"Laura Kollmann, Ann-Kathrin Kundermann",,25-29,01:09:38
2026 Amsterdam,HYROX PRO DOUBLES - Overall,Women,53,20,"Sophie Bregen, Kim Anna Willenborg",,25-29,01:09:43
2026 Amsterdam,HYROX PRO DOUBLES - Overall,Women,54,21,"Katharina Langer, Louisa Messmer",,25-29,01:09:54
2026 Amsterdam,HYROX PRO DOUBLES - Overall,Women,55,22,"Florence Augath, Caterina Schacht",,25-29,01:09:54
2026 Amsterdam,HYROX PRO DOUBLES - Overall,Women,56,23,"Cristina Pecoraro, Nadège Coussement",,25-29,01:09:55
2026 Amsterdam,HYROX PRO DOUBLES - Overall,Women,57,24,"Silke Loverbosch, Luzan Janssen",,25-29,01:09:56
2026 Amsterdam,HYROX PRO DOUBLES - Overall,Women,58,7,"Sylke Jansen, Nienke Van Dijk",,35-39,01:09:58
2026 Amsterdam,HYROX PRO DOUBLES - Overall,Women,59,5,"Charlie Sinclair, Danni Sinclair",,16-24,01:10:05
2026 Amsterdam,HYROX PRO DOUBLES - Overall,Women,60,25,"Renske Van Os, Jessie Van Os",,25-29,01:10:10
2026 Amsterdam,HYROX PRO DOUBLES - Overall,Women,61,1,"Henrike Habuzin, Natalie Otten",,50-54,01:10:27
2026 Amsterdam,HYROX PRO DOUBLES - Overall,Women,62,6,"Laura Mackay, Cat Macleod",,40-44,01:10:27
2026 Amsterdam,HYROX PRO DOUBLES - Overall,Women,63,18,"Anna-Rita Vergari, Wissam Benadjaoud",,30-34,01:10:33
2026 Amsterdam,HYROX PRO DOUBLES - Overall,Women,64,26,"Sophie Pieterson, Anna Ruiter",,25-29,01:10:38
2026 Amsterdam,HYROX PRO DOUBLES - Overall,Women,65,2,"Liesbeth Lust, Henriette De Hoog",,45-49,01:10:45
2026 Amsterdam,HYROX PRO DOUBLES - Overall,Women,66,27,"Lyan Goltstein, Nina Timmermans",,25-29,01:10:50
2026 Amsterdam,HYROX PRO DOUBLES - Overall,Women,67,3,"KATIE PUPLETT, Katie Macaulay",,45-49,01:11:03
2026 Amsterdam,HYROX PRO DOUBLES - Overall,Women,68,28,"Franziska Ullrich, Lisa Marie Schmidt",,25-29,01:11:06
2026 Amsterdam,HYROX PRO DOUBLES - Overall,Women,69,19,"Pieternel Van Beek, Dominique Munten",,30-34,01:11:08
2026 Amsterdam,HYROX PRO DOUBLES - Overall,Women,70,20,"Sam Sanders, Rowena Boyes",,30-34,01:11:27
2026 Amsterdam,HYROX PRO DOUBLES - Overall,Women,71,6,"Elena Stachowski, Larissa Sophie Neukamm",,16-24,01:11:29
2026 Amsterdam,HYROX PRO DOUBLES - Overall,Women,72,29,"Romy Vervoorn, Charelle Van Lamoen",,25-29,01:11:35
2026 Amsterdam,HYROX PRO DOUBLES - Overall,Women,73,21,"Tamara Becker, Laura Thomanek",,30-34,01:11:38
2026 Amsterdam,HYROX PRO DOUBLES - Overall,Women,74,22,"Alexandra Staffensen, Ditte Hald",,30-34,01:11:39
2026 Amsterdam,HYROX PRO DOUBLES - Overall,Women,75,7,"Carolin Müller, Ute Steinhauer",,40-44,01:11:40
2026 Amsterdam,HYROX PRO DOUBLES - Overall,Women,76,8,"Patricia Van Der Meer - Willemse, Sascha Toppinga",,40-44,01:11:50
2026 Amsterdam,HYROX PRO DOUBLES - Overall,Women,77,30,"Mathilde Marie Erdahl Korsmo, Sina Haugland Myhrsveen",,25-29,01:12:09
2026 Amsterdam,HYROX PRO DOUBLES - Overall,Women,78,31,"Mellicia Tjoeng, Denice De Mul",,25-29,01:12:14
2026 Amsterdam,HYROX PRO DOUBLES - Overall,Women,79,8,"Natascha Shahbaziane, Nienke Tjalma",,35-39,01:12:15
2026 Amsterdam,HYROX PRO DOUBLES - Overall,Women,80,23,"Tess Oude Weernink, Eline Peterse",,30-34,01:12:19
2026 Amsterdam,HYROX PRO DOUBLES - Overall,Women,81,24,"Mette Busk Nielsen, Camilla Dyhrberg",,30-34,01:12:43
2026 Amsterdam,HYROX PRO DOUBLES - Overall,Women,82,9,"Marieke Haighton-Van Hemert, Tamara Van Der Ros-Jansen Holleboom",,40-44,01:12:53
2026 Amsterdam,HYROX PRO DOUBLES - Overall,Women,83,9,"Joan Alderliesten, Bobbie Rogerson",,35-39,01:12:56
2026 Amsterdam,HYROX PRO DOUBLES - Overall,Women,84,10,"Barbara Snaaijer, Myrthe Lockhorst",,35-39,01:13:04
2026 Amsterdam,HYROX PRO DOUBLES - Overall,Women,85,11,"Femke Bergsma, Maritha van Loon",,35-39,01:13:13
2026 Amsterdam,HYROX PRO DOUBLES - Overall,Women,86,32,"Sanne Vreekamp, May-Britt Verhoef",,25-29,01:13:15
2026 Amsterdam,HYROX PRO DOUBLES - Overall,Women,87,33,"Christel Van Der Ploeg, Carmen Prins",,25-29,01:13:18
2026 Amsterdam,HYROX PRO DOUBLES - Overall,Women,88,7,"Gwenllian Llwyd Jones, Tilly Johnson",,16-24,01:13:18
2026 Amsterdam,HYROX PRO DOUBLES - Overall,Women,89,1,"Isabelle Weibel Abid, Christiane Laubner",,55-59,01:13:18
2026 Amsterdam,HYROX PRO DOUBLES - Overall,Women,90,8,"Chiara Kok, Sanne Duijvestijn",,16-24,01:13:23
2026 Amsterdam,HYROX PRO DOUBLES - Overall,Women,91,2,"Wendy Bogers, Caroline Vos",,50-54,01:13:39
2026 Amsterdam,HYROX PRO DOUBLES - Overall,Women,92,25,"Esmée Meijer, Christina Mertens",,30-34,01:13:44
2026 Amsterdam,HYROX PRO DOUBLES - Overall,Women,93,34,"Laura De Beer, Nina Horneman",,25-29,01:13:50
2026 Amsterdam,HYROX PRO DOUBLES - Overall,Women,94,35,"Mijke Brand, Loïs Liem",,25-29,01:13:57
2026 Amsterdam,HYROX PRO DOUBLES - Overall,Women,95,12,"Bianca Snijder-Kok, Tamara Van Den Berg",,35-39,01:14:03
2026 Amsterdam,HYROX PRO DOUBLES - Overall,Women,96,9,"Marieke Hoekstra, Gwyneth Slijk",,16-24,01:14:17
2026 Amsterdam,HYROX PRO DOUBLES - Overall,Women,97,36,"Anouk Van Lanen, Esmee Florie",,25-29,01:14:23
2026 Amsterdam,HYROX PRO DOUBLES - Overall,Women,98,26,"Ramona Ratering, Jeanette Heimberger",,30-34,01:14:23
2026 Amsterdam,HYROX PRO DOUBLES - Overall,Women,99,37,"Sharon Schellingerhout, Anke Speerstra",,25-29,01:14:25
2026 Amsterdam,HYROX PRO DOUBLES - Overall,Women,100,10,"Floor Boschloo, Nico De Blonde",,16-24,01:14:30
2026 Amsterdam,HYROX PRO DOUBLES - Overall,Women,101,27,"Judith Spijksma, Sanne Haumersen",,30-34,01:14:32
2026 Amsterdam,HYROX PRO DOUBLES - Overall,Women,102,28,"Lucia Kaeller, Caroline Kistner",,30-34,01:14:32
2026 Amsterdam,HYROX PRO DOUBLES - Overall,Women,103,11,"Mia Servold Oppi, Stine Grov Harjar",,16-24,01:14:35
2026 Amsterdam,HYROX PRO DOUBLES - Overall,Women,104,29,"Angelina Beifuß, Natalie Heidt",,30-34,01:14:36
2026 Amsterdam,HYROX PRO DOUBLES - Overall,Women,105,38,"Wencke Josephine Süllwold, Jane Kersten",,25-29,01:14:37
2026 Amsterdam,HYROX PRO DOUBLES - Overall,Women,106,30,"Evelien Roelands, Nina Pover",,30-34,01:14:40
2026 Amsterdam,HYROX PRO DOUBLES - Overall,Women,107,31,"Shelley Van Den Tempel, Noëlle Van Den Boom",,30-34,01:14:56
2026 Amsterdam,HYROX PRO DOUBLES - Overall,Women,108,13,"Jennifer Faveeuw, Sandy Spitale Chevet",,35-39,01:15:01
2026 Amsterdam,HYROX PRO DOUBLES - Overall,Women,109,3,"Ira Keuter, Bekira Sinanovic",,50-54,01:15:01
2026 Amsterdam,HYROX PRO DOUBLES - Overall,Women,110,32,"Anna Harms, Amke Huisinga-Meyer",,30-34,01:15:14
2026 Amsterdam,HYROX PRO DOUBLES - Overall,Women,111,39,"Marloes Metselaar, Esmee Tijssen",,25-29,01:15:15
2026 Amsterdam,HYROX PRO DOUBLES - Overall,Women,112,10,"Jeanette Bergersen, Wenche Setsaas",,40-44,01:15:17
2026 Amsterdam,HYROX PRO DOUBLES - Overall,Women,113,14,"Chantal Sterk, Lizette Van Wasbeek",,35-39,01:15:27
2026 Amsterdam,HYROX PRO DOUBLES - Overall,Women,114,40,"Hana Jezberova, Sarah Grunbauer",,25-29,01:15:28
2026 Amsterdam,HYROX PRO DOUBLES - Overall,Women,115,41,"Floor Gaasbeek, Anne Kooijman",,25-29,01:15:40
2026 Amsterdam,HYROX PRO DOUBLES - Overall,Women,116,15,"Sacha Farber, Shana Hasson",,35-39,01:15:58
2026 Amsterdam,HYROX PRO DOUBLES - Overall,Women,117,42,"Nicole Leinberger, Paula Freudenberger",,25-29,01:16:14
2026 Amsterdam,HYROX PRO DOUBLES - Overall,Women,118,43,"Zoï Dam, Jessica Pearson",,25-29,01:16:15
2026 Amsterdam,HYROX PRO DOUBLES - Overall,Women,119,33,"Janneke Van Setten, Anne Van Wijngaarden",,30-34,01:16:22
2026 Amsterdam,HYROX PRO DOUBLES - Overall,Women,120,34,"Kira Lübke, Leonie Beek",,30-34,01:16:25
2026 Amsterdam,HYROX PRO DOUBLES - Overall,Women,121,12,"Katharina Koch, Jula Wiemers",,16-24,01:16:26
2026 Amsterdam,HYROX PRO DOUBLES - Overall,Women,122,11,"Carlot Verloop, Kuna Van Der Kolk",,40-44,01:16:28
2026 Amsterdam,HYROX PRO DOUBLES - Overall,Women,123,12,"Daphne Steur, Dagmar Boskma",,40-44,01:16:28
2026 Amsterdam,HYROX PRO DOUBLES - Overall,Women,124,16,"Kathrin Lisken, Caroline Polzin",,35-39,01:16:29
2026 Amsterdam,HYROX PRO DOUBLES - Overall,Women,125,35,"Sabrina Triebess, Katinka Graw",,30-34,01:16:45
2026 Amsterdam,HYROX PRO DOUBLES - Overall,Women,126,36,"Danielle Riezebos, Tessa Nieuwenhuis",,30-34,01:16:48
2026 Amsterdam,HYROX PRO DOUBLES - Overall,Women,127,37,"Merel Geilvoet, Romy Van Pelt",,30-34,01:16:55
2026 Amsterdam,HYROX PRO DOUBLES - Overall,Women,128,38,"Britta Naatz, Lorena Haist",,30-34,01:17:07
2026 Amsterdam,HYROX PRO DOUBLES - Overall,Women,129,17,"Rebecca Botin Bach, Michelle Bodil Bøgelund Madsen",,35-39,01:17:17
2026 Amsterdam,HYROX PRO DOUBLES - Overall,Women,130,39,"Cassandra Drouin, Jade Gagne",,30-34,01:17:33
2026 Amsterdam,HYROX PRO DOUBLES - Overall,Women,131,44,"Kate English, Deirbhile Fitzgerald",,25-29,01:17:34
2026 Amsterdam,HYROX PRO DOUBLES - Overall,Women,132,13,"Milena Beute, Gabriella Herrero Dos Santos",,16-24,01:17:41
2026 Amsterdam,HYROX PRO DOUBLES - Overall,Women,133,45,"Rebecca Van Der Beets, Lena Keil",,25-29,01:17:42
2026 Amsterdam,HYROX PRO DOUBLES - Overall,Women,134,40,"Antonia Witthaus, Melina Overhoff-Bühnen",,30-34,01:17:52
2026 Amsterdam,HYROX PRO DOUBLES - Overall,Women,135,46,"Annemieke Van Vliet, Juliette Priester",,25-29,01:18:07
2026 Amsterdam,HYROX PRO DOUBLES - Overall,Women,136,41,"Maud Van De Ven, Vera Jongejan",,30-34,01:18:14
2026 Amsterdam,HYROX PRO DOUBLES - Overall,Women,137,18,"Ilona Evers, Gerdien Aaftink",,35-39,01:18:19
2026 Amsterdam,HYROX PRO DOUBLES - Overall,Women,138,47,"Ezgi Korkmaz, Liz Van Hilst",,25-29,01:18:35
2026 Amsterdam,HYROX PRO DOUBLES - Overall,Women,139,42,"Estelle Lerouge, Justine Guillemet",,30-34,01:18:41
2026 Amsterdam,HYROX PRO DOUBLES - Overall,Women,140,48,"Daphne Peeters, Frederique Te Riele",,25-29,01:18:47
2026 Amsterdam,HYROX PRO DOUBLES - Overall,Women,141,49,"Tomke Brüling, Imke Miener",,25-29,01:19:01
2026 Amsterdam,HYROX PRO DOUBLES - Overall,Women,142,13,"Mirte Leloup, Dagmar Manuhuwa",,40-44,01:19:10
2026 Amsterdam,HYROX PRO DOUBLES - Overall,Women,143,19,"Lisa Kwakernaat, Jitske Huisman",,35-39,01:19:11
2026 Amsterdam,HYROX PRO DOUBLES - Overall,Women,144,14,"Froukje Blokker, Isabel Vogel",,40-44,01:19:14
2026 Amsterdam,HYROX PRO DOUBLES - Overall,Women,145,43,"Marit Beerends, Joska Koch",,30-34,01:19:17
2026 Amsterdam,HYROX PRO DOUBLES - Overall,Women,146,4,"Odette Zwanikken, Nadia Kooistra",,45-49,01:19:20
2026 Amsterdam,HYROX PRO DOUBLES - Overall,Women,147,20,"Manel Lamine, Daphné Launay",,35-39,01:19:27
2026 Amsterdam,HYROX PRO DOUBLES - Overall,Women,148,44,"Maude Guillou, Elodie Dewez",,30-34,01:19:37
2026 Amsterdam,HYROX PRO DOUBLES - Overall,Women,149,21,"Laura Ruano Amengual, Maria Estevez Reguera",,35-39,01:19:37
2026 Amsterdam,HYROX PRO DOUBLES - Overall,Women,150,45,"Charella Van Oosterhout, Tamara Baauw",,30-34,01:20:05
2026 Amsterdam,HYROX PRO DOUBLES - Overall,Women,151,22,"Katja America, Linda Stevens - Peeters",,35-39,01:20:22
2026 Amsterdam,HYROX PRO DOUBLES - Overall,Women,152,46,"Wiebke Krampitz, Nina Kilgast",,30-34,01:20:23
2026 Amsterdam,HYROX PRO DOUBLES - Overall,Women,153,50,"Fleur Den Broeder, Almaz Brom",,25-29,01:20:25
2026 Amsterdam,HYROX PRO DOUBLES - Overall,Women,154,51,"Kerry Chawko, Emily Sutton",,25-29,01:20:31
2026 Amsterdam,HYROX PRO DOUBLES - Overall,Women,155,47,"Kristin Schmidkunz, Fiona Schmidkunz",,30-34,01:20:40
2026 Amsterdam,HYROX PRO DOUBLES - Overall,Women,156,23,"Renate Steenvoorden, Ilja Botman",,35-39,01:20:52
2026 Amsterdam,HYROX PRO DOUBLES - Overall,Women,157,48,"Léa Thourain, Marine Nicoli",,30-34,01:21:00
2026 Amsterdam,HYROX PRO DOUBLES - Overall,Women,158,49,"Anne-Will De Krieger, Mary-Linde De Krieger",,30-34,01:21:01
2026 Amsterdam,HYROX PRO DOUBLES - Overall,Women,159,15,"Ilka Stüwe, Kristin Wesenberg",,40-44,01:21:21
2026 Amsterdam,HYROX PRO DOUBLES - Overall,Women,160,52,"Charlotte Pürzel, Elisa Neering",,25-29,01:21:26
2026 Amsterdam,HYROX PRO DOUBLES - Overall,Women,161,53,"Madita Rudloff, Celina Wübbe",,25-29,01:21:31
2026 Amsterdam,HYROX PRO DOUBLES - Overall,Women,162,16,"Klien Van Den Broek, Carla Van Lier",,40-44,01:21:39
2026 Amsterdam,HYROX PRO DOUBLES - Overall,Women,163,54,"Isabelle Rustenburg, Megan Tolner",,25-29,01:21:49
2026 Amsterdam,HYROX PRO DOUBLES - Overall,Women,164,50,"Jana Wilwerscheid, Lena Schulte-Henrich",,30-34,01:21:57
2026 Amsterdam,HYROX PRO DOUBLES - Overall,Women,165,14,"Isa Van ‘T Hul, Esther Beekman",,16-24,01:22:15
2026 Amsterdam,HYROX PRO DOUBLES - Overall,Women,166,55,"Lara Lauren Tillessen, Annalena Engel",,25-29,01:22:22
2026 Amsterdam,HYROX PRO DOUBLES - Overall,Women,167,5,"Meike Thurz, Katharina Smerd",,45-49,01:22:36
2026 Amsterdam,HYROX PRO DOUBLES - Overall,Women,168,24,"Magdalena Seuren, Sinah Borsch",,35-39,01:22:48
2026 Amsterdam,HYROX PRO DOUBLES - Overall,Women,169,51,"Marlies Oosterveld, Kaylee Wessels",,30-34,01:22:49
2026 Amsterdam,HYROX PRO DOUBLES - Overall,Women,170,15,"Fenne Van Son, Jamy De Kok",,16-24,01:22:50
2026 Amsterdam,HYROX PRO DOUBLES - Overall,Women,171,16,"Yara Groefsema, Charlotte Hoogakker",,16-24,01:22:50
2026 Amsterdam,HYROX PRO DOUBLES - Overall,Women,172,17,"Quinty Langedijk, Evy Van Den Wildenberg",,16-24,01:23:00
2026 Amsterdam,HYROX PRO DOUBLES - Overall,Women,173,52,"Annelise Stander, Shanna Janssen",,30-34,01:23:12
2026 Amsterdam,HYROX PRO DOUBLES - Overall,Women,174,4,"Elke Zamani, Maria Remenyuk",,50-54,01:23:18
2026 Amsterdam,HYROX PRO DOUBLES - Overall,Women,175,53,"Lara-Maria Klewin, Milena-Janika Müller",,30-34,01:23:21
2026 Amsterdam,HYROX PRO DOUBLES - Overall,Women,176,17,"Yeliz Kaya, Yvonne Buchner",,40-44,01:23:22
2026 Amsterdam,HYROX PRO DOUBLES - Overall,Women,177,25,"Patricia Arends, Krista Rijnhart",,35-39,01:23:29
2026 Amsterdam,HYROX PRO DOUBLES - Overall,Women,178,6,"Vera Den Hoedt, Lon Van Rijn",,45-49,01:23:29
2026 Amsterdam,HYROX PRO DOUBLES - Overall,Women,179,18,"Renee De Vries, Rowana Proost",,40-44,01:23:33
2026 Amsterdam,HYROX PRO DOUBLES - Overall,Women,180,56,"Coraline Dardenne, Laure Guillaume",,25-29,01:23:36
2026 Amsterdam,HYROX PRO DOUBLES - Overall,Women,181,7,"Saskia Brauer, Alexandra Kusenberg",,45-49,01:23:37
2026 Amsterdam,HYROX PRO DOUBLES - Overall,Women,182,57,"Lisa Butter, Varkenka Koelemeij",,25-29,01:23:41
2026 Amsterdam,HYROX PRO DOUBLES - Overall,Women,183,19,"Aylin Verburg, Vera Siera",,40-44,01:23:50
2026 Amsterdam,HYROX PRO DOUBLES - Overall,Women,184,26,"Lydie Van Der Thiel, Danielle Van Otterlo",,35-39,01:23:50
2026 Amsterdam,HYROX PRO DOUBLES - Overall,Women,185,58,"Saskia Veldhoven, Mylene Keizer",,25-29,01:23:53
2026 Amsterdam,HYROX PRO DOUBLES - Overall,Women,186,27,"Priscila Soares, Maartje De Goede",,35-39,01:23:59
2026 Amsterdam,HYROX PRO DOUBLES - Overall,Women,187,20,"Jodie Fry, Rosie Doyle",,40-44,01:24:00
2026 Amsterdam,HYROX PRO DOUBLES - Overall,Women,188,59,"Merel Van Munster, Ilse Van Beusekom",,25-29,01:24:05
2026 Amsterdam,HYROX PRO DOUBLES - Overall,Women,189,60,"Emma Van Duijvenvoorde, Tessa Van Delft",,25-29,01:24:20
2026 Amsterdam,HYROX PRO DOUBLES - Overall,Women,190,54,"Manon Tasiaux, Hind Salim",,30-34,01:24:24
2026 Amsterdam,HYROX PRO DOUBLES - Overall,Women,191,55,"Laura Brion, Aline Planchon",,30-34,01:24:25
2026 Amsterdam,HYROX PRO DOUBLES - Overall,Women,192,21,"Louise Aagaard Jensen, Eline Meijer",,40-44,01:24:33
2026 Amsterdam,HYROX PRO DOUBLES - Overall,Women,193,61,"Daniëlle Janssen, Lyenne Vaassen",,25-29,01:24:43
2026 Amsterdam,HYROX PRO DOUBLES - Overall,Women,194,18,"Milla Weidijk, Sophie De Groot",,16-24,01:24:45
2026 Amsterdam,HYROX PRO DOUBLES - Overall,Women,195,22,"Marjolijn Hendriks, Aria Vooijs",,40-44,01:24:50
2026 Amsterdam,HYROX PRO DOUBLES - Overall,Women,196,62,"Hendrika Hoekstra, Eline Van Keulen",,25-29,01:25:10
2026 Amsterdam,HYROX PRO DOUBLES - Overall,Women,197,63,"Marilene Gout, Tirza Nieuwdorp",,25-29,01:25:16
2026 Amsterdam,HYROX PRO DOUBLES - Overall,Women,198,23,"Ingeborg Trul, Hanneke Eleveld",,40-44,01:25:16
2026 Amsterdam,HYROX PRO DOUBLES - Overall,Women,199,24,"Shirley Sotthewes - Kleine, Layla Cimen",,40-44,01:25:25
2026 Amsterdam,HYROX PRO DOUBLES - Overall,Women,200,25,"Mélanie De Groot, Lysanne De Bruin",,40-44,01:25:40
2026 Amsterdam,HYROX PRO DOUBLES - Overall,Women,201,28,"Marloes Blekkink, Shanna Klein Geltink",,35-39,01:25:52
2026 Amsterdam,HYROX PRO DOUBLES - Overall,Women,202,56,"Marlies Van Beers, Cilla Knook",,30-34,01:25:58
2026 Amsterdam,HYROX PRO DOUBLES - Overall,Women,203,57,"Sanne Van Schuppen, Nathalie Van Schuppen - Jeras",,30-34,01:26:34
2026 Amsterdam,HYROX PRO DOUBLES - Overall,Women,204,26,"Judith Damen, Veronique Ras",,40-44,01:26:38
2026 Amsterdam,HYROX PRO DOUBLES - Overall,Women,205,64,"Wiona Wintterlin, Emily Eilers",,25-29,01:26:39
2026 Amsterdam,HYROX PRO DOUBLES - Overall,Women,206,19,"Maud Droog, Resi Bakker",,16-24,01:26:47
2026 Amsterdam,HYROX PRO DOUBLES - Overall,Women,207,8,"Roelanda Roper, Alice Schipper-Houwer",,45-49,01:27:11
2026 Amsterdam,HYROX PRO DOUBLES - Overall,Women,208,20,"Renée Pronk, Lonneke Weel",,16-24,01:27:32
2026 Amsterdam,HYROX PRO DOUBLES - Overall,Women,209,65,"Kim Looijenga, Kai Middelkoop",,25-29,01:27:32
2026 Amsterdam,HYROX PRO DOUBLES - Overall,Women,210,27,"Jennifer Schut, Nicole Koenen",,40-44,01:27:52
2026 Amsterdam,HYROX PRO DOUBLES - Overall,Women,211,66,"Kirsten Ebeltjes, Marli Tiemersma",,25-29,01:27:59
2026 Amsterdam,HYROX PRO DOUBLES - Overall,Women,212,29,"Line Mørkholt-Haaning, Rikke Bundgaard",,35-39,01:28:00
2026 Amsterdam,HYROX PRO DOUBLES - Overall,Women,213,30,"Marianne Van Beek, Antoinette Abbing",,35-39,01:28:42
2026 Amsterdam,HYROX PRO DOUBLES - Overall,Women,214,28,"Harriet Hardy, Natalie Seymour",,40-44,01:28:53
2026 Amsterdam,HYROX PRO DOUBLES - Overall,Women,215,21,"Fleur Gerritsen, Pien Gerritsen",,16-24,01:29:30
2026 Amsterdam,HYROX PRO DOUBLES - Overall,Women,216,58,"Yulia De Veer, Myranda Maas",,30-34,01:29:34
2026 Amsterdam,HYROX PRO DOUBLES - Overall,Women,217,67,"Robin Deuss, Jessie Eijkenboom",,25-29,01:29:50
2026 Amsterdam,HYROX PRO DOUBLES - Overall,Women,218,22,"Zara Konstapel, Stephanie Schoemans",,16-24,01:30:07
2026 Amsterdam,HYROX PRO DOUBLES - Overall,Women,219,59,"Anna Berlekamp, Celine Feldmeier",,30-34,01:30:50
2026 Amsterdam,HYROX PRO DOUBLES - Overall,Women,220,60,"Debby Bakker, Julia Van Rijen",,30-34,01:30:53
2026 Amsterdam,HYROX PRO DOUBLES - Overall,Women,221,68,"Daniëlle Zandbergen, Esmee Van Uum",,25-29,01:31:39
2026 Amsterdam,HYROX PRO DOUBLES - Overall,Women,222,29,"Amy Bovelander, Michela Van der Heijden",,40-44,01:31:51
2026 Amsterdam,HYROX PRO DOUBLES - Overall,Women,223,9,"Tracy Maitland, Claire Paris",,45-49,01:33:02
2026 Amsterdam,HYROX PRO DOUBLES - Overall,Women,224,30,"Latoya Romney, Nina Vlasova",,40-44,01:33:27
2026 Amsterdam,HYROX PRO DOUBLES - Overall,Women,225,23,"Hilde Leenaars, Renske Leenaars",,16-24,01:33:37
2026 Amsterdam,HYROX PRO DOUBLES - Overall,Women,226,69,"Gergana Nikolova, Savina Chergarova",,25-29,01:34:57
2026 Amsterdam,HYROX PRO DOUBLES - Overall,Women,227,61,"Nanda Elsinghorst, Diede Wiggers",,30-34,01:34:59
2026 Amsterdam,HYROX PRO DOUBLES - Overall,Women,228,10,"Linda Umlauf, Ellen Sylla-De Jonge",,45-49,01:35:04
2026 Amsterdam,HYROX PRO DOUBLES - Overall,Women,229,31,"Levi Rijks, Nicole Rijks-Van Den Heuvel",,40-44,01:35:11
2026 Amsterdam,HYROX PRO DOUBLES - Overall,Women,230,24,"Jilly Buitenhuis, Luna Booij",,16-24,01:36:07
2026 Amsterdam,HYROX PRO DOUBLES - Overall,Women,231,62,"Anna Hettwer-Kappenberg, Laura Rigterink",,30-34,01:36:26
2026 Amsterdam,HYROX PRO DOUBLES - Overall,Women,232,25,"Gladys Lebouc, Nina Lebreton",,16-24,01:36:26
2026 Amsterdam,HYROX PRO DOUBLES - Overall,Women,233,70,"Madelief Bikker, Franka Wilhelmina Visser",,25-29,01:36:55
2026 Amsterdam,HYROX PRO DOUBLES - Overall,Women,234,32,"Monika May, Mandy Deiters",,40-44,01:38:40
2026 Amsterdam,HYROX PRO DOUBLES - Overall,Women,235,31,"Salomé Claeyssen, Aurelia Louis-Sidney",,35-39,01:38:44
2026 Amsterdam,HYROX PRO DOUBLES - Overall,Women,236,26,"Alie Martin, Martyna Szmagara",,16-24,01:40:00
2026 Amsterdam,HYROX PRO DOUBLES - Overall,Women,237,27,"Ikram Mataich, Intissar Mataich",,16-24,01:40:27
2026 Amsterdam,HYROX PRO DOUBLES - Overall,Women,238,63,"Yara Van Rossem, Kim Bakker",,30-34,01:44:05
2026 Amsterdam,HYROX PRO DOUBLES - Overall,Women,239,32,"Aukje De Graaf, Sophie Laubert",,35-39,01:44:55
2026 Amsterdam,HYROX PRO DOUBLES - Overall,Women,240,33,"Janny Teensma, Bianca De Jong-Muhren",,40-44,01:45:17
2026 Amsterdam,HYROX PRO DOUBLES - Overall,Women,241,11,"Bianca Fuhrmann, Isabell Creus Martinez",,45-49,01:47:01
2026 Amsterdam,HYROX PRO DOUBLES - Overall,Women,242,33,"Bianca Mattheussen, Evelien Ducheyne",,35-39,01:48:08
2026 Amsterdam,HYROX PRO DOUBLES - Overall,Women,243,34,"Dianne Van Beek, Lotte Kok",,35-39,01:51:25
2026 Amsterdam,HYROX PRO DOUBLES - Overall,Women,244,34,"Bianca Grelle, Christina Cosby",,40-44,01:51:48
2026 Amsterdam,HYROX PRO DOUBLES - Overall,Women,245,35,"Renee Schut, Maria Serban",,35-39,01:51:55
2026 Amsterdam,HYROX PRO DOUBLES - Overall,Women,246,28,"Hannah Van Der Ploeg, Bente Mulder",,16-24,02:04:06
2026 Amsterdam,HYROX PRO DOUBLES - Overall,Women,247,64,"Chantelle Haye, Natasha Haye",,30-34,02:04:16
2026 Amsterdam,HYROX PRO DOUBLES - Overall,Women,248,36,"Melissa Van Dort, Marjolein De Reus",,35-39,02:11:20
