Race,Division,Gender,Rank Overall,Rank Age Group,Name,Nation,Age Group,Total Time
2026 Amsterdam,HYROX PRO DOUBLES - Overall,Men,254,89,"Maurice Morel, Melvin Root",,30-34,01:07:18
2026 Amsterdam,HYROX PRO DOUBLES - Overall,Men,255,90,"Bart Geurts, Pim Geurts",,30-34,01:07:23
2026 Amsterdam,HYROX PRO DOUBLES - Overall,Men,256,26,"Niek Paans, Yge Paans",,16-24,01:07:27
2026 Amsterdam,HYROX PRO DOUBLES - Overall,Men,257,91,"Kevin Weijers, Jesse Van Der Zwet",,30-34,01:07:29
2026 Amsterdam,HYROX PRO DOUBLES - Overall,Men,258,92,"Roel Ghielen, Mark Van Berlo",,30-34,01:07:38
2026 Amsterdam,HYROX PRO DOUBLES - Overall,Men,259,56,"Arjan Groen In 'T Woud, Bart Zwijsen",,25-29,01:07:42
2026 Amsterdam,HYROX PRO DOUBLES - Overall,Men,260,50,"Frenk Weber, Randy Duin",,35-39,01:07:50
2026 Amsterdam,HYROX PRO DOUBLES - Overall,Men,261,93,"Stefan Pavleski, Max Verres",,30-34,01:07:53
2026 Amsterdam,HYROX PRO DOUBLES - Overall,Men,262,94,"Axel Freon, Bastien Teixeira",,30-34,01:07:55
2026 Amsterdam,HYROX PRO DOUBLES - Overall,Men,263,24,"Darius Macijauskas, Alvin Mateo",,40-44,01:08:02
2026 Amsterdam,HYROX PRO DOUBLES - Overall,Men,264,95,"Pieter Aernouts, Brent Luyckx",,30-34,01:08:02
2026 Amsterdam,HYROX PRO DOUBLES - Overall,Men,265,96,"Tom Bakker, Leon Monart",,30-34,01:08:07
2026 Amsterdam,HYROX PRO DOUBLES - Overall,Men,266,97,"Chris De Pree, Martijn Wierenga",,30-34,01:08:10
2026 Amsterdam,HYROX PRO DOUBLES - Overall,Men,267,98,"Julian Van Den Bosch, Olivier Schoemaker",,30-34,01:08:13
2026 Amsterdam,HYROX PRO DOUBLES - Overall,Men,268,27,"Job Andreae, Dinand Andringa",,16-24,01:08:15
2026 Amsterdam,HYROX PRO DOUBLES - Overall,Men,269,6,"Jason Stone, Paul Atkins",,50-54,01:08:18
2026 Amsterdam,HYROX PRO DOUBLES - Overall,Men,270,51,"Robin Yu, Tonny Ye",,35-39,01:08:22
2026 Amsterdam,HYROX PRO DOUBLES - Overall,Men,271,52,"Derek Gambrah, Ricky Breidel",,35-39,01:08:25
2026 Amsterdam,HYROX PRO DOUBLES - Overall,Men,272,57,"Leon Pijning, Stijn Savelsbergh",,25-29,01:08:27
2026 Amsterdam,HYROX PRO DOUBLES - Overall,Men,273,53,"Alexander Nørskov, Jesper Bentley Ditlevsen",,35-39,01:08:33
2026 Amsterdam,HYROX PRO DOUBLES - Overall,Men,274,28,"Bram Engelbertink, Daan Engelbertink",,16-24,01:08:40
2026 Amsterdam,HYROX PRO DOUBLES - Overall,Men,275,99,"Pablo Carnero Kheo-Kao, Dalton James Yeomans",,30-34,01:08:40
2026 Amsterdam,HYROX PRO DOUBLES - Overall,Men,276,58,"Sem Menzinga, Kelvin Hu",,25-29,01:08:47
2026 Amsterdam,HYROX PRO DOUBLES - Overall,Men,277,54,"Peter Groothand, Martijn Van De Sluis",,35-39,01:08:51
2026 Amsterdam,HYROX PRO DOUBLES - Overall,Men,278,100,"Danny Gillie, Liam Gillie",,30-34,01:08:52
2026 Amsterdam,HYROX PRO DOUBLES - Overall,Men,279,59,"Stefan Kies, Peter Schlötter",,25-29,01:09:02
2026 Amsterdam,HYROX PRO DOUBLES - Overall,Men,280,101,"Jedd Goldcwajg, Sam Cohen",,30-34,01:09:05
2026 Amsterdam,HYROX PRO DOUBLES - Overall,Men,281,25,"Martin Stroo, Gilian Geschiere",,40-44,01:09:05
2026 Amsterdam,HYROX PRO DOUBLES - Overall,Men,282,55,"Max Both, Evert Jan Dekens",,35-39,01:09:07
2026 Amsterdam,HYROX PRO DOUBLES - Overall,Men,283,26,"Bob Koning, Wouter Lastdrager",,40-44,01:09:10
2026 Amsterdam,HYROX PRO DOUBLES - Overall,Men,284,60,"Bram Van Slagmaat, Lieuwe Zeldenrust",,25-29,01:09:12
2026 Amsterdam,HYROX PRO DOUBLES - Overall,Men,285,61,"Danny Holtus, Alexander Leonard Veldhuizen",,25-29,01:09:15
2026 Amsterdam,HYROX PRO DOUBLES - Overall,Men,286,9,"Ramon Thijssen, Ralph Thijssen",,45-49,01:09:16
2026 Amsterdam,HYROX PRO DOUBLES - Overall,Men,287,102,"Rens Van Der Spek, Bart De Groot",,30-34,01:09:18
2026 Amsterdam,HYROX PRO DOUBLES - Overall,Men,288,103,"Yannick Rave, Laurens Kersbergen",,30-34,01:09:19
2026 Amsterdam,HYROX PRO DOUBLES - Overall,Men,289,104,"Dimitri Van Den Hoed, Dion Van Welie",,30-34,01:09:21
2026 Amsterdam,HYROX PRO DOUBLES - Overall,Men,290,56,"Arno Van Beest, Dennis Kloppenburg",,35-39,01:09:24
2026 Amsterdam,HYROX PRO DOUBLES - Overall,Men,291,62,"Djordy Dijkgraaf, Nick Mol",,25-29,01:09:24
2026 Amsterdam,HYROX PRO DOUBLES - Overall,Men,292,29,"Julian Van Ooijen, Tijn Damen",,16-24,01:09:30
2026 Amsterdam,HYROX PRO DOUBLES - Overall,Men,293,7,"Dave Kelly, Matt Minter",,50-54,01:09:37
2026 Amsterdam,HYROX PRO DOUBLES - Overall,Men,294,10,"Kashif Kasanwirdjo, Jermain Breidel",,45-49,01:09:39
2026 Amsterdam,HYROX PRO DOUBLES - Overall,Men,295,105,"Thomas De Graaf, Tim Bouwmeester",,30-34,01:09:43
2026 Amsterdam,HYROX PRO DOUBLES - Overall,Men,296,63,"Stijn Hendriks, Niek Derks",,25-29,01:09:47
2026 Amsterdam,HYROX PRO DOUBLES - Overall,Men,297,64,"Петар Раковић, Стеван Станковић",,25-29,01:09:48
2026 Amsterdam,HYROX PRO DOUBLES - Overall,Men,298,30,"Dax Van Kempen, Milan Rojo",,16-24,01:09:49
2026 Amsterdam,HYROX PRO DOUBLES - Overall,Men,299,27,"Peter Freriks, Hans Van Zalen",,40-44,01:09:49
2026 Amsterdam,HYROX PRO DOUBLES - Overall,Men,300,65,"Edo Herrera, Pieter Pols",,25-29,01:09:49
2026 Amsterdam,HYROX PRO DOUBLES - Overall,Men,301,57,"Frank Bons, Nick De Zeeuw",,35-39,01:09:52
2026 Amsterdam,HYROX PRO DOUBLES - Overall,Men,302,66,"Tobias Hippe, Marcel Seitz",,25-29,01:09:56
2026 Amsterdam,HYROX PRO DOUBLES - Overall,Men,303,58,"Boy Viring, Arnaud Bal",,35-39,01:09:58
2026 Amsterdam,HYROX PRO DOUBLES - Overall,Men,304,106,"Antoine Redon, Maxime Mariano",,30-34,01:09:59
2026 Amsterdam,HYROX PRO DOUBLES - Overall,Men,305,59,"Jozua Van Leerdam, Benjamin De Nijs",,35-39,01:10:05
2026 Amsterdam,HYROX PRO DOUBLES - Overall,Men,306,67,"Dylan Justin Vork, Tim Van Welie",,25-29,01:10:10
2026 Amsterdam,HYROX PRO DOUBLES - Overall,Men,307,107,"Arran Sweetman, Stephen Brown",,30-34,01:10:13
2026 Amsterdam,HYROX PRO DOUBLES - Overall,Men,308,31,"Tim Schut, Wesley Den Hollander",,16-24,01:10:19
2026 Amsterdam,HYROX PRO DOUBLES - Overall,Men,309,108,"Tom Webb, David Gray",,30-34,01:10:19
2026 Amsterdam,HYROX PRO DOUBLES - Overall,Men,310,109,"Edward Appiah, Maxime Monfort",,30-34,01:10:20
2026 Amsterdam,HYROX PRO DOUBLES - Overall,Men,311,28,"Tim Wiering, John Van Keulem",,40-44,01:10:21
2026 Amsterdam,HYROX PRO DOUBLES - Overall,Men,312,11,"Peter Blaha, Ako Rahim",,45-49,01:10:33
2026 Amsterdam,HYROX PRO DOUBLES - Overall,Men,313,29,"Henrik Moning, Lars Franke",,40-44,01:10:36
2026 Amsterdam,HYROX PRO DOUBLES - Overall,Men,314,110,"Tilo Kaiser, Benne Weidig",,30-34,01:10:38
2026 Amsterdam,HYROX PRO DOUBLES - Overall,Men,315,68,"Jelle Van der Kruijs, Sem Bakkes",,25-29,01:10:40
2026 Amsterdam,HYROX PRO DOUBLES - Overall,Men,316,60,"Dennis Treichel, Tobias Reger",,35-39,01:10:41
2026 Amsterdam,HYROX PRO DOUBLES - Overall,Men,317,30,"Jacobus Jong, Hitiri Turner",,40-44,01:10:44
2026 Amsterdam,HYROX PRO DOUBLES - Overall,Men,318,111,"Joel Sjouerman, Imme Bertens",,30-34,01:10:46
2026 Amsterdam,HYROX PRO DOUBLES - Overall,Men,319,69,"Nino Van Der Velde, Menno Galama",,25-29,01:10:49
2026 Amsterdam,HYROX PRO DOUBLES - Overall,Men,320,32,"Sami Atek, Karim Nessah",,16-24,01:10:58
2026 Amsterdam,HYROX PRO DOUBLES - Overall,Men,321,70,"Christian Bron, Rene Mellema",,25-29,01:11:00
2026 Amsterdam,HYROX PRO DOUBLES - Overall,Men,322,61,"Michael Van Dijk, Menno Tigchelaar",,35-39,01:11:01
2026 Amsterdam,HYROX PRO DOUBLES - Overall,Men,323,112,"Houssem Ghazouani, Vincent Cohen",,30-34,01:11:04
2026 Amsterdam,HYROX PRO DOUBLES - Overall,Men,324,62,"Bertwin Prins, Thijmen Kraaijeveld",,35-39,01:11:07
2026 Amsterdam,HYROX PRO DOUBLES - Overall,Men,325,113,"Martijn Marinus, Thomas Van Leeuwen",,30-34,01:11:13
2026 Amsterdam,HYROX PRO DOUBLES - Overall,Men,326,71,"Mannes Borren, Martijn Moorlag",,25-29,01:11:14
2026 Amsterdam,HYROX PRO DOUBLES - Overall,Men,327,72,"Nick Ouwerkerk, Jerry Meeles",,25-29,01:11:23
2026 Amsterdam,HYROX PRO DOUBLES - Overall,Men,328,63,"Bhodi Lesage, Nick Sweertman",,35-39,01:11:23
2026 Amsterdam,HYROX PRO DOUBLES - Overall,Men,329,31,"Douwe Talma, Patrick Veenstra",,40-44,01:11:24
2026 Amsterdam,HYROX PRO DOUBLES - Overall,Men,330,64,"Gilson Ferreira, Kevin Kasbergen",,35-39,01:11:26
2026 Amsterdam,HYROX PRO DOUBLES - Overall,Men,331,65,"Bram Schreurs, Jeroen Brouwers",,35-39,01:11:29
2026 Amsterdam,HYROX PRO DOUBLES - Overall,Men,332,66,"Rutger De Gans, Martijn Froon",,35-39,01:11:32
2026 Amsterdam,HYROX PRO DOUBLES - Overall,Men,333,67,"Frits Loogman, Ivar Davids",,35-39,01:11:34
2026 Amsterdam,HYROX PRO DOUBLES - Overall,Men,334,1,"Frank De Groot, André Augustijn",,55-59,01:11:39
2026 Amsterdam,HYROX PRO DOUBLES - Overall,Men,335,12,"Tjapko Scholten, Jan Willem Van Der Windt",,45-49,01:11:39
2026 Amsterdam,HYROX PRO DOUBLES - Overall,Men,336,114,"Simon Bühnen, Axel Hieronymus",,30-34,01:11:43
2026 Amsterdam,HYROX PRO DOUBLES - Overall,Men,337,13,"Tom Verboon, Luuk Van Der Knaap",,45-49,01:11:44
2026 Amsterdam,HYROX PRO DOUBLES - Overall,Men,338,73,"Jamie Nelstein, Marciano Waisapij",,25-29,01:11:46
2026 Amsterdam,HYROX PRO DOUBLES - Overall,Men,339,32,"Jamie Bouhuys, Joy Bouhuys",,40-44,01:11:51
2026 Amsterdam,HYROX PRO DOUBLES - Overall,Men,340,14,"Dilan Miranda, Joey Stam",,45-49,01:11:53
2026 Amsterdam,HYROX PRO DOUBLES - Overall,Men,341,33,"Robbert Dorst, Dennis Eschmeijer",,40-44,01:12:00
2026 Amsterdam,HYROX PRO DOUBLES - Overall,Men,342,68,"Arne Kelfkens, Edwin Van Der Weele",,35-39,01:12:01
2026 Amsterdam,HYROX PRO DOUBLES - Overall,Men,343,69,"Damien Vespertini, Morgan Vespertini",,35-39,01:12:06
2026 Amsterdam,HYROX PRO DOUBLES - Overall,Men,344,15,"Paul Muller, Peter Muller",,45-49,01:12:13
2026 Amsterdam,HYROX PRO DOUBLES - Overall,Men,345,8,"Ray Poots, Michiel Timmermans",,50-54,01:12:18
2026 Amsterdam,HYROX PRO DOUBLES - Overall,Men,346,115,"Ciaran Clusker, Darren Hopkins",,30-34,01:12:26
2026 Amsterdam,HYROX PRO DOUBLES - Overall,Men,347,74,"Nick De Klerk, Remco Grol",,25-29,01:12:27
2026 Amsterdam,HYROX PRO DOUBLES - Overall,Men,348,34,"Samuel Van Der Hoeven, Mark Van Truije",,40-44,01:12:33
2026 Amsterdam,HYROX PRO DOUBLES - Overall,Men,349,35,"Luuc Rickhoff, Niek Broekhuis",,40-44,01:12:43
2026 Amsterdam,HYROX PRO DOUBLES - Overall,Men,350,70,"Nick Hospers, Jan Van Aalderen",,35-39,01:12:44
2026 Amsterdam,HYROX PRO DOUBLES - Overall,Men,351,75,"Robert Weiß, Liam Boese",,25-29,01:12:55
2026 Amsterdam,HYROX PRO DOUBLES - Overall,Men,352,71,"Armando Haverkamp, Johan Otten",,35-39,01:12:57
2026 Amsterdam,HYROX PRO DOUBLES - Overall,Men,353,76,"Tom De Vries, Arjen De Vries",,25-29,01:12:58
2026 Amsterdam,HYROX PRO DOUBLES - Overall,Men,354,72,"Jeroen Diemen, Theo Smidt",,35-39,01:13:05
2026 Amsterdam,HYROX PRO DOUBLES - Overall,Men,355,77,"Jordi Hamming, Daniël Hubers",,25-29,01:13:25
2026 Amsterdam,HYROX PRO DOUBLES - Overall,Men,356,78,"Lars Gorter, Joran Warning",,25-29,01:13:35
2026 Amsterdam,HYROX PRO DOUBLES - Overall,Men,357,33,"Sjoerd Avis, Jasper Avis",,16-24,01:13:37
2026 Amsterdam,HYROX PRO DOUBLES - Overall,Men,358,116,"Joost Walterbos, Rob Roumans",,30-34,01:13:45
2026 Amsterdam,HYROX PRO DOUBLES - Overall,Men,359,117,"Franck Van Der Sluis, Boris De Wit",,30-34,01:13:47
2026 Amsterdam,HYROX PRO DOUBLES - Overall,Men,360,118,"Maurice Treffers, Roy Treffers",,30-34,01:13:49
2026 Amsterdam,HYROX PRO DOUBLES - Overall,Men,361,16,"Ronald Krijgsman, Greg Roseval",,45-49,01:13:50
2026 Amsterdam,HYROX PRO DOUBLES - Overall,Men,362,119,"Altan Guner, Jeroen Huisman",,30-34,01:13:50
2026 Amsterdam,HYROX PRO DOUBLES - Overall,Men,363,79,"Boudewijn Groosman, Rens Lotze",,25-29,01:13:55
2026 Amsterdam,HYROX PRO DOUBLES - Overall,Men,364,73,"Dennis Beek, Bart Weggelaar",,35-39,01:14:17
2026 Amsterdam,HYROX PRO DOUBLES - Overall,Men,365,80,"Donny Buisman, Hidde Buisman",,25-29,01:14:19
2026 Amsterdam,HYROX PRO DOUBLES - Overall,Men,366,74,"Miguel Morales Hildebrandt, Leon Lans",,35-39,01:14:21
2026 Amsterdam,HYROX PRO DOUBLES - Overall,Men,367,120,"Milco Brosky, Martijn Ax",,30-34,01:14:33
2026 Amsterdam,HYROX PRO DOUBLES - Overall,Men,368,34,"Jens Wiegers, Roy Tesselaar",,16-24,01:14:33
2026 Amsterdam,HYROX PRO DOUBLES - Overall,Men,369,75,"Pieter Knotnerus, Jorn Meijer",,35-39,01:14:36
2026 Amsterdam,HYROX PRO DOUBLES - Overall,Men,370,121,"Koen Konings, Collin Van Der Bilt",,30-34,01:14:38
2026 Amsterdam,HYROX PRO DOUBLES - Overall,Men,371,36,"Poldi Van Rijen, Patrick Brijbag",,40-44,01:14:44
2026 Amsterdam,HYROX PRO DOUBLES - Overall,Men,372,122,"Domien Hettinga, Willem Zijlstra",,30-34,01:14:48
2026 Amsterdam,HYROX PRO DOUBLES - Overall,Men,373,76,"Arthur Van Zuijlen, Marc Van Zuijlen",,35-39,01:14:50
2026 Amsterdam,HYROX PRO DOUBLES - Overall,Men,374,77,"Marcel Wennekes, Quincy Uljee",,35-39,01:14:58
2026 Amsterdam,HYROX PRO DOUBLES - Overall,Men,375,78,"Lukas Boonstra, Jan Rispens",,35-39,01:15:01
2026 Amsterdam,HYROX PRO DOUBLES - Overall,Men,376,35,"Sep Albers, Luca Van Den Berg",,16-24,01:15:01
2026 Amsterdam,HYROX PRO DOUBLES - Overall,Men,377,79,"Bauke Van Harskamp, Cas Lebbink",,35-39,01:15:06
2026 Amsterdam,HYROX PRO DOUBLES - Overall,Men,378,81,"Jurano O’Brien, Damian Muller",,25-29,01:15:07
2026 Amsterdam,HYROX PRO DOUBLES - Overall,Men,379,37,"Wilton Kam, Jordi Stevens",,40-44,01:15:12
2026 Amsterdam,HYROX PRO DOUBLES - Overall,Men,380,82,"Stan Apeldoorn, Julian Van Riemsdijk",,25-29,01:15:22
2026 Amsterdam,HYROX PRO DOUBLES - Overall,Men,381,123,"Bart Koornstra, Diaz De Barbanson",,30-34,01:15:26
2026 Amsterdam,HYROX PRO DOUBLES - Overall,Men,382,83,"Casper Van Breukelen, Myron Otto",,25-29,01:15:37
2026 Amsterdam,HYROX PRO DOUBLES - Overall,Men,383,80,"Cedric Meniai, Julien Meyssonnier",,35-39,01:15:37
2026 Amsterdam,HYROX PRO DOUBLES - Overall,Men,384,124,"Maciej Kursa, Adrian Dudko",,30-34,01:15:40
2026 Amsterdam,HYROX PRO DOUBLES - Overall,Men,385,36,"Noah Postma, Samuel Grande Y Rodriguez",,16-24,01:15:44
2026 Amsterdam,HYROX PRO DOUBLES - Overall,Men,386,81,"Mikel Saa, Xabier Laverdd",,35-39,01:15:44
2026 Amsterdam,HYROX PRO DOUBLES - Overall,Men,387,125,"Kevin Betsema, Yosu Daalder",,30-34,01:15:47
2026 Amsterdam,HYROX PRO DOUBLES - Overall,Men,388,84,"Casper Untersalmberger, Joris Untersalmberger",,25-29,01:15:47
2026 Amsterdam,HYROX PRO DOUBLES - Overall,Men,389,126,"Nick Van Den Bosch, Mitchell Jacobs",,30-34,01:15:50
2026 Amsterdam,HYROX PRO DOUBLES - Overall,Men,390,127,"Allard Moerenhout, Matthijs Van Den Berge",,30-34,01:15:50
2026 Amsterdam,HYROX PRO DOUBLES - Overall,Men,391,17,"Frederik Walraven, Marius Noordam",,45-49,01:15:52
2026 Amsterdam,HYROX PRO DOUBLES - Overall,Men,392,128,"Arjen Boelens, Gordon Doelwijt",,30-34,01:16:12
2026 Amsterdam,HYROX PRO DOUBLES - Overall,Men,393,85,"Mark Cowles, Wynand Fourie",,25-29,01:16:14
2026 Amsterdam,HYROX PRO DOUBLES - Overall,Men,394,82,"Kevin Schellberg, Daniel Lüders",,35-39,01:16:18
2026 Amsterdam,HYROX PRO DOUBLES - Overall,Men,395,129,"Dave Potter, Reinder Boekhoff",,30-34,01:16:21
2026 Amsterdam,HYROX PRO DOUBLES - Overall,Men,396,130,"Niels Lageweg, Arjen Kranendonk",,30-34,01:16:21
2026 Amsterdam,HYROX PRO DOUBLES - Overall,Men,397,131,"Laurynas Lazdauskas, Rudi Giovanni Merkin",,30-34,01:16:23
2026 Amsterdam,HYROX PRO DOUBLES - Overall,Men,398,86,"Tigo Jacobs, Nick Smetsers",,25-29,01:16:27
2026 Amsterdam,HYROX PRO DOUBLES - Overall,Men,399,83,"Terry Maurer, Jordy Brouwer",,35-39,01:16:33
2026 Amsterdam,HYROX PRO DOUBLES - Overall,Men,400,132,"Jan Nixdorf, Marco Kleinschmidt",,30-34,01:16:53
2026 Amsterdam,HYROX PRO DOUBLES - Overall,Men,401,37,"Nico Kwakman, Tom Kroon",,16-24,01:16:54
2026 Amsterdam,HYROX PRO DOUBLES - Overall,Men,402,133,"Marten Leegte, Jan Meijer",,30-34,01:16:55
2026 Amsterdam,HYROX PRO DOUBLES - Overall,Men,403,38,"Marcel Blokker, Stefan Hartman",,40-44,01:16:58
2026 Amsterdam,HYROX PRO DOUBLES - Overall,Men,404,87,"Dennis Groninger, Davey Mulder",,25-29,01:17:05
2026 Amsterdam,HYROX PRO DOUBLES - Overall,Men,405,88,"Jerry Van Dommelen, Maarten Meijer",,25-29,01:17:12
2026 Amsterdam,HYROX PRO DOUBLES - Overall,Men,406,134,"Timothy Stalenhoef, Wout Bonnema",,30-34,01:17:15
2026 Amsterdam,HYROX PRO DOUBLES - Overall,Men,407,89,"Merijn Uijthoven, Jacobus Max Nienhuijs",,25-29,01:17:19
2026 Amsterdam,HYROX PRO DOUBLES - Overall,Men,408,38,"Sem Franken, Jesse Franken",,16-24,01:17:24
2026 Amsterdam,HYROX PRO DOUBLES - Overall,Men,409,135,"Yuri Cayo Huerta, Victor Cayo Huerta",,30-34,01:17:27
2026 Amsterdam,HYROX PRO DOUBLES - Overall,Men,410,39,"Tom Kies, Tom Eltz",,40-44,01:17:27
2026 Amsterdam,HYROX PRO DOUBLES - Overall,Men,411,9,"Sebastiaan Herman, Michiel Cleeren",,50-54,01:17:37
2026 Amsterdam,HYROX PRO DOUBLES - Overall,Men,412,40,"Klaas Jan Bijlsma, Will Yeung",,40-44,01:17:45
2026 Amsterdam,HYROX PRO DOUBLES - Overall,Men,413,84,"Benjamin Plasschaert, Hans Boukema",,35-39,01:17:57
2026 Amsterdam,HYROX PRO DOUBLES - Overall,Men,414,41,"Alexander Frik, Artur Heidt",,40-44,01:18:00
2026 Amsterdam,HYROX PRO DOUBLES - Overall,Men,415,136,"Bart Witte, Wouter Witte",,30-34,01:18:00
2026 Amsterdam,HYROX PRO DOUBLES - Overall,Men,416,85,"Rik Borneman, Tom Limmen",,35-39,01:18:10
2026 Amsterdam,HYROX PRO DOUBLES - Overall,Men,417,18,"Dave Grosjean, Perry Coomans",,45-49,01:18:15
2026 Amsterdam,HYROX PRO DOUBLES - Overall,Men,418,42,"Benny Gould, Dustin Fergus",,40-44,01:18:18
2026 Amsterdam,HYROX PRO DOUBLES - Overall,Men,419,90,"Merslin Govender, Alfredo Gomes",,25-29,01:18:32
2026 Amsterdam,HYROX PRO DOUBLES - Overall,Men,420,86,"Remy Kistemaker, Carlo Van Bergen",,35-39,01:18:35
2026 Amsterdam,HYROX PRO DOUBLES - Overall,Men,421,137,"Denis Melnikov, Jasper Morssink",,30-34,01:18:50
2026 Amsterdam,HYROX PRO DOUBLES - Overall,Men,422,39,"Vincent Hemmen, Joshua Visser",,16-24,01:18:57
2026 Amsterdam,HYROX PRO DOUBLES - Overall,Men,423,10,"Peter Beelen, Eric Van De Beeten",,50-54,01:19:01
2026 Amsterdam,HYROX PRO DOUBLES - Overall,Men,424,40,"Bennet Speh, Gerrit Speh",,16-24,01:19:18
2026 Amsterdam,HYROX PRO DOUBLES - Overall,Men,425,11,"Johannes Zandvoort, Houke Boon",,50-54,01:19:30
2026 Amsterdam,HYROX PRO DOUBLES - Overall,Men,426,87,"Patrick Schrijver, Mark Greidanus",,35-39,01:19:34
2026 Amsterdam,HYROX PRO DOUBLES - Overall,Men,427,88,"Simon Zientara, Daniel Petronik",,35-39,01:19:47
2026 Amsterdam,HYROX PRO DOUBLES - Overall,Men,428,91,"Kelvin Carels, Damon Ten Have",,25-29,01:19:53
2026 Amsterdam,HYROX PRO DOUBLES - Overall,Men,429,138,"Michael Palm, Ed Van Grevenbroek",,30-34,01:19:54
2026 Amsterdam,HYROX PRO DOUBLES - Overall,Men,430,92,"Karel Eisses, Hessel Postma",,25-29,01:19:57
2026 Amsterdam,HYROX PRO DOUBLES - Overall,Men,431,43,"Rogier Nouwen, Vincent Van Der Burgt",,40-44,01:19:59
2026 Amsterdam,HYROX PRO DOUBLES - Overall,Men,432,44,"André Van Bruggen, Arie Van Der Oost",,40-44,01:20:00
2026 Amsterdam,HYROX PRO DOUBLES - Overall,Men,433,12,"Robert Westhoff, Ben Sterenberg",,50-54,01:20:27
2026 Amsterdam,HYROX PRO DOUBLES - Overall,Men,434,89,"Gregor Simon, Thomas Simon",,35-39,01:20:27
2026 Amsterdam,HYROX PRO DOUBLES - Overall,Men,435,90,"Martin Van Den Broek, Bart Donders",,35-39,01:20:29
2026 Amsterdam,HYROX PRO DOUBLES - Overall,Men,436,139,"Délano Faber, Jordy Huiskes",,30-34,01:20:54
2026 Amsterdam,HYROX PRO DOUBLES - Overall,Men,437,41,"Aaron Godliman, Alex Moon",,16-24,01:21:07
2026 Amsterdam,HYROX PRO DOUBLES - Overall,Men,438,91,"Jimmy Van Eekelen, Michael Buijsen",,35-39,01:21:16
2026 Amsterdam,HYROX PRO DOUBLES - Overall,Men,439,93,"Jaimy Cai, Bram Vroegh",,25-29,01:21:17
2026 Amsterdam,HYROX PRO DOUBLES - Overall,Men,440,92,"Nico Draaisma, Chris Helwerda",,35-39,01:21:27
2026 Amsterdam,HYROX PRO DOUBLES - Overall,Men,441,94,"Jos Van Der Boogh, Joachim Scheffer",,25-29,01:21:39
2026 Amsterdam,HYROX PRO DOUBLES - Overall,Men,442,93,"Hooshang Radfar, Moonhee Lee",,35-39,01:21:41
2026 Amsterdam,HYROX PRO DOUBLES - Overall,Men,443,140,"Erich Blaesing, Justin Lier",,30-34,01:21:50
2026 Amsterdam,HYROX PRO DOUBLES - Overall,Men,444,42,"Lucas Baak, Bas Hulshof",,16-24,01:21:54
2026 Amsterdam,HYROX PRO DOUBLES - Overall,Men,445,141,"Dylan Janssens, Julio Chavez",,30-34,01:22:02
2026 Amsterdam,HYROX PRO DOUBLES - Overall,Men,446,142,"Kevin De Vries, Bas Flobbe",,30-34,01:22:20
2026 Amsterdam,HYROX PRO DOUBLES - Overall,Men,447,95,"Sander Hooijman, Max Van Nassau",,25-29,01:22:20
2026 Amsterdam,HYROX PRO DOUBLES - Overall,Men,448,45,"Edwin Kaizer, Wouter Kuiper",,40-44,01:22:32
2026 Amsterdam,HYROX PRO DOUBLES - Overall,Men,449,94,"Henri Kaes, Christophe Poterat",,35-39,01:22:41
2026 Amsterdam,HYROX PRO DOUBLES - Overall,Men,450,143,"Jort Stockmann, Johannes Talhout",,30-34,01:22:44
2026 Amsterdam,HYROX PRO DOUBLES - Overall,Men,451,144,"Peter Merx, Erik Merx",,30-34,01:22:47
2026 Amsterdam,HYROX PRO DOUBLES - Overall,Men,452,43,"Mazeo Leihitu, Boaz De Gruijter",,16-24,01:22:48
2026 Amsterdam,HYROX PRO DOUBLES - Overall,Men,453,44,"Paul Meijer, Twan Horst",,16-24,01:23:08
2026 Amsterdam,HYROX PRO DOUBLES - Overall,Men,454,95,"Dennis De Wit, Rene Wilbers",,35-39,01:23:12
2026 Amsterdam,HYROX PRO DOUBLES - Overall,Men,455,45,"Marcel Brens, Tom Van Der Grinten",,16-24,01:23:17
2026 Amsterdam,HYROX PRO DOUBLES - Overall,Men,456,46,"Christophe Kok, Zorzis Van Den Ham",,16-24,01:23:26
2026 Amsterdam,HYROX PRO DOUBLES - Overall,Men,457,96,"Mark Van Santen, Robert Van Der Zwaan",,35-39,01:23:36
2026 Amsterdam,HYROX PRO DOUBLES - Overall,Men,458,145,"Maarten Koornstra, Yao Zhong Gao",,30-34,01:23:42
2026 Amsterdam,HYROX PRO DOUBLES - Overall,Men,459,96,"Moritz Thoben, Pierre Lemkemeyer",,25-29,01:23:44
2026 Amsterdam,HYROX PRO DOUBLES - Overall,Men,460,46,"Jeroen Kleinjan, Ferran Plaggenborg",,40-44,01:23:50
2026 Amsterdam,HYROX PRO DOUBLES - Overall,Men,461,47,"Lucien Vermeulen, Bart Hoogeveen",,16-24,01:24:06
2026 Amsterdam,HYROX PRO DOUBLES - Overall,Men,462,97,"Raphael Lartot, Raphael Bousigues",,25-29,01:24:49
2026 Amsterdam,HYROX PRO DOUBLES - Overall,Men,463,146,"Niek Van Herwerden, Evert Ten Cate",,30-34,01:24:51
2026 Amsterdam,HYROX PRO DOUBLES - Overall,Men,464,97,"Jesse Bitter, Rick Van Den Oetelaar",,35-39,01:24:59
2026 Amsterdam,HYROX PRO DOUBLES - Overall,Men,465,47,"Sebastiaan Van Der Zalm, Joffry Musch",,40-44,01:25:02
2026 Amsterdam,HYROX PRO DOUBLES - Overall,Men,466,147,"Gijs Makker, Tim Beijaard",,30-34,01:25:03
2026 Amsterdam,HYROX PRO DOUBLES - Overall,Men,467,148,"Ryan Rao, Bart Gommers",,30-34,01:26:02
2026 Amsterdam,HYROX PRO DOUBLES - Overall,Men,468,149,"Tamir Mohamed, Amidu Tanko",,30-34,01:26:49
2026 Amsterdam,HYROX PRO DOUBLES - Overall,Men,469,98,"Jack Barnett, Jacob Oakley",,25-29,01:27:00
2026 Amsterdam,HYROX PRO DOUBLES - Overall,Men,470,48,"Thom Hanssen, Darshan Moti",,16-24,01:28:58
2026 Amsterdam,HYROX PRO DOUBLES - Overall,Men,471,98,"Julien Dumortier, Nicolas Maréchal",,35-39,01:29:27
2026 Amsterdam,HYROX PRO DOUBLES - Overall,Men,472,99,"Kevin Denniston, Terrell Robinson",,35-39,01:29:44
2026 Amsterdam,HYROX PRO DOUBLES - Overall,Men,473,100,"Abderrahim Ziani, Vially Marquita",,35-39,01:30:18
2026 Amsterdam,HYROX PRO DOUBLES - Overall,Men,474,101,"Sabry Djebali, Olivier Levaque",,35-39,01:31:23
2026 Amsterdam,HYROX PRO DOUBLES - Overall,Men,475,102,"Jarno Van Plateringen, Simon Elberts",,35-39,01:32:44
2026 Amsterdam,HYROX PRO DOUBLES - Overall,Men,476,49,"Tawan Harink, Lorenzo Bakker",,16-24,01:33:31
2026 Amsterdam,HYROX PRO DOUBLES - Overall,Men,477,103,"Tim Brouwer, Jaco Postuma",,35-39,01:33:38
2026 Amsterdam,HYROX PRO DOUBLES - Overall,Men,478,104,"Gabriel Kaya, Remy Spanjaard",,35-39,01:37:26
2026 Amsterdam,HYROX PRO DOUBLES - Overall,Men,479,99,"Jons Hogestijn, Lars Ubachs",,25-29,01:37:39
2026 Amsterdam,HYROX PRO DOUBLES - Overall,Men,480,100,"Bradley Busto-Tuya, Alessio Ghelli",,25-29,01:37:53
2026 Amsterdam,HYROX PRO DOUBLES - Overall,Men,481,105,"Mina Youssef, M Waly",,35-39,01:38:36
2026 Amsterdam,HYROX PRO DOUBLES - Overall,Men,482,101,"Matt Ward, Joe Cross",,25-29,01:41:37
2026 Amsterdam,HYROX PRO DOUBLES - Overall,Men,483,50,"Jaden Chote, Bradley Bergonje",,16-24,01:42:18
2026 Amsterdam,HYROX PRO DOUBLES - Overall,Men,484,106,"Christophe Raccogli, David Urbing",,35-39,01:44:15
2026 Amsterdam,HYROX PRO DOUBLES - Overall,Men,485,48,"Jean-François Franc, Florian Capone",,40-44,01:55:38
2026 Amsterdam,HYROX PRO DOUBLES - Overall,Men,486,13,"Dennis Van Zijl, Gertjan Hoefman",,50-54,02:00:25
2026 Amsterdam,HYROX PRO DOUBLES - Overall,Women,1,1,"Lola Gomes, Apolline Cardon",,16-24,00:57:21
2026 Amsterdam,HYROX PRO DOUBLES - Overall,Women,2,1,"Tanja Schuck, Svenja Sommer",,25-29,00:58:19
2026 Amsterdam,HYROX PRO DOUBLES - Overall,Women,3,1,"Janne Thomsen, Alice Dr. Schürer",,30-34,00:58:39
2026 Amsterdam,HYROX PRO DOUBLES - Overall,Women,4,2,"Michaela Disseldorp, Thanee Uittenhout",,30-34,01:00:02
2026 Amsterdam,HYROX PRO DOUBLES - Overall,Women,5,2,"Bliss Mason, Aimee Gardiner",,25-29,01:00:18
2026 Amsterdam,HYROX PRO DOUBLES - Overall,Women,6,3,"Petra Arvela, Beatrice Ardelt",,30-34,01:00:32
2026 Amsterdam,HYROX PRO DOUBLES - Overall,Women,7,1,"Anne Marte Sneve, Catrine Collins",,40-44,01:00:33
2026 Amsterdam,HYROX PRO DOUBLES - Overall,Women,8,3,"Sterre Van De Goor, Iza Tulkens",,25-29,01:01:28
2026 Amsterdam,HYROX PRO DOUBLES - Overall,Women,9,4,"Fleur Van Zuilen, Teuntje Bruijstens",,25-29,01:01:51
2026 Amsterdam,HYROX PRO DOUBLES - Overall,Women,10,2,"Marique Dieudonne, Iris Langejans",,16-24,01:01:52
2026 Amsterdam,HYROX PRO DOUBLES - Overall,Women,11,1,"Sinead Sheahan, Aine Sheehan",,35-39,01:01:59
2026 Amsterdam,HYROX PRO DOUBLES - Overall,Women,12,2,"Esti Van Dieen, Melanie Jager",,35-39,01:02:10
2026 Amsterdam,HYROX PRO DOUBLES - Overall,Women,13,5,"Romy Colsen, Sien Heylen",,25-29,01:02:15
2026 Amsterdam,HYROX PRO DOUBLES - Overall,Women,14,3,"Marisa Beliën, Michoe Luykx",,35-39,01:03:28
2026 Amsterdam,HYROX PRO DOUBLES - Overall,Women,15,4,"Bo Grievink, Annette De Wolf",,30-34,01:03:28
2026 Amsterdam,HYROX PRO DOUBLES - Overall,Women,16,5,"Corinna Remberg, Merel Visser",,30-34,01:03:31
2026 Amsterdam,HYROX PRO DOUBLES - Overall,Women,17,6,"Evelien Van Esch, Mandy Staargaard",,25-29,01:04:00
2026 Amsterdam,HYROX PRO DOUBLES - Overall,Women,18,7,"Lisa De Rijke, Femke Herber",,25-29,01:04:53
