Race,Division,Gender,Rank Overall,Rank Age Group,Name,Nation,Age Group,Total Time
2026 Amsterdam,HYROX PRO DOUBLES - Overall,Men,1,1,"Louis Osselaer, Maarten Enthoven",,30-34,00:49:45
2026 Amsterdam,HYROX PRO DOUBLES - Overall,Men,2,1,"Pedro Antonio Toral Leiva, Roberto Viciedo Gimeno",,25-29,00:50:30
2026 Amsterdam,HYROX PRO DOUBLES - Overall,Men,3,1,"Cem Ter Burg, Ross Walker",,16-24,00:51:01
2026 Amsterdam,HYROX PRO DOUBLES - Overall,Men,4,2,"Pieter Maes, Tom Franssens",,30-34,00:51:04
2026 Amsterdam,HYROX PRO DOUBLES - Overall,Men,5,3,"Sam Schoeman, Nicky Verhoeven",,30-34,00:51:13
2026 Amsterdam,HYROX PRO DOUBLES - Overall,Men,6,4,"Quentin Garel, Tommy Valentin",,30-34,00:51:40
2026 Amsterdam,HYROX PRO DOUBLES - Overall,Men,7,2,"Dennis Gödde, Jan-Niklas Friedrich",,25-29,00:52:29
2026 Amsterdam,HYROX PRO DOUBLES - Overall,Men,8,5,"Florian Gast, Peter Schiller",,30-34,00:52:39
2026 Amsterdam,HYROX PRO DOUBLES - Overall,Men,9,1,"Mark Newton, Tony Revell",,35-39,00:53:40
2026 Amsterdam,HYROX PRO DOUBLES - Overall,Men,10,6,"Jannick Plantinga, Mark Nieuwenhuis",,30-34,00:53:49
2026 Amsterdam,HYROX PRO DOUBLES - Overall,Men,11,7,"Samir Schön, Timo Tekolf",,30-34,00:54:01
2026 Amsterdam,HYROX PRO DOUBLES - Overall,Men,12,2,"Ben Mcmullen, Jay Hudson",,16-24,00:54:17
2026 Amsterdam,HYROX PRO DOUBLES - Overall,Men,13,3,"Joep De Beer, Umesh Ten Kate",,25-29,00:54:19
2026 Amsterdam,HYROX PRO DOUBLES - Overall,Men,14,4,"Jordi Fuhler, Bobby Bos",,25-29,00:54:29
2026 Amsterdam,HYROX PRO DOUBLES - Overall,Men,15,5,"Gabriel Baijings, Jasper Baijings",,25-29,00:54:31
2026 Amsterdam,HYROX PRO DOUBLES - Overall,Men,16,8,"Nick Van Ommen, Vincent Veth",,30-34,00:54:32
2026 Amsterdam,HYROX PRO DOUBLES - Overall,Men,17,9,"Antoine Bouhana, Anthony Casano",,30-34,00:54:43
2026 Amsterdam,HYROX PRO DOUBLES - Overall,Men,18,6,"Jordi Fuhler, Jop Janssen",,25-29,00:54:49
2026 Amsterdam,HYROX PRO DOUBLES - Overall,Men,19,7,"Matthew McDowell, Jack Waugh",,25-29,00:54:59
2026 Amsterdam,HYROX PRO DOUBLES - Overall,Men,20,3,"Koen Proost, Stijn Lof",,16-24,00:55:01
2026 Amsterdam,HYROX PRO DOUBLES - Overall,Men,21,8,"Jason Van Der Geugten, Roman Van Eijk",,25-29,00:55:13
2026 Amsterdam,HYROX PRO DOUBLES - Overall,Men,22,10,"Maxime Avenel, Dorian Gricourt",,30-34,00:55:22
2026 Amsterdam,HYROX PRO DOUBLES - Overall,Men,23,11,"Piers Plowman, Joseph Wells",,30-34,00:55:22
2026 Amsterdam,HYROX PRO DOUBLES - Overall,Men,24,12,"Pierre Grimont, Nicolas Grimont",,30-34,00:55:22
2026 Amsterdam,HYROX PRO DOUBLES - Overall,Men,25,13,"Julian Bosch, Robbert De Rijk",,30-34,00:55:35
2026 Amsterdam,HYROX PRO DOUBLES - Overall,Men,26,9,"Mohamed Nessah, Ahmed El Tantawi",,25-29,00:55:59
2026 Amsterdam,HYROX PRO DOUBLES - Overall,Men,27,1,"Roman Hopp, Dennis Kneepkens",,40-44,00:56:03
2026 Amsterdam,HYROX PRO DOUBLES - Overall,Men,28,14,"Bjarne Ten Wolde, Sven Ten Wolde",,30-34,00:56:08
2026 Amsterdam,HYROX PRO DOUBLES - Overall,Men,29,15,"Mack Engbers, Leon Roos",,30-34,00:56:14
2026 Amsterdam,HYROX PRO DOUBLES - Overall,Men,30,16,"Ewout Tromp, Romano Baal",,30-34,00:56:25
2026 Amsterdam,HYROX PRO DOUBLES - Overall,Men,31,17,"Lloyd Bleeksma, Sil Wiersma",,30-34,00:56:29
2026 Amsterdam,HYROX PRO DOUBLES - Overall,Men,32,10,"Boy Van Erp, Mike Rietveld",,25-29,00:56:40
2026 Amsterdam,HYROX PRO DOUBLES - Overall,Men,33,18,"Mark O’Dwyer, Jack Memery",,30-34,00:56:41
2026 Amsterdam,HYROX PRO DOUBLES - Overall,Men,34,11,"Owen Coverdale, Euan Gordon",,25-29,00:56:52
2026 Amsterdam,HYROX PRO DOUBLES - Overall,Men,35,2,"Gerry Kennedy, Gary Crawford",,35-39,00:56:54
2026 Amsterdam,HYROX PRO DOUBLES - Overall,Men,36,19,"Francisco Hijazo Zabala, Oscar Espada Rodríguez",,30-34,00:57:00
2026 Amsterdam,HYROX PRO DOUBLES - Overall,Men,37,20,"Joost Kok, Raimond Huiszoon",,30-34,00:57:03
2026 Amsterdam,HYROX PRO DOUBLES - Overall,Men,38,12,"Aron Schalk, Tygo Versendaal",,25-29,00:57:07
2026 Amsterdam,HYROX PRO DOUBLES - Overall,Men,39,13,"Mitchell Van Den Berg, Jeroen Eppenga",,25-29,00:57:10
2026 Amsterdam,HYROX PRO DOUBLES - Overall,Men,40,14,"Hans Donker, Jeroen Meerman",,25-29,00:57:14
2026 Amsterdam,HYROX PRO DOUBLES - Overall,Men,41,15,"Simon Wéry, Antoine Wéry",,25-29,00:57:21
2026 Amsterdam,HYROX PRO DOUBLES - Overall,Men,42,21,"Christian Rose, Tobias Franke",,30-34,00:57:30
2026 Amsterdam,HYROX PRO DOUBLES - Overall,Men,43,2,"Alex Romero, Steven Spaans",,40-44,00:57:30
2026 Amsterdam,HYROX PRO DOUBLES - Overall,Men,44,16,"Sven Moerkerk, Islam Sahin",,25-29,00:57:37
2026 Amsterdam,HYROX PRO DOUBLES - Overall,Men,45,22,"Yanis Ferrat, Pierre Sahraoui",,30-34,00:57:37
2026 Amsterdam,HYROX PRO DOUBLES - Overall,Men,46,23,"Martin Polak, Damian Kramer",,30-34,00:57:48
2026 Amsterdam,HYROX PRO DOUBLES - Overall,Men,47,3,"Patrick Willems, Oliver Baijings",,40-44,00:57:49
2026 Amsterdam,HYROX PRO DOUBLES - Overall,Men,48,24,"Stefan Bongers, Camiel Pesch",,30-34,00:57:50
2026 Amsterdam,HYROX PRO DOUBLES - Overall,Men,49,17,"Martijn Van Dalen, Chris Stienenbos",,25-29,00:57:53
2026 Amsterdam,HYROX PRO DOUBLES - Overall,Men,50,25,"Alex Tiesma, Jeroen Van duijn",,30-34,00:57:53
2026 Amsterdam,HYROX PRO DOUBLES - Overall,Men,51,3,"Dominic Kiewiet Kiewiet, Steven Knops",,35-39,00:57:56
2026 Amsterdam,HYROX PRO DOUBLES - Overall,Men,52,18,"Stan Boekel, Bart Jouta",,25-29,00:58:05
2026 Amsterdam,HYROX PRO DOUBLES - Overall,Men,53,26,"Kaj Smeets, Jorryt Terluin",,30-34,00:58:06
2026 Amsterdam,HYROX PRO DOUBLES - Overall,Men,54,27,"Niels Verwer, David Pinchasik",,30-34,00:58:18
2026 Amsterdam,HYROX PRO DOUBLES - Overall,Men,55,19,"Carlos Platier, Niels Van Lanen",,25-29,00:58:21
2026 Amsterdam,HYROX PRO DOUBLES - Overall,Men,56,28,"Guido Heerink, Rik Biesterbos",,30-34,00:58:21
2026 Amsterdam,HYROX PRO DOUBLES - Overall,Men,57,29,"Tim Van Wees, Joris Van Nieuwkerk",,30-34,00:58:28
2026 Amsterdam,HYROX PRO DOUBLES - Overall,Men,58,4,"Ciaran Parkinson, Martijn Schmale",,40-44,00:58:29
2026 Amsterdam,HYROX PRO DOUBLES - Overall,Men,59,20,"Pascal Verboom, Kevin Verboom",,25-29,00:58:29
2026 Amsterdam,HYROX PRO DOUBLES - Overall,Men,60,21,"Ollie Groombridge, Jack Meredith",,25-29,00:58:34
2026 Amsterdam,HYROX PRO DOUBLES - Overall,Men,61,4,"Thomas Serais, Cyrus Skakal",,16-24,00:58:36
2026 Amsterdam,HYROX PRO DOUBLES - Overall,Men,62,5,"Guido Van Els, Paul De Wit",,40-44,00:58:42
2026 Amsterdam,HYROX PRO DOUBLES - Overall,Men,63,6,"Stephan Wallacher, Konstantin Ulrich",,40-44,00:58:43
2026 Amsterdam,HYROX PRO DOUBLES - Overall,Men,64,5,"Mats Freijser, Rik Maalcke",,16-24,00:58:43
2026 Amsterdam,HYROX PRO DOUBLES - Overall,Men,65,4,"Wouter Dijkshoorn, Peter Van Dartel",,35-39,00:58:51
2026 Amsterdam,HYROX PRO DOUBLES - Overall,Men,66,7,"Donny Lodder, Diederik Verhoef",,40-44,00:58:51
2026 Amsterdam,HYROX PRO DOUBLES - Overall,Men,67,30,"Jack Brien, James Crowe",,30-34,00:58:55
2026 Amsterdam,HYROX PRO DOUBLES - Overall,Men,68,22,"Lilinho Da Silva Martins, Fadi Kerkwijk",,25-29,00:58:56
2026 Amsterdam,HYROX PRO DOUBLES - Overall,Men,69,1,"Rogier Verbaan, Arjen Koolen",,45-49,00:59:00
2026 Amsterdam,HYROX PRO DOUBLES - Overall,Men,70,23,"Tobias Neve, Fabian Siering",,25-29,00:59:08
2026 Amsterdam,HYROX PRO DOUBLES - Overall,Men,71,31,"Rob Gambon, Frank Beemer",,30-34,00:59:15
2026 Amsterdam,HYROX PRO DOUBLES - Overall,Men,72,8,"Klaas Van Woudenbergh, Sander Van Der Linden",,40-44,00:59:20
2026 Amsterdam,HYROX PRO DOUBLES - Overall,Men,73,5,"Julien Fournel, Sylvain Derognat",,35-39,00:59:20
2026 Amsterdam,HYROX PRO DOUBLES - Overall,Men,74,32,"Emeric Rary, Quentin Dupuis",,30-34,00:59:21
2026 Amsterdam,HYROX PRO DOUBLES - Overall,Men,75,6,"Brahim Lahmiri, Martin Doyen",,35-39,00:59:24
2026 Amsterdam,HYROX PRO DOUBLES - Overall,Men,76,24,"Matthieu Scholten, Matthijs Groenhuijzen",,25-29,00:59:27
2026 Amsterdam,HYROX PRO DOUBLES - Overall,Men,77,33,"Ruud Boom, Niek Boom",,30-34,00:59:32
2026 Amsterdam,HYROX PRO DOUBLES - Overall,Men,78,6,"Sem Zonderwijk, Joost Huisman",,16-24,00:59:35
2026 Amsterdam,HYROX PRO DOUBLES - Overall,Men,79,34,"Diogo Estevão, Afonso Fadigas",,30-34,00:59:37
2026 Amsterdam,HYROX PRO DOUBLES - Overall,Men,80,7,"Tim Decker, Marco Hilke",,35-39,00:59:37
2026 Amsterdam,HYROX PRO DOUBLES - Overall,Men,81,25,"Jay Johnson, Oli Leighton",,25-29,00:59:39
2026 Amsterdam,HYROX PRO DOUBLES - Overall,Men,82,7,"Buick Van Ruijven, Thijs Van Den Abbeele",,16-24,00:59:42
2026 Amsterdam,HYROX PRO DOUBLES - Overall,Men,83,2,"Marnix Kaspers, Gert-Jan Westerhout",,45-49,00:59:53
2026 Amsterdam,HYROX PRO DOUBLES - Overall,Men,84,35,"Frederik Miebach, Lukas Lewald",,30-34,00:59:56
2026 Amsterdam,HYROX PRO DOUBLES - Overall,Men,85,36,"Dan Briault, Jake Riley",,30-34,00:59:57
2026 Amsterdam,HYROX PRO DOUBLES - Overall,Men,86,37,"Rob Stigter, Roben Schenk",,30-34,00:59:58
2026 Amsterdam,HYROX PRO DOUBLES - Overall,Men,87,38,"Mattias Malchau, Daniel Stendahl",,30-34,01:00:03
2026 Amsterdam,HYROX PRO DOUBLES - Overall,Men,88,39,"Sander Bijnen, Bob Venneman",,30-34,01:00:08
2026 Amsterdam,HYROX PRO DOUBLES - Overall,Men,89,9,"Arnoud Jullens, Rory Van Rees",,40-44,01:00:13
2026 Amsterdam,HYROX PRO DOUBLES - Overall,Men,90,40,"Albert Vd Berge, Tom De Bruijn",,30-34,01:00:14
2026 Amsterdam,HYROX PRO DOUBLES - Overall,Men,91,41,"Daniel Serce, Marvin Grüttner",,30-34,01:00:16
2026 Amsterdam,HYROX PRO DOUBLES - Overall,Men,92,8,"Tijmen Sportel, Leon Eleveld",,16-24,01:00:23
2026 Amsterdam,HYROX PRO DOUBLES - Overall,Men,93,10,"Charles-Antoine Dubois, Clément Vuattier",,40-44,01:00:23
2026 Amsterdam,HYROX PRO DOUBLES - Overall,Men,94,8,"Tim Vicariesmann, Steffen Schieke",,35-39,01:00:26
2026 Amsterdam,HYROX PRO DOUBLES - Overall,Men,95,42,"Pascal Visser, Stijn Giesbers",,30-34,01:00:28
2026 Amsterdam,HYROX PRO DOUBLES - Overall,Men,96,11,"Maarten Nijboer, Sylvester Van De Bunt",,40-44,01:00:28
2026 Amsterdam,HYROX PRO DOUBLES - Overall,Men,97,9,"Rudy Fernane, Gil Van Lerberghe",,35-39,01:00:29
2026 Amsterdam,HYROX PRO DOUBLES - Overall,Men,98,10,"Geert Pel, Peter Van Eijk",,35-39,01:00:30
2026 Amsterdam,HYROX PRO DOUBLES - Overall,Men,99,11,"Bert Veenstra, Lucas Vente",,35-39,01:00:34
2026 Amsterdam,HYROX PRO DOUBLES - Overall,Men,100,26,"Jesse Ruiter, Casper Laan",,25-29,01:00:42
2026 Amsterdam,HYROX PRO DOUBLES - Overall,Men,101,27,"Hugo Landré, Maxime Dernesch",,25-29,01:00:47
2026 Amsterdam,HYROX PRO DOUBLES - Overall,Men,102,43,"Luiz Plein, Jonne Van Der Poel",,30-34,01:00:48
2026 Amsterdam,HYROX PRO DOUBLES - Overall,Men,103,44,"Nicholas Pinfold, Toby Symington",,30-34,01:00:53
2026 Amsterdam,HYROX PRO DOUBLES - Overall,Men,104,28,"Mitchel Eijgenraam, Jordy Van Hout",,25-29,01:00:59
2026 Amsterdam,HYROX PRO DOUBLES - Overall,Men,105,3,"David Sloan, Dean Wilson",,45-49,01:01:03
2026 Amsterdam,HYROX PRO DOUBLES - Overall,Men,106,12,"Martijn Schohaus, Niels Mulder",,40-44,01:01:07
2026 Amsterdam,HYROX PRO DOUBLES - Overall,Men,107,45,"Ben Van Egmond, Sebastian Schoenmaker",,30-34,01:01:09
2026 Amsterdam,HYROX PRO DOUBLES - Overall,Men,108,46,"Gabriel Meijer, Joshua Meijer",,30-34,01:01:09
2026 Amsterdam,HYROX PRO DOUBLES - Overall,Men,109,47,"Farid Gamei, Tomash Marko",,30-34,01:01:12
2026 Amsterdam,HYROX PRO DOUBLES - Overall,Men,110,9,"Willem Ballet, Charles Angelis",,16-24,01:01:12
2026 Amsterdam,HYROX PRO DOUBLES - Overall,Men,111,12,"Gjemajl Abazi, Marcello Asta",,35-39,01:01:19
2026 Amsterdam,HYROX PRO DOUBLES - Overall,Men,112,13,"Kevin De Pauw, Bert Pluym",,35-39,01:01:21
2026 Amsterdam,HYROX PRO DOUBLES - Overall,Men,113,29,"Njord Visser, Dirjan Bouma",,25-29,01:01:22
2026 Amsterdam,HYROX PRO DOUBLES - Overall,Men,114,30,"Geronimo Torenstra, Kevin Philipsen",,25-29,01:01:22
2026 Amsterdam,HYROX PRO DOUBLES - Overall,Men,115,10,"Per Nieuwenhuis, Cedric Guilonard",,16-24,01:01:25
2026 Amsterdam,HYROX PRO DOUBLES - Overall,Men,116,11,"Eljan Van Soeren, Wouter Van Soeren",,16-24,01:01:32
2026 Amsterdam,HYROX PRO DOUBLES - Overall,Men,117,14,"Marouin Abaied, Kevin Lesigne",,35-39,01:01:39
2026 Amsterdam,HYROX PRO DOUBLES - Overall,Men,118,15,"Dino Linden, Michiel Brankaert",,35-39,01:01:40
2026 Amsterdam,HYROX PRO DOUBLES - Overall,Men,119,16,"Raphael Jean, Stéphane Chiesa",,35-39,01:01:40
2026 Amsterdam,HYROX PRO DOUBLES - Overall,Men,120,12,"David Boyle, Ryan Barrett",,16-24,01:01:41
2026 Amsterdam,HYROX PRO DOUBLES - Overall,Men,121,48,"Patrick Rutterkamp, Sven Eggermont",,30-34,01:01:41
2026 Amsterdam,HYROX PRO DOUBLES - Overall,Men,122,49,"Lilinho Da Silva Martins, Lulinho Da Silva martins",,30-34,01:01:43
2026 Amsterdam,HYROX PRO DOUBLES - Overall,Men,123,1,"Michel Opdam, Richard Proost",,50-54,01:01:43
2026 Amsterdam,HYROX PRO DOUBLES - Overall,Men,124,50,"Javier Pardo Murcia, Justin Alexandre",,30-34,01:01:45
2026 Amsterdam,HYROX PRO DOUBLES - Overall,Men,125,13,"Twan Poppeliers, Tristan Philippa",,16-24,01:01:47
2026 Amsterdam,HYROX PRO DOUBLES - Overall,Men,126,14,"Thibaut Montay, Melvin Nidaud",,16-24,01:01:49
2026 Amsterdam,HYROX PRO DOUBLES - Overall,Men,127,51,"Olivier Ajamlou, Thijs Vlak",,30-34,01:01:50
2026 Amsterdam,HYROX PRO DOUBLES - Overall,Men,128,31,"Ruben Van De Plas, Denny Layik",,25-29,01:01:50
2026 Amsterdam,HYROX PRO DOUBLES - Overall,Men,129,52,"Andrey Kalinin, Evgeny Kalinin",,30-34,01:01:57
2026 Amsterdam,HYROX PRO DOUBLES - Overall,Men,130,15,"Alec Rijks, Zach Taylor",,16-24,01:02:02
2026 Amsterdam,HYROX PRO DOUBLES - Overall,Men,131,16,"Samuel Augusto, Tim Schudde",,16-24,01:02:10
2026 Amsterdam,HYROX PRO DOUBLES - Overall,Men,132,53,"Shane Skinner, Andy Rolstone",,30-34,01:02:20
2026 Amsterdam,HYROX PRO DOUBLES - Overall,Men,133,17,"Jeremy Martin, Roeland Reijse",,35-39,01:02:28
2026 Amsterdam,HYROX PRO DOUBLES - Overall,Men,134,2,"Darren Shearer, Nigel Levett",,50-54,01:02:28
2026 Amsterdam,HYROX PRO DOUBLES - Overall,Men,135,54,"Miel Bakker, Kars Bakker",,30-34,01:02:32
2026 Amsterdam,HYROX PRO DOUBLES - Overall,Men,136,32,"Simon Kocourek, Andrei Ces",,25-29,01:02:34
2026 Amsterdam,HYROX PRO DOUBLES - Overall,Men,137,18,"Ramon Stol, Joey Stol",,35-39,01:02:35
2026 Amsterdam,HYROX PRO DOUBLES - Overall,Men,138,55,"Marnick Kok, Daan Van Dortmont",,30-34,01:02:39
2026 Amsterdam,HYROX PRO DOUBLES - Overall,Men,139,56,"Jelle Boonekamp, Dirk Driessen",,30-34,01:02:42
2026 Amsterdam,HYROX PRO DOUBLES - Overall,Men,140,19,"Rick Glorie, Erwin Van Dijk",,35-39,01:02:44
2026 Amsterdam,HYROX PRO DOUBLES - Overall,Men,141,57,"Nicolas Van Bockstaele, Zakaria Mahria",,30-34,01:02:47
2026 Amsterdam,HYROX PRO DOUBLES - Overall,Men,142,13,"Declan Mccabe, Gavin Kenny",,40-44,01:02:51
2026 Amsterdam,HYROX PRO DOUBLES - Overall,Men,143,20,"Ross Wilhelmsen, Ioannis Papadopoulous",,35-39,01:02:51
2026 Amsterdam,HYROX PRO DOUBLES - Overall,Men,144,14,"Roeland Weve, Ewout Weve",,40-44,01:02:52
2026 Amsterdam,HYROX PRO DOUBLES - Overall,Men,145,33,"Reno Van Aalst, Pepijn Verzellenberg",,25-29,01:02:52
2026 Amsterdam,HYROX PRO DOUBLES - Overall,Men,146,58,"Rob Vincenten, Jesse Van Bezooijen",,30-34,01:02:53
2026 Amsterdam,HYROX PRO DOUBLES - Overall,Men,147,34,"Josh Whitney, Dillon Tomlinson",,25-29,01:02:54
2026 Amsterdam,HYROX PRO DOUBLES - Overall,Men,148,15,"Noud Schoenmakers, Pepijn Van Straelen",,40-44,01:02:54
2026 Amsterdam,HYROX PRO DOUBLES - Overall,Men,149,59,"Marck Van Baal, Ton Matton",,30-34,01:02:55
2026 Amsterdam,HYROX PRO DOUBLES - Overall,Men,150,4,"Stuart Cockram, Ron Smith",,45-49,01:02:56
2026 Amsterdam,HYROX PRO DOUBLES - Overall,Men,151,60,"Skip Saegaert, Edwin Stok",,30-34,01:02:58
2026 Amsterdam,HYROX PRO DOUBLES - Overall,Men,152,3,"Koen Daelewyn, Ronny Hofenboom",,50-54,01:03:02
2026 Amsterdam,HYROX PRO DOUBLES - Overall,Men,153,21,"Daniël Visser, Ivan Berrevoets",,35-39,01:03:10
2026 Amsterdam,HYROX PRO DOUBLES - Overall,Men,154,22,"Sonny Bouwhuis, Ricardo Haverschmidt",,35-39,01:03:14
2026 Amsterdam,HYROX PRO DOUBLES - Overall,Men,155,17,"Dinand Brouwer, Noël Schoenmaker",,16-24,01:03:17
2026 Amsterdam,HYROX PRO DOUBLES - Overall,Men,156,35,"Mudalib Osman, Danny Gerardo Strunk",,25-29,01:03:20
2026 Amsterdam,HYROX PRO DOUBLES - Overall,Men,157,5,"Joris Lansdaal, Tijs Groot",,45-49,01:03:21
2026 Amsterdam,HYROX PRO DOUBLES - Overall,Men,158,36,"Devin Sluijs, Bobby Zundorf",,25-29,01:03:23
2026 Amsterdam,HYROX PRO DOUBLES - Overall,Men,159,6,"Rory Woods, Sean Mccabe",,45-49,01:03:31
2026 Amsterdam,HYROX PRO DOUBLES - Overall,Men,160,23,"Nicolas Colson, Filipe Pereira Cruz",,35-39,01:03:36
2026 Amsterdam,HYROX PRO DOUBLES - Overall,Men,161,18,"Jim Van Aken, Twan Van Tunen",,16-24,01:03:41
2026 Amsterdam,HYROX PRO DOUBLES - Overall,Men,162,24,"Jonas Thoben, Andrej Benner",,35-39,01:03:43
2026 Amsterdam,HYROX PRO DOUBLES - Overall,Men,163,16,"Thomas Lecieux, Ludovic Rodrigues Baeta",,40-44,01:03:47
2026 Amsterdam,HYROX PRO DOUBLES - Overall,Men,164,61,"Ewen Da Silva, Etienne Bayard",,30-34,01:03:50
2026 Amsterdam,HYROX PRO DOUBLES - Overall,Men,165,4,"Thom Rutten, Patrick Lerou",,50-54,01:03:52
2026 Amsterdam,HYROX PRO DOUBLES - Overall,Men,166,25,"Geert Jan Van Benthem, Daniel Horst",,35-39,01:03:55
2026 Amsterdam,HYROX PRO DOUBLES - Overall,Men,167,62,"Sam Hendrickx, Bob Van Den Enden",,30-34,01:03:58
2026 Amsterdam,HYROX PRO DOUBLES - Overall,Men,168,63,"Sander Kerbusch, Max Niessen",,30-34,01:03:59
2026 Amsterdam,HYROX PRO DOUBLES - Overall,Men,169,26,"Anno Van Der Kooi, Michiel Wajer",,35-39,01:03:59
2026 Amsterdam,HYROX PRO DOUBLES - Overall,Men,170,17,"Mike Stolworthy, Robert Harrison",,40-44,01:04:03
2026 Amsterdam,HYROX PRO DOUBLES - Overall,Men,171,37,"Teun Mooldijk, Silvan van Horssen",,25-29,01:04:05
2026 Amsterdam,HYROX PRO DOUBLES - Overall,Men,172,64,"Bram Leenen, Robin Jonis",,30-34,01:04:05
2026 Amsterdam,HYROX PRO DOUBLES - Overall,Men,173,7,"Ruud van Oudenallen, Tom Renhungan",,45-49,01:04:05
2026 Amsterdam,HYROX PRO DOUBLES - Overall,Men,174,27,"Marco Möhring, Jan Belov",,35-39,01:04:07
2026 Amsterdam,HYROX PRO DOUBLES - Overall,Men,175,28,"Sebastiaan Leurs, Tim Broekhoven",,35-39,01:04:08
2026 Amsterdam,HYROX PRO DOUBLES - Overall,Men,176,29,"Pieter Meiboom, Benny Van Schaijk",,35-39,01:04:09
2026 Amsterdam,HYROX PRO DOUBLES - Overall,Men,177,30,"Sander Kalkman, Jan-Willem Kalkman",,35-39,01:04:10
2026 Amsterdam,HYROX PRO DOUBLES - Overall,Men,178,31,"Robbert-Jan Vasse, Bjorn Van Veggel",,35-39,01:04:11
2026 Amsterdam,HYROX PRO DOUBLES - Overall,Men,179,65,"Jorden Van Driel, Sander Fischer",,30-34,01:04:12
2026 Amsterdam,HYROX PRO DOUBLES - Overall,Men,180,38,"Jelte Veldkamp, Stan Koobs",,25-29,01:04:12
2026 Amsterdam,HYROX PRO DOUBLES - Overall,Men,181,32,"bram Slagter, eric steller",,35-39,01:04:22
2026 Amsterdam,HYROX PRO DOUBLES - Overall,Men,182,66,"Tobias Bruder, Fabian Sorgen",,30-34,01:04:24
2026 Amsterdam,HYROX PRO DOUBLES - Overall,Men,183,33,"Hylke Riemersma, Jason Loby",,35-39,01:04:26
2026 Amsterdam,HYROX PRO DOUBLES - Overall,Men,184,67,"Leonard Perrin, Charly Vejtzik",,30-34,01:04:27
2026 Amsterdam,HYROX PRO DOUBLES - Overall,Men,185,8,"Sammy Edwards, Spencer Stent",,45-49,01:04:29
2026 Amsterdam,HYROX PRO DOUBLES - Overall,Men,186,39,"Matthew Byrne, Stephen Conboy",,25-29,01:04:29
2026 Amsterdam,HYROX PRO DOUBLES - Overall,Men,187,68,"Nick Frese, Michael Millarson",,30-34,01:04:33
2026 Amsterdam,HYROX PRO DOUBLES - Overall,Men,188,40,"Jim van Westerlaak, Remco Out",,25-29,01:04:40
2026 Amsterdam,HYROX PRO DOUBLES - Overall,Men,189,69,"Pascal Michels, Patrick Rondorf",,30-34,01:04:43
2026 Amsterdam,HYROX PRO DOUBLES - Overall,Men,190,41,"Max Bickmeier, Andreas Mikeli",,25-29,01:04:48
2026 Amsterdam,HYROX PRO DOUBLES - Overall,Men,191,70,"Sjaak Hoogstraaten, Jurre Kok",,30-34,01:04:50
2026 Amsterdam,HYROX PRO DOUBLES - Overall,Men,192,42,"Jeremy Martin, Jari Kroon",,25-29,01:04:51
2026 Amsterdam,HYROX PRO DOUBLES - Overall,Men,193,34,"Mike Burtombois, Kevin Gonzalez",,35-39,01:04:58
2026 Amsterdam,HYROX PRO DOUBLES - Overall,Men,194,71,"Andres Perez Perez, Miguel De Abreu",,30-34,01:04:59
2026 Amsterdam,HYROX PRO DOUBLES - Overall,Men,195,43,"František Sinko, Tarik Gharbaoui",,25-29,01:05:01
2026 Amsterdam,HYROX PRO DOUBLES - Overall,Men,196,19,"Theron Farro, Kurtis Quant",,16-24,01:05:02
2026 Amsterdam,HYROX PRO DOUBLES - Overall,Men,197,35,"Julian Waschkau, Fabian Urban",,35-39,01:05:03
2026 Amsterdam,HYROX PRO DOUBLES - Overall,Men,198,44,"Milan Van Schaijik, Bas Hoogakker",,25-29,01:05:05
2026 Amsterdam,HYROX PRO DOUBLES - Overall,Men,199,36,"Joppe Kant, Tim Slingerland",,35-39,01:05:06
2026 Amsterdam,HYROX PRO DOUBLES - Overall,Men,200,37,"Sam Vieillard, Jeroen Meinders",,35-39,01:05:08
2026 Amsterdam,HYROX PRO DOUBLES - Overall,Men,201,72,"Eduard Gebel, Petru Brataniuc",,30-34,01:05:10
2026 Amsterdam,HYROX PRO DOUBLES - Overall,Men,202,73,"Maxim Wijngaards, Nip Van Wees",,30-34,01:05:10
2026 Amsterdam,HYROX PRO DOUBLES - Overall,Men,203,74,"Renaud Jean, Kevin Missault",,30-34,01:05:10
2026 Amsterdam,HYROX PRO DOUBLES - Overall,Men,204,20,"Jasper Moons, David Van Leeuwen",,16-24,01:05:13
2026 Amsterdam,HYROX PRO DOUBLES - Overall,Men,205,75,"Rick Harmsen, Jan Willem Van Kleef",,30-34,01:05:15
2026 Amsterdam,HYROX PRO DOUBLES - Overall,Men,206,38,"Armin Rasidovic, Tim Van Bochove",,35-39,01:05:17
2026 Amsterdam,HYROX PRO DOUBLES - Overall,Men,207,76,"Dex Van De Lest, Stef Gramser",,30-34,01:05:22
2026 Amsterdam,HYROX PRO DOUBLES - Overall,Men,208,18,"Oliver Bruns, David Fischer",,40-44,01:05:25
2026 Amsterdam,HYROX PRO DOUBLES - Overall,Men,209,45,"Joep Van Venrooij, Damian Forster",,25-29,01:05:28
2026 Amsterdam,HYROX PRO DOUBLES - Overall,Men,210,46,"Marvin Moser, Leon Valentin Von Lipinski",,25-29,01:05:32
2026 Amsterdam,HYROX PRO DOUBLES - Overall,Men,211,19,"Lewienus Welboren, Roy De Ruyter",,40-44,01:05:32
2026 Amsterdam,HYROX PRO DOUBLES - Overall,Men,212,77,"Samory Soubes, Teddy Jarron",,30-34,01:05:34
2026 Amsterdam,HYROX PRO DOUBLES - Overall,Men,213,20,"Michiel Rulkens, Jan Beumers",,40-44,01:05:44
2026 Amsterdam,HYROX PRO DOUBLES - Overall,Men,214,78,"Killian Hanssens, Ludovic Hanssens",,30-34,01:05:48
2026 Amsterdam,HYROX PRO DOUBLES - Overall,Men,215,79,"Mikey Moller, David Ajayi",,30-34,01:05:48
2026 Amsterdam,HYROX PRO DOUBLES - Overall,Men,216,80,"Joep Christiaanse, Casper Christiaanse",,30-34,01:05:50
2026 Amsterdam,HYROX PRO DOUBLES - Overall,Men,217,21,"Remco Gronsveld, Enriquo Seliers",,40-44,01:05:51
2026 Amsterdam,HYROX PRO DOUBLES - Overall,Men,218,47,"Jay Van Leeuwen, Jeremy Van Loenen",,25-29,01:05:52
2026 Amsterdam,HYROX PRO DOUBLES - Overall,Men,219,39,"Mark Trewren, Julian Vella",,35-39,01:05:57
2026 Amsterdam,HYROX PRO DOUBLES - Overall,Men,220,40,"Ismaël Sow, Laurent Monbrun",,35-39,01:05:59
2026 Amsterdam,HYROX PRO DOUBLES - Overall,Men,221,48,"Mitchell Ronde, Samuel Kingsley",,25-29,01:06:00
2026 Amsterdam,HYROX PRO DOUBLES - Overall,Men,222,81,"Justinus Puls, Dave De Wit",,30-34,01:06:01
2026 Amsterdam,HYROX PRO DOUBLES - Overall,Men,223,49,"Filip Sidó, Tomáš Nehasil",,25-29,01:06:02
2026 Amsterdam,HYROX PRO DOUBLES - Overall,Men,224,82,"Sebastiaan Crul, Rik Keeris",,30-34,01:06:02
2026 Amsterdam,HYROX PRO DOUBLES - Overall,Men,225,50,"Swen Wichertjes, Wouter De Jong",,25-29,01:06:07
2026 Amsterdam,HYROX PRO DOUBLES - Overall,Men,226,51,"Christopher Mc Enery, Tadhg Fitzgerald",,25-29,01:06:15
2026 Amsterdam,HYROX PRO DOUBLES - Overall,Men,227,52,"Andrea Berardesca, Daniel Nunez",,25-29,01:06:17
2026 Amsterdam,HYROX PRO DOUBLES - Overall,Men,228,21,"Stephan Karreman, Daan Jongejan",,16-24,01:06:17
2026 Amsterdam,HYROX PRO DOUBLES - Overall,Men,229,22,"Remco Groeneveld, Ronald Boer",,40-44,01:06:17
2026 Amsterdam,HYROX PRO DOUBLES - Overall,Men,230,23,"Tony Barry, James Doran",,40-44,01:06:19
2026 Amsterdam,HYROX PRO DOUBLES - Overall,Men,231,41,"Richard De Groot Ultee, Louk Van Looveren",,35-39,01:06:23
2026 Amsterdam,HYROX PRO DOUBLES - Overall,Men,232,42,"Roy Van Lierop, Kevin Van Schie",,35-39,01:06:24
2026 Amsterdam,HYROX PRO DOUBLES - Overall,Men,233,53,"Mathias Devillé, Otis Subhan",,25-29,01:06:25
2026 Amsterdam,HYROX PRO DOUBLES - Overall,Men,234,83,"Tim Leliveld, Cas Van Duijnhoven",,30-34,01:06:26
2026 Amsterdam,HYROX PRO DOUBLES - Overall,Men,235,84,"Mick Zuurman, Sven Bootsman",,30-34,01:06:30
2026 Amsterdam,HYROX PRO DOUBLES - Overall,Men,236,22,"Yorick Bouwmeester, Rowdy Bouwmeester",,16-24,01:06:32
2026 Amsterdam,HYROX PRO DOUBLES - Overall,Men,237,54,"Armand Bouchain, Nathan Chupa",,25-29,01:06:33
2026 Amsterdam,HYROX PRO DOUBLES - Overall,Men,238,43,"Arjan Onstwedder, Tomas Elbersen",,35-39,01:06:46
2026 Amsterdam,HYROX PRO DOUBLES - Overall,Men,239,44,"Frank Greuter, Tjeerd Greuter",,35-39,01:06:52
2026 Amsterdam,HYROX PRO DOUBLES - Overall,Men,240,23,"Luca Zingstra, Sander Meijer",,16-24,01:06:57
2026 Amsterdam,HYROX PRO DOUBLES - Overall,Men,241,85,"Ted De Feiter, Wouter Dronkers",,30-34,01:06:59
2026 Amsterdam,HYROX PRO DOUBLES - Overall,Men,242,86,"Jannik Bartsch, Marc Böhnke",,30-34,01:07:00
2026 Amsterdam,HYROX PRO DOUBLES - Overall,Men,243,24,"Bowen Kruisselbrink, Luuk Morskieft",,16-24,01:07:02
2026 Amsterdam,HYROX PRO DOUBLES - Overall,Men,244,87,"Pepijn Versteeg, Ruben Versteeg",,30-34,01:07:04
2026 Amsterdam,HYROX PRO DOUBLES - Overall,Men,245,45,"Laurens Boer, Robert Molendijk",,35-39,01:07:06
2026 Amsterdam,HYROX PRO DOUBLES - Overall,Men,246,5,"Kees Hagen, Hugo Pijloo",,50-54,01:07:07
2026 Amsterdam,HYROX PRO DOUBLES - Overall,Men,247,25,"Jorden Stoevenbeld, Jesse Knook",,16-24,01:07:10
2026 Amsterdam,HYROX PRO DOUBLES - Overall,Men,248,46,"Peter Schwering, Stephan Oost Lievense",,35-39,01:07:11
2026 Amsterdam,HYROX PRO DOUBLES - Overall,Men,249,47,"Djavan Romney, Boris Senator",,35-39,01:07:13
2026 Amsterdam,HYROX PRO DOUBLES - Overall,Men,250,55,"Simon Wils, Olivier Kok",,25-29,01:07:13
2026 Amsterdam,HYROX PRO DOUBLES - Overall,Men,251,48,"Rob Van Osch, Stefan Halfers",,35-39,01:07:15
2026 Amsterdam,HYROX PRO DOUBLES - Overall,Men,252,49,"Bram Smallenbroek, Epke Zonderland",,35-39,01:07:15
2026 Amsterdam,HYROX PRO DOUBLES - Overall,Men,253,88,"Oliver Buchta, Eric Sabe",,30-34,01:07:17
